Condition,Rating,Review
Migraine Prevention,5.0,"""I'm 19 and have been suffering from migraines for the past couple years. I've been taking Topamax for 6 months now, went from 25 to 75 mg daily now, and have noticed some reduced frequency in my migraines. I'm also pretty thin to begin with and can't afford to lose any more weight. I've lost 15lbs already and noticed the 2 days I ran out of the medicines. I actually felt hungry and ate. I think it's time to consider some other options."""
Migraine Prevention,5.0,"""I'm still new to this medicine but i'm still on it. I'm still in high school so I get migraines due to stress a lot. Every morning I'm starting to wake up super early ready to go and super hyper. So hyper that i'm shaking like crazy to the point it looks like i have a tremor. I'm more outgoing on this medication. I am losing little bit of my hair but i'm okay with it. at least i don't have migraines."""
Migraine Prevention,5.0,"""I've been taking Topamax for about 2 years now, 100 mg a day. I have severe chronic migraines due to my spinal cord. So my doctor put me on this medication.  The only side effect I've had was the tingling but I get that anyways even before this medication so who knows if it was a side effect. But it works ok for me when I take it regularly but I also have focal seizures so this medication is for both of my problems. But I always take it with my hydrocodone so my migraines are fine."""
,5.0,"""This medication DID eventually help with the migraines BUT I started losing cognitive skills.  I lost my ability to process thoughts, complete sentences, was even being lost in the place I lived for 35 years.  I was very scared.  My mind was clouded all the time.  The Doctor thought I was possibly having a break down due to stress. At his same time I had been battling continual Urinary Tract Infections.  The Doctor immediately took me off of this drug and everything is coming back to normal!  I was told this is a VERY common side effect and eventually I would probably have had kidney stones also.  """
Migraine Prevention,5.0,"""I've been using Topamax for about a year now and have not really seen a difference in my pain threshold. I get very shaky when I take a dosage and still experience migraines."""
Obesity,5.0,"""I am on a two week trial. I have been on the medication for 5 days.  I have noticed that soda taste disgusting. Which is a good thing for me. I don't feel or look as bloated. I have not lost any weight as of yet. I hope that comes soon. I do notice that I am more thirsty and not as hungry. I try to eat at least three times a day so that I don't ""binge"". I have noticed that I am more constipated than normal even with drinking more water. I hope to see weight loss soon. I have been ""obese"" for some time and very unhappy with myself. This puts a huge wedge into my married life. I also would love to loose weight to take the pressure off my knee, my back, and to reduce my asthma some. I hope this medicine is the key to a new life for me."""
Migraine Prevention,5.0,"""I've been taking this medication for a little under two weeks. To give you a background, I'll be 20 in a week, and have had migraines with auras since I was about 10. I've had numerous prescription meds, from injections to triptans to hydrocodone, etc, I think topomax makes #13? Anyways, over the last year my migraines have increased in frequency, I'm guessing because of the stress of college, but I get them every week, about twice a week, one right after another( triptans for me usually trigger another migraine) I've been dreading starting this medication, but finally decided to give it ago, as I'm on winter break and quite frankly this is all I have left to try. Literally half of my life has been consumed by this. Right now my right foot is tingling, and my chest hurts, I'm rather dizzy and have been forgetting things all week. I've felt super anxious and down all week, but I haven't had a migraine in 20 days. Sprite tastes flat but I don't really drink soda apart from that so I don't mind, so far this is bearable. I noticed when I went up to 50mg the side effects increased so I'm worried about when I inc to 75 and 100mg, but we shall see. :)"""
Migraine Prevention,5.0,"""It worked, but the side effects were terrible, lasting and possibly permanent. The worst of the side effects I experienced were lack of taste and short-term memory loss. Over two years after taking this medication, I have still having issues with my short-term memory."""
Fibromyalgia,5.0,"""I've been on it all! Cymbalta, toparite, Lyrica and Nexium. Also, Inderal.  Still am for that matter! Fibro kicks butt and I don't know which one works and which one doesn't at this point.  I do know I am losing my hair and my nails are peeling off!  If anyone has any suggestion as to which drug might be doing this please help!  I can't find this as a reaction to any of them."""
Migraine Prevention,5.0,"""I just started taking Topamax. So far it's not too bad. The headaches are getting a little better and the side effects aren't bad. The only thing I'm having trouble with is differentiating between dreams and reality. my dreams seem so real, like it happened. I hope it gets better with time."""
Migraine Prevention,5.0,"""Trouble concentrating and some memory problems"""
Migraine Prevention,5.0,"""I was placed on Topamax (aka Topiramate) several years ago for Migraines. For the most part (during that time), it seems to have worked with minimal adverse effects like slight tingling. In late 2016 while I was asleep, I experienced the most awful leg pain (as if my thigh muscle did a flip flop or wanted to rip out of my leg).  After various conversative methods which included Vitamin D 5000mg, it was suggested that I cease the Topiramate as a process of eliminating things. It has been 5 days since being off of the medication and the numbness/tingling in that single quadrant of my thigh went away. 

Now, I have migraine headaches that are coming back."""
Bulimia,4.0,"""As I type this it is hard to relay it understandably because of the Topamax. I researched Topamax and heard it suppressed eating and stabilized mood which I figured would helped my bulimia, which I have been getting help for and am in recovery for. The Topamax definitely suppresses the desire to eat and have cravings which is great. You do lose weight. However, it created other problems. I didn't realize it but I was increasingly having a harder time talking to people. I can't do homework, write papers, and my relationship with my boyfriend- we ended breaking up. My hair falls out. I had bad anxiety, I thought I was going insane. I then researched side effects of Topamax and now realized this is what I am experiencing. I'm getting off."""
Bipolar Disorder,4.0,"""I took Topamax for 12 years as a mood stabilizer for Bipolar 1 disorder. It is a GREAT mood stabilizer and I used to be quite heavy and I lost 100 pounds in around 6 months (yes you read that right!). The bad part was HORRIBLE side effects. Constant itching in the summer. I developed a 9mm kidney stone when I had no prior history. I developed a blood disorder (something acidosis, was told this was a rare side effect, but that was why I stopped taking it. However, if I could go back in time would I still take it? You bet! One of the best mood stabilizers I've ever been on. Just make sure you EAT when taking it, it makes you not want to eat."""
Bipolar Disorder,4.0,"""I started taking this medicine several weeks ago with a combination of Celexa for my depression. The side effects are unwelcome and welcome all in the same time. I have memory loss and can't find the the right words when I'm speaking to people. I feel tired during the day, but at night I'm wide awake. My nails have become thinner, so has my waist line. I've struggled with my weight since I was young, [I'm 17 and I started these pills at 260lbs. I'm now at 231lbs]. These pills make me feel like food is the enemy. I'm also having decreased sensitivity during sex."""
Trigeminal Neuralgia,4.0,"""I only took Topamax for a short time, but the side effects were so bad I had to stop. Primarily, it made me feel goofy. I was in a cloud and had trouble remembering how to get places I went to frequently. I lost the ability to taste bubbles in beverages, and beer or soda without carbonation just wasn't the same. In short, the nickname ""dopamax"" seemed well earned to me."""
Migraine Prevention,4.0,"""I took this medicine off and on for years. And I can honestly say it has helped my migraines tremendously. I suffer from migraines with the aura, and while off Topamax  they come in weekly clusters. About once every couple of months I will have a week from hell. On Topamax I have one attack every couple of months. BUT, the side effects are unbearable."""
Obesity,4.0,"""I've been on this medicine almost a month. In the beginning the side effects were absolutely horrible! I couldn't sleep at night and I could barely hold my head up during the day. My head was foggy and I had trouble finding the words I needed sometimes. I felt like I had the Flu without the runny/stuffy nose. It also causes constipation. I had read several reviews and saw a couple comments about how the side effects would die down after a few weeks. I was determined to push through Now my head isn't  as foggy. I'm no where near as tired during the day. I take one melatonin gummy at night just to be sure I get a good nights rest. The constipation hasn't went away but I am only eating half of what I was."""
Migraine Prevention,4.0,"""I was only on this medicine for a week and had a horrible experience. I switched from amitriptyline to topamax for my migraines due to the previous medicine not doing it's job as well. Within the week of taking the new medicine I became completely unable to sleep at night, upset stomach 24/7 and an a horrible level of unquenchable thirst. The no sleep was the worst part; I'm usually a pretty great sleeper, so going from 7-8 hours of sleep a night to maybe 3-4 hours a night was rough on my physical and emotional self. I was advised to stop the medicine tonight by my doctor and cannot wait to return to myself. I even still had migraines while on this medicine. Would not recommend."""
Bipolar Disorder,4.0,"""I started noticing the weight loss end of January. I weighed at 235 and was down to 220 in a month without trying to diet! Or excise. I was taking 100mg then up to 200, and now 300. I weigh 209 to this date. 26 pounds in 56 days. my mind is foggy, I feel like a zombie, some days I can clean for 5  hours, I have migraines when I've never had them before in my life, my knees are in pain, throat hurts, numb feeling over all my body. Doctors screw you over so be careful. I'm on a vegan diet for the past 5 days will update after another few months to see more of the symptoms and weightloss :)"""
Migraine Prevention,4.0,"""Caused weight loss as well as major hair loss. I lost four inches or more in hair over a year period."""
Migraine Prevention,4.0,"""I was on topamax for a month and lost 6lbs. I could handle the tingling in my hands and feet but I stopped taking it because my period never stopped!  It started the day after my first dose and ended three days after I stopped taking topamax. I do have the birth control Implanon implanted in my arm. So maybe those drugs combined doesn't work well. I still had migraines but they weren't intense."""
Migraine Prevention,4.0,"""I've been on Topamax for about 5 months now (100 am/100 pm) and finally giving up faith. The negative side effects outweigh the slight change in my migraines. Carbonated beverages taste terrible, I have to force myself to eat, I stutter constantly, I can never find the right words and often switch up words in a sentence. My memory is horrid, and I always see tracers, which is enough to drive anyone crazy. The only pluses are the slight decrease in consistency of my migraines and the weight loss."""
Migraine Prevention,4.0,"""I took this medication for nearly two months before seeking a second opinion about my hormonal migraines.  I was only having 1-2 migraines a month; however they would last 4-5 days at a time.  When the pain medications didn't help, my doctor started me on Topamax.  I do a great deal of technical writing and crisis management in my job, and my migraines really got in the way.  I was able to deal with the weight loss and taste changes, but the difficulty in concentrating became a serious issue. When I started losing hair, that was the last straw.  If my migraines became worse I may return to Topamax though."""
Borderline Personality Disorder,4.0,"""Personally this drug helped my mood swings greatly, however I was quite disturbed that it agitated my diet as much as it did. I have a co-morbid eating disorder which was agitated by the med. The Topirimate made it so I HAD to eat my food a very specific way. Something soft, yet crunchy at the same time. Normally I wouldnt complain, however it was always on my mind.I think the hardest thing about the med was the appetite suppression for me. I was down to eating one meal a day, which ultimately let to me not loosing any weight which I can say was very difficult for me. I had increased irritability, and I felt overly fatigued. I am also on Citalopram, which is a terrible combination if you're prone to fatigue."""
Migraine Prevention,4.0,"""I've been on topiramate for about 9 months and I've had really weird side-effects. I have the usual tingling, numbness, and weight-loss/loss of appetite that most everyone seems to have, but I've also gotten really bad heartburn. It gets to the point where it feels like I'm gonna throw up, and an episode might last anywhere from 2 hours to the whole day. It's not when I eat certain foods either. I also still get really horrible migraines, just not as often. I can't go on imitrex anymore because I have ""complex"" migraines, but sometimes no medicine helps. Does anyone else have these problems too?"""
Migraine Prevention,4.0,"""If I had to base my rating on migraine prevention alone I would have to rate it a 10. My migraines were pretty much none existent while on Topamax. HOWEVER, I had extreme side effects: taste change, extreme mood & behavior change, tingling fingers/toes/lips, dizziness, vomiting, and increased eye pressure. I had to be taken off of it and put on Elavil. Like I said, as far as the migraine prevention it was perfect but it came with a price that my doctor and I thought was not worth it."""
Bipolar Disorder,4.0,"""I was put on it plus Wellbutrin to stabilize my mood. For 3 months I was extremely nauseous, unable to eat a thing. I lost  - 12kg's. The side effects were tingling in my hands and feet, a feeling that my head was being pulled to one side, metallic taste, extreme brain fog, loss of vocab (I sounded like an idiot, I could hardly string a sentence together), attention span diminished and extreme muscle weakness. I became socially anxious/awkward and still am. I developed a strange curry-like smell to me. I stopped when I fell pregnant and put on 24kg's, still holding on to 9kg's. It seems to have ruined my metabolism. I loved the appetite suppression (why I stayed on it) but won't go back on it, the side effects are too severe. And expensive"""
Obesity,4.0,"""I haven't been on Topiramate very long, only a couple of months.  Started taking it for RLS (restless leg syndrome).  I was really surprised to see that it is sometimes used as a weight loss medicine. I didn't really notice any difference in my appetite.  However, my last visit to doctor did show that I've lost 5lbs.  I don't like the tingling, crawling skin sensation side effect.  That went away after a few days."""
Migraine Prevention,4.0,"""Been on this for just a week now at 25 mg also on 50 mg of amitriptalyne  of a night. The first few days I felt really spaced out, but sort of kept coming in waves through the day. I also suffer from m.e as well but have found the past few days I have had lots of energy. I don't feel tired at all. Supposed to up dose to 50 mgs on second week, but I'm thinking may stick to the 25 for a little while to see how things go. No migraines up to now.
Reading all the reviews most of the side effects seem to come when the dose is increased. Really worried about the hair loss business, don't think I could deal with that one . 
Think I'm going to give this a go for a few months and see how things go, it's all trial and error, or kill or cure."""
Migraine Prevention,4.0,"""i have been on topamax for a little over 6 years.  I started at 25 mg. and slowly went up to 250 mg.  I experienced the weight loss, tingling and the other minimal side effects at the lower dose but was encouraged to stay on the meds.  As i increased the dose, i started having hair loss, dizziness and ""white outs"" where i would not be able to see at all for up to 20-30 seconds at a time.  I also started having the memory  issues.  I started seeing a new neuro and we dropped me  down to 100 mg.  The hair loss stopped but I still get the vertigo.  I am now down to 50 mg.  I suffer from eye pain in my left eye and still the random dizziness- which is horrible.  Weaning off of this - I do Botox injections now for preventative with some relief"""
Migraine Prevention,4.0,"""I've been on Topamax for 2 weeks now after switching from Elavil. Now I'm seriously questioning that decision despite the problems Elavil caused me. The insomnia is outrageous. I have to set an alarm to take my morning dose at 5 a.m. so that my evening dose can be taken around 3 p.m. This way it's effects have kind have faded off by bedtime and with the help of some prescribed sleeping pills I'm lucky to get a tiny bit of sleep. Of course, along with that I have tingling, slight numbness (not enough to even complain about), dizziness, decreased appetite, taste aversion, and weight loss of course. I haven't had too many experiences with confusion yet. On a positive note, my migraines haven't returned."""
Seizure Prevention,4.0,"""This medicine was great in taking care of seizures but I honestly felt like I was crazy most of the time. I lost weight which I was happy with but when it comes to the final review, I was a crazy, small person. I couldn't even call an order in on the phone because I couldn't think fast enough, I went back to my doctor and ask him to take me off this."""
Migraine Prevention,4.0,"""Acute depression for the 1st 4 weeks on this medication, then it tappered off. Other side effects: upset stomach, tingling in fingers and toes - daily, altered taste. The good side was it reduced the intensity of the migraines, but did nothing for the frequency of them.  Getting off of it now, tying Keppra.  Have had migraines since I was 8 and they have progressed in intensity and frequency as I got older, now 60. I expected to grow out of them - who knows!"""
Migraine Prevention,4.0,"""I took topiramate for approx 3 months before I refused to continue with the therapy. The side effects (peripheral neuropathy, inability to remember anything, altered taste of just about everything, insomnia were not worth suffering through. So I'm still going through an adjustment. As of right now, I have been taking propranolol for a month and have not had a migraine (was getting 1-2 a week previously)."""
Obesity,4.0,"""Hi I have been taking these pills for 5 weeks now  for weight loss I do struggle . Specialist trying to see if it's my metabolism... I'm
On 25mg he has not mentioned anything about higher dose but I have not been able to sleep !!! It's driving me crazy now . Was wondering if any of you had the same experience? I do feel so tired and lethargic but it's so late before I get any sleep then I'm waking up mid afternoon missing my days I've tried getting up early going out walking etc like today still no luck . I suffer with mental
health  problems and was dubious about taking them at first but read a lot on your feedback that it's helped some people.I just hope this depression is through my sleep pattern and not the med ."""
Migraine Prevention,4.0,"""I am taking 25mg in morning. Working up to 100mg over few weeks going up 25mg every 2weeks, iv only been taking it 4days and tbh only thing I've noticed was first day felt rough but since I've felt the odd nausea no other side effects, maybe because I've been so busy haven't noticed them, I'm actually lookin  forward to upping dosage, I want to prevent migraines I dunno why I didn't go get help sooner I've suffered for years, but to me being overweight I'm also hoping itl help with the weightloss I've been struggling to lose for over 4yrs I'm fit and healthy and regular exercise and healthy eater yet can't shift so hoping this helps"""
Migraine Prevention,4.0,"""I was put on topamax for about 3 weeks for excruciating migraines that I would get just about daily. While it was pretty effective at decreasing my headaches (I only had about one or two in the three weeks I was on it), I experienced side effects from it. I was taken off it for a few days and then put back on to see if I still had the same problems.  A little bit of lip tingling but nothing major.  When I upped the dose like I was supposed to my gums started hurting so my doctor took me off it and put me on Depakote."""
Migraine Prevention,4.0,"""I've been on Topimax for going on 3 1/2 months now and met with my doctor twice telling her I absolutely could not be on this medication because I could not perform my job duties at work. I had a very difficult time comprehending very basic stuff. I was put on it for my headaches I've dealt with for near 2 decades. My dr took me off my medication I've been on for 18 years suddenly, which has worked for my heaches, and switched me to Topimax. I decided to push through because I was no longer getting my medication that worked for me and I kept being told that the brain fog would get better wich it has the past 2 weeks. New problem is my hair is falling out in clumps. Every day literal clumps of hair fall out in the shower."""
Seizure Prevention,3.0,"""Used it for a mth  and having the weirdest seizures ever"""
Migraine Prevention,3.0,"""The main issue I had with this is the side effects. It caused my hands and feet to tingle and feel numb for hours on end. It made me drowsy and extremely moody due to it. I'm not sure if it really worked because after two weeks I stopped taking Topamax because the side effects were so intense."""
Seizure Prevention,3.0,"""When I first started this medication it was OK ,I was never told this medicine cause memory loss. It's really bad, I can't remember at times if I took my medicine and places I have been going all my life I can't remember how to get there. Please be aware!!!"""
Migraine Prevention,3.0,"""I have not had good luck with this medicine. The side effects were horrible at first but they did settle down and mostly disappeared after 4 or 5 months on the medication. If you're just starting it, give it some time and the side effects will go away, but for me it never helped lessen or decrease my migraines so now my doc has given me Amitriptyline to try so I'm hoping I have better luck with this one!!"""
Migraine Prevention,3.0,"""Although it did work for reducing my migraines, I found that the side effects outweighed the treatment. I had almost all of the side effects mentioned: confusion, irritability, diarrhea, tingling hands and feet, vision changes, loss of appetite and weight, change in sex drive and worst of all hives. The people around me were glad I stopped taking it, as it made me act differently than I would normally."""
Migraine Prevention,3.0,"""I've tried every medicine you can offer someone in pediatrics so they are now trying me on adult meds. I've been on topiramate for 6 months nearly and its not been great for me. I'm currently doing my AS levels and although it has cuts my headaches/migraines down from 6-7 a week to 3-4 a week the side effects have been awful. I had been irritable and tired. I lost a fair bit of weight that I don't need to lose simply because I'm not hungry any more. I've been experiencing pins and needle in my hands and feet and am constantly cold, and I am dizzy and feel like passing out. And with exams coming up the memory problems and the problems with getting out my words isn't helping. At 17, suffering from migraines for coming up too 4 years I don't know what to do."""
Migraine Prevention,3.0,"""I don't really feel any side effects, but I have been experiencing brain fog, fatigue, & rare pins & needles that are painful. I wonder if this is the drug. I've been on it about 3 to 4 years. I do have Lupus, so I have been blaming it for the brain fog and fatigue. Now I'm not sure as I talked to my doc about this * he told me it could be the drug. He is taking me off of it because it's doing nothing for the migraines. I gave it a 3 more for the lack of help for the migraines versus the side effects, since I'm not sure if it's the drugs, the Lupus, or something else. I just felt it did nothing for me & is a waste of time and money. I hope by going off of it, I feel an improvement in those side effects. Wouldn't you know it, no weight loss!"""
Migraine Prevention,3.0,"""I began taking this drug at 25 mg and worked my way up to 200 mg a day, 100 mg in the morning and 100 mg at night. At first this drug was amazing but it had to be supplemented with sumatriptin in case it didn't fulltake stop the migraine. I didn't loose any weight, but what I did loose was the ability to remember sharp details that I would have been able to before, I would loose feeling in my feet, my legs, my handson, and my arms, and in the worst of it the dizziness got so severe that my vision blacked out. I would not recommend this drug to anyone. This drug may fix your migraines, but it will give you 1000 more problems."""
