Condition,Rating,Review
Fibromyalgia,8.0,"""Make sure to start with low dosage, or it will make you sick. Had less stiffness right away.  Still some pain, but nothing like before. Somehow, it helped reduce my asthma symptoms. First time I slept 7 hours in a row since my car accident 5 years prior. Lost 20 lbs easily, but I had to stop taking it due to side effects. It makes certain foods taste terrible; gave me a constant pins/needles/numbness feeling in my hands and feet; dropped things more often; handfuls of hair fell out; sweat turned orange; dumb as box of rocks. All this yet it worked better than anything else I'd taken."""
Migraine Prevention,8.0,"""Started 100mg at bedtime (in case of drowsiness) because I was waking up with 3  migraines/week. Later we added 25mg in the morning to prevent afternoon migraines. My headaches have gradually improved, not just in frequency but also in intensity.

Only side effects have been weight loss (about 10-15 lb, and it seems to have levelled out there, which is fine; I'm a relatively small person) and paresthesia/tingles in my hands & face. Tingling is more frequent in cold weather, but it's not bad enough to make me quit, especially not with the benefits I'm experiencing.

There's been a bit of research into its use for mood disorders, which I have. I'm on other meds for that, but I wonder if the topiramate is having any extra little benefit there."""
Seizure Prevention,8.0,"""I just started Topirimate Wednesday before thanksgiving before I had a severe migraine I couldn't get rid of & my seizures were out of control! It's only been a couple of days & I feel a huge change. I get a tingle feeling in my hand and feet and I've lost a bit of weight but I'm not complaining lol I 22, 5'8 start weight was 180 now I'm 177.. My head feels so much better, a little cloudy and I'm extremely tired but I think that's normal"""
Migraine Prevention,8.0,"""After many years onTopamax 100mg, eexcellent results for migraines, anxiety, depression, weight loss, now on generic Topiramate 300mg. Only keeps migraines at bay. No other good side effect. Gained back weight and stay depressed and anxious. Phcy. says it is the binders in the Rx."""
Obesity,8.0,"""Ive been on psychiatric meds for a greater than 10 years. Most of these medications had cause me to gain a lot of weight. At my last doctors appointment I weighed 265 and was given the option to start taking topiramate. I took 1/2 50 mg tablet every night for 3 days then 1/2 tablet twice a day starting on June 30, 2016. Well when I was weighed on July 15, 2016, I had lost 5 pounds with no exercise. I have a follow up appointment tomorrow on July 28,2016. Oh I haven't noticed any side effects. I'll keep you guys posted."""
Migraine Prevention,8.0,"""I have been taking Topamax for about 2 full months now. I had a sudden onset of massive Migraine's.In one month alone I went 27 days with Migraine's, I was a nonfunctioning person. I ended up in the hospital for 2 days finally,I started taking this wonder drug!I have only had 2 bad Migraine's in 2 months.I am able to go to work and most of all function at home.I do find however that I have memory issues, and speech issues, ThankGod everyone around me is very understanding and we laugh about it."""
Obesity,8.0,"""fibromyalgia sufferer for 10 years"""
Bipolar Disorder,8.0,"""I've been on every medicine. I've had electroshock therapy. Medications don't really work for me very well. I'm only taking Lithium ER 450 mg right now cos my body can't handle more of it. I was taking Topamax for headaches, I thought, but my psychiatrist said it might help my mood. Been taking it for years. I didn't know that it did work for me until I stopped using it. I broke into a manic episode because I started taking that Garcinia weight loss thing, and I wasn't on the Topamax. Well, I guess Topamax DOES work. """
Migraine Prevention,8.0,"""So far, I've been on Topomirate for a few months now.  I take one 25 mg pill per day in the morning.  It mostly controls the daily headaches for me.  The only side effect for me has been sodas tasting flat, which is a side effect I can get on board with!  I drink a lot more water because of it and I love that!  I have just now started to lose weight after about 3 months or so of being on this medication for headaches.  I've started steadily losing ounces/weight.  I started out at 142 and over the past month I've dropped down to 134 which is unusual for me because I haven't changed my eating habits at all really except for the soda thing.  I'm okay with it all so far, but I hope I don't experience any other side effects like I typically do."""
Bulimia,8.0,"""I had been bulimic, anorexic for 15 years. I tried in-patient/ out-patient programs in the best places in  Toronto, Canada .. and I did each 3-4 times. When I started Topamax, I could attend lunches at work and can honestly say I haven't binged at work this year (I am a teacher). In previous years, I binged and purged, 3-4 times a day.

I know socialize and have friends.

I do admit though that the meds have made me very, very, tired. I sleep in until about 1 or 2 pm on the weekends which brothers me a lot but I think its a small price to pay for the huge changes I've made."""
Obesity,8.0,"""I've found that Topimax has worked for me, I've lost 73 pounds still struggle with food consumption from time to time but I do find that it has a definite affect."""
Obesity,8.0,"""First started topamax in 2013 lost 30 lbs on 75mg in 3 mos topamax 25 mg 3 x a day w/30 mg prozac once a da.  Weight went from  278 to 248.  I am 65 year old female obese all my life.  Had experimental  Lap band surgery in 1979. Gained all weight back.  Tried everything and gained back all weight every time.  Can't take diet pills make me too jittery.  After three years stopped topamax because of minor memory loss which I thought was embarrassing.  Stayed on Prozac 30mg and gained all weight back and more up to 291. Now I am really depressed.  Came off Prozac and am back on topamax 25 mg in morning and 25 mg at night only.  Have lost 3 lbs in one week.  So happy.  Would rather walk and feel better physically than remember someones name,"""
Migraine Prevention,8.0,"""The first month was great, started on 25mg and upped to 100mg within 4 weeks. Totally migraine free except when I came to my period. Then I started to have a visual aura which I never previously experienced and had a 3-day intense migraine. My usual vertigo and severe travel sickness completely disappeared. After that, I stayed headache free mostly for a couple of months, apart from my time of month and ovulation. I continue to get the visual auras almost daily. They're not painful so don't bother me. Last month, the headaches came back almost daily with the auras. My doctor increased dose, going to 200mg and headaches are gone already. I'm hoping this will also help with back pain from disk degeneration. Lost 33lbs"""
Migraine Prevention,8.0,"""I started this medication at the suggestion of my neurologist in June 2016. I was overweight and having frequent migraines. I started on 25mg and increased by 25 mg every week until I was at 100 mg. I started to notice slow weight loss at first, and my migraines were instantly better. The weight loss definitely increased once I got to 100mg. After the one month mark the doctor increased me to 125mg and the wight loss slowly continued. As of now I am down 27lbs and still going! As some have said the side effects of ""word soup"" and tingling in my hands and feet have all happened, but they have all worn off once I have become used to the increased dosage (which is a good and bad thing). I'll be talking with the dr soon! Good luck everyone!"""
Migraine Prevention,8.0,"""I have epilepsy and chronic migraines due to a head injury. I have had this condition for 3 years now. It wasn't until Topamax was added to my regimen that I was seizure free. I do still have occasional migraines but I personally feel Topamax gave me my life back. 6 months ago I got my drivers licence back after 3 years. I attribute that to Topamax."""
Migraine Prevention,8.0,"""I was put on Topamax, but the generic version about 5 yrs ago for migraines. The weight loss was phenomenal when I took it like I was instructed. It decreased my appetite tremendously. I did have tingling in my hands & feet for a while & was a little foggy, but nothing too bad. I actually didn't attribute these effects to the Topamax until reading others account. I went from 220 to 180 lbs in under a year. I stopped taking it about 3 months ago because a friend complained that it made her hair fall out & that she was feeling mentally ill so I got scared & stopped. Now my appetite has really picked up. I'm going back to the Topamax because my hair never fell out or anything & I didn't feel mental. Everyone reacts differently to different med"""
Bipolar Disorder,8.0,"""I have taken Topamax for bipolar twice. First for three years then now for a year. Do not know why I ever went off! This has been great for me after 25 years on lithium which was like living under 4 wet wool blankets. I also tried Depakote which only increased the weight gain and depression. At first, the side effects were a bit rough even at the initial very low dose of 25 mg. Very sleepy and tingly of hands and feet. BUT they pass, they really do. It may take a week of just being exhausted even when you increase your dose. The appetite depressant is wonderful. Also cuts down on general anxiety. Takes the real edge off the hypomania. I have not had any of the problems with finding words, etc. """
Migraine Prevention,8.0,"""Topamax worked pretty well for my daily headaches/migraines. I was down to using 6 of the 9 Imitrex pills that I usually suffered the rest of the month needing more of before. It also helped my cravings for alcohol (former binge drinker) and sugar, significantly. Topamax works for so many things- but there were 2 side effects that I couldn't deal with- irritability and hair loss. I recently had the same experience with Keppra- minus the benefits of Topamax. I have gone through all the seizure medicines with minimal benefit and all have caused hair loss for me except Zonegran, which didn't help my headaches at all."""
Migraine Prevention,8.0,"""After taking 100mg daily, it took me roughly 3 months for my migraines to dramatically stop. I went from having approximately 12 migraines monthly to having maybe two. The side effects of this medication for me: for 3 weeks I could not focus, extreme fatigue, restlessness. I cannot drink anything carbonated, as a result, I lost 20 pounds in the first month. Serious appetite loss. I've been on this medication for 9 months and lost a total of 43 pounds. I have to take in the morning otherwise I cannot sleep. It also helps with my OCD tendencies. If you can make it through 3 weeks of outter space, this medication is worth it!!"""
Obesity,8.0,"""This is my second check in. I started Topiramate on July 4th with minor success but high hopes taking 25mg 2x daily. Now I am at 100 mg, 50 a.m. & p.m. This seems to be the turning point for me. The weight is finally starting to noticeably go down. I eat a breakfast with protein, barely hungry until dinner but make wiser choices and still enjoy desserts. Very thirsty for water all night and still biking. Good luck all!"""
Seizure Prevention,8.0,"""I've been on Topamax (250 mg/day) for 8 years now. Up until last week, I was seizure free for 7 years. Everything I tried prior to Topamax resulted in breakthrough seizures every couple of weeks. Topamax enabled me to get my license, a full time job, move out of my parent's house, and eventually get my Bachelor's degree (next year!). Put simply, Topamax gave me a life!"""
Migraine Prevention,8.0,"""I had tried everything Depakote, verapamil, Inderal, etc. and I had several migraines a week.  I have been on Topamax for 15 years and it has made a huge difference.  I still have a few migraines a month which usually respond to Imitrex.  As the years have gone by the tingling, loss of words have gotten much better.  I can't do without this medicine.  I'm a nurse and for the one or two out of control migraines per year I use injectable Toradol.  That is a miracle medicine.  No more Emergency department for me.  I can now feel free, live a normal life, not terrified of being stuck in a dark room with vomiting and wanting to die."""
Bipolar Disorder,8.0,"""I have been diagnosed with bipolar disorder since I was 16 and now that I'm 25. I feel good to have found a medication that helps me. The only problem I have is the fatige. I could sleep alot on this medication. I guess thats still better than being depressed and irritable."""
Migraine Prevention,8.0,"""I've been on Topamax for probably at least 15 years, 400 mg daily. I'm get debilating migraines. After reading these reviews I guess I am one of the lucky ones as I have not received one side effect. I take it at night. If the migrane is really bad I add one pill of Relpax and that does the job."""
Tourette's Syndrome,8.0,"""I have MS and often shake. I have a full time job and often had to listen to people ask me ""had a little to much coffee?"" or ""are you cold?"". Since I started taking two doses of Topamax - one in the morning and one in the evening my shaking has greatly diminished."""
Bipolar Disorder,8.0,"""Overall, Topamax has been a very positive attribute to my daily ""cocktail"" of necessary medicines.  It has assisted in stabilizing my mood, and thus helped me to resume a semi normal routine.  As for side effects, I experience loss of memory that I am told is due to the Topamax, and is fairly common.  Although, irritating at times, it is much more tolerable than my past existence."""
Migraine Prevention,8.0,"""Prescribed a half 50 mg tab at bedtime for a week.  It's been two days and I have no more headaches! Finally!  I have a strange side effect of pain in my private area though.  Does anyone else have this issue?  It's just annoying.  I hope it doesn't get any worse.  I've been looking for a migraine med that actually helps without too many side effects."""
Migraine Prevention,8.0,"""I've had daily chronic migs for over 39 years now & have tried everything under the sun. Although Topamax doesn't get rid of my migs it allows them to be manageable. When they not, Imitrex is there. I LIVE on those two. Yes, Topamax has its side effects; I esp like the one where I forget words and objects. I've been on it for about 6 years now & although it doesn't work the best, it works better than anything else i've been on. I take 400 mgs daily. Have a pos outlook on life, it helps a lot!!  :o)"""
Migraine Prevention,8.0,"""Didn't like initial side effects. Reduced migraines by at least 50-75%"""
Migraine Prevention,8.0,"""This is one of the medicines I cycle through for my migraine control.  My body gets ""used"" to them, so about every 4-6 months I have to change drugs.  Fortunately I can rotate back after about a year off.  This is one of my favorites, because the side effects don't interfere too much with my day-to-day life.  Tingling in the hands and feet, decreased appetite, and a bit of increased anxiety (but manageable).  For me, the benefits of having my migraines under control (ones that went on for days and weeks, 7-9 scale pain on a regular basis), far outweigh the cost of the side effects."""
Migraine Prevention,8.0,"""I still get slight headaches once in a while,  and use Excedrin Migraine with the Topamax, but its nothing compared to what I had. The side effects go away and the ones that don't, you get used to. I still have memory problems, so I had to lower the dose."""
Migraine Prevention,8.0,"""I've been taking Topamax since  1/2015 for Migraines suggested from my Doctor. She said it was a little pricey. If you don't have insurance I would recommend websites where you print out coupons and take them to the pharmacy they saved me $188.00 for Topamax ! No kidding. Anyways. Topamax works good. I did loss 7 lbs my 1st week, I ended up losing a total of 20 lbs in 3 mos. been steady since. I'm still taking Topamax 6mos later. I'm looking into other options as  I can not take the Side effects, loss of hair, tingling of my Feet, hands, legs,, face, odd places on my body, mood swings, I'm very irritable, I don't recognize myself.  I need a change."""
Obesity,8.0,"""I was taking 400mg daily for chronic migraines, depression, and weight loss. It's very important to build up slowly otherwise the side effects can be extreme. I lost around maybe 50lbs while on it. When I got up to 300 - 400mg I started to have memory problems and sleep issues. After a while I felt like it had stopped working and dropped it, but that could have been from me forgetting to take it (memory issues remember). It takes a few weeks to a few months for the side   effects to fully wear off. I started at 235 or 245, and went down to 185. I'm now back up to 200. I haven't exercised in years, and I didn't change my diet (I probably don't eat as healthy as I should)."""
Migraine Prevention,8.0,"""I have only been on this medicine for about a month and a half. I was having about 6-8 migraines a week. I cannot tell you how much difference Topamax has made in my life. I feel like a new person. Some side effects , little tingling, my tongue feels weird, but only a few mini migraines here and there now and well manageable. Love it."""
Migraine Prevention,8.0,"""Just started Topiramate August 2 2013. I've had migraines for 33 years.  Imitrex works unless, like now, I'm a stress-monkey. I was having 2-3 migraines per week. Doc started me on 50 mg. Slowly working up to maximum dose over 30 days. I didn't like the 1st 3 days. Feel disoriented, dingy, irritable. I've lost 8 lbs in 3 weeks which is fine since my weight contributes to my hypertension which contributes to my migraines. My doc & I plan to take me off Topiramate as I lose weight & get healthier. Right now I can tolerate the negatives."""
Migraine Prevention,8.0,"""I started taking 25 mg about a year and a half ago I got up 200 mg once a day I found in the beginning my hands would tingle I had bitter a taste in my mouth but overtime that went away it did help with weight loss I lost about 10 pounds. I didn't experience any hair loss in the beginning I had trouble remembering things but it eventually fades away and you're back to normal at least for me . I believe this drug does work specially if you have migraines."""
Seizure Prevention,8.0,"""Well I can say that I was taking keppra which made me psychotic. I now take topiramate x25mg twice a day and increasing until 6 weeks and I started last week Tuesday and already lost 15lbs. I have to watch this because as being in the medical field I know there are different side effects but the main two are diarrhea and anorexia. The diarrhea I maybe can deal with but I'm not made to be anorexic. I like a little meat on my bones. So just watch your weight side effects"""
Obesity,8.0,"""Hi, thank you all for your comments. Ive just started topamax (second night) 25mg and cant sleep. I now see its a side effect that some expereince and it will go away. I will persist. Had a bit of a headache and a bit fuzzy in the morning but thats it. will let you know in a week if any weight loss. definately not feeling hungry."""
Migraine Prevention,8.0,"""I used to get migraines twice a week that would last a day or two. Now they're down to  two every two weeks that could possibly last a little more than a day.Topiramate really helped. I used to be on a lot of meds. I'm 17 now. I do experience side affects as well. I can't really concentrate as well in school. I can see that in my grades. I can't sleep well at night. I've lost weight, which is probably a good thing, (30lbs in 6mos.) and the one that gets me the most is my hair has started falling out drastically. I don't brush my hair anymore. I used to have 8 migraine days a month at the least last month I was down to 3. These side affects are worth it to me. but every case is different."""
Fibromyalgia,8.0,"""I love this medicine.  My Dr originally gave it to me for weight loss but it got rid of all my joint pains.  I had it everywhere.  It was a miracle drug for me.  I am noticing some memory loss,  and difficulty concentrating but I'm 52 so it could be age.  I'm going to cut back on the dosage and see if I notice changes."""
Seizure Prevention,8.0,"""I took Topamax for approximately 5 years with little trouble. I did have the metallic taste, and could not drink carbonated beverages. In July 2009, I had to quit Topamax due to a little published side effect, kidney stones. I was on a pretty large dose (600 mg).

I had a 9mm Kidney stone and many many small stones. I take Keppra XR now. It prevents the seizures, but I have gained all the weight plus some that I had lost on Topamax, but no seizures or kidney stones."""
Migraine Prevention,8.0,"""Used to get 2-3 weekly migraines before Topamax and would run out of Fioricet and Imitrex. I tapered up to the 100 mg dose and while I do get the occasional tingling in my fingers and toes, its nothing compared to a full fledged migraine. I also dropped 8 or 9 lbs, which is a lot for me since I'm 5'2 and was 129, now I'm 121lbs. I have almost no appetite, but almost no migraines."""
Obesity,8.0,"""I started againTopomax about 1& 1/2 week ago for migraines and I am down about 8 lbs. I am overweight due to the fact that I just had my last child and I did eat what I wanted to. I did work out before, during, and now after my pregnancy. Topomax has reduced my cravings I absolutely love sweets & southern foods(I'm from the South:) I did occasionally soda but I did regularly drink Izzy a healthy carbonated drink but Topomax makes all carbonated drinks tastes horrible which is great if you have issues drinking soda all the time."""
Diabetic Peripheral Neuropathy,7.0,"""I was recently prescribed topiramate 25 MG tablet for neuropathy caused by type 2 diabetes.  I can not find any other place on here where this drug was prescribed for neuropathy, but so far it appears to be helping."""
Migraine Prevention,7.0,"""By the time I started Topamax, I was getting migraines 2-4 days a week. Topamax seemed like the best fix. And for a while, it was. My migraines significantly reduced, though I did get most of the common side effects: slight tingling in my fingers, carbonated beverages tasted gross, and weight loss. 

My main warning about this medicine is weight loss. It seems to be paraded as a benefit, and to some it may be, but if you are already naturally slim, pay very close attention. I wound up dropping to an unhealthy weight despite all attempts to counter it, and it's ultimately why I had to stop Topamax. I was unwillingly wasting away. When I stopped, my migraines returned in short order, and I'm still looking for an alternative that works."""
Seizure Prevention,7.0,"""I have to take a very low dose or suffer from stomach problems and diarrhea. If I miss just one day can allow mild seizures to come through. Otherwise it works well."""
Migraine Prevention,7.0,"""This drug isn't for everyone. The side effects are completely crazy. I have been on it for almost 12 months now. It has provided relief from migraines by almost 95% of the time.  This has been a big deal for me. Side effects I've experienced: hands and feet tingle periodically (some days are worse than others), hair loss started 3 months after taking it but began to cease 6 months later, definite brain fog (some days I feel like I'm losing my mind), grogginess (I can only take my dose at night otherwise I'm a zombie during the day), changes in vision, loss of appetite, fatigue, irritability.  At first I convinced myself the side effects were worth tolerating compared to having a migraine. But as time goes on, I'm beginning to think im wrong"""
Diabetic Peripheral Neuropathy,7.0,"""I started taking Topiramate several years ago for pain/neuropathy, as I read these posts I found out it could also be helping my obesity, fibromyalgia, Crohns and my smoking. I stopped taking it about two months ago because I was having kidney stone problems and thinking this medicine could be the reason why. In the two months I have gained 25lbs, I'm in so much pain I can't wrap my head around it, and my smoking is got in out of control. I had no idea this medicine could or was helping all my other issues so I'm going back on it to see if I loose the weigh, control my pain, stop smoking, Although kidney stones can be the most excruciating pain ever! I'd rather have that pain once a year than suffer every day in my other pain."""
Migraine Prevention,7.0,"""Been on Topamax for 3 months I have recently gone up on the dose to 75 mg at bedtime. I've been all right dealing with the tingling. I have quit smoking and drinking which is great. I started working out alot since I've been so anxious. Possible side effect?  The worst for me is the sleep issues and the mood swings. Since the dose went up I am having terrible night sweats and am waking up all night long. I'm exhausted all day with little to no motivation. My mood swings quickly and dramatically from happy to annoyed. Just trying to wait it out. I'm still having headaches everyday. Just not migraines."""
Migraine Prevention,7.0,"""When I took 50mg of topamax the first time for migraine prevention it worked wonders and I lost 20lbs in a few short months! I stopped it when I got pregnant with my daughter. Once she stopped nursing I restarted it again to help with my migraines and hopefully drop the extra weight I couldn't lose from the pregnancy. It helps with my migraines the second time around but there is no decrease in appetite and no weight loss. Very disappointing."""
