Condition,Rating,Review
Bipolar Disorder,10,"""I was afraid to take this medication I went online and looked it up and read so many bad things about it hair loss memory loss etc ... I am so glad I went ahead and gave it a try for myself I think it's a miracle drug ! It's helped stabilize my mood, taken away my migraines and even helped me lose a few pounds !!! I haven't had any negative side effects at all from it ! I know it's effects everyone differently and for me personally it's been great I love it!"""
Migraine Prevention,10,"""After 7 years of debilitating migraines almost daily and rebound headaches from taking Excedrin and ibuprofen, I finally found a doctor that was willing to help me. She suggested Topamax and just in this short period of a couple months, there's been a significant difference. Not only am I rarely having pain, I feel less anxious and more balanced out emotionally as well. Even friends and co-workers can see the difference in my mood! As for side effects, I experienced the tingling in my hands, feet and face but my Dr. mentioned taking a Multi vitamin each day, which has seemed to help. Also been drinking LOTS of water, to counteract the major dry mouth. Overall, Topamax has been more of an effective, positive experience for me than anything."""
Trigeminal Neuralgia,10,"""I have taken it for 1 and 1/2 years for migraine. Also, after developing chronic lower back pain from degenerative discs it has really helped me cope with the pain."""
Obesity,10,"""I am 56 years old and weighed 249 pounds. Finally decided to deal with this weight issue once and for all. My knees prevented me from working out and my weight caused my knee issue. I sat down with my primary care physician and she ultimately suggested the use of topamax. In July 2015 i started with 25 milligrams and evolved to 125 miligrams. It is now December 8 and I weigh 221 pounds. Here is how I would describe the experience. It stops the need to impulse eat, so you don't feel deprived, so...your not crying when the scale isn't moving quickly. Its not quick, because I am post menopausal...but
its not painful. Appetite is down, I can now walk 45 minutes...and for the first time in my life..I know I will reach a goal weight."""
Seizure Prevention,10,"""I have had extremely positive effects from this drug, but I do have to take Prozac with it as it causes mood swings or depression with me."""
Seizures,10,"""I went to a new doctor and mentioned to her that I had a binge eating problem in addition to having PCOS(also causes weight gain) and recently being diagnosed diabetic. She put me on Trokendi XR and told me it would help with the binge eating and OMG has it! Not only has it changed the taste of foods, where before foods I would normally eat all of in one sitting, I now only eat a literal serving size of and don't physically want anymore, and most times don't even want to eat unless I'm physically hungry. I HIGHLY recommend trying this instead of surgery or letting them put you in a hospital if you an overeating problem. Surgery should be a LAST resort! Good luck to all! <3"""
Seizure Prevention,10,"""This medication has really helped my seizures plus my migraines. It is really convenient because I have both problems and I don't have to take two medications for both problems. Topamax is great."""
Bipolar Disorder,10,"""I take this as a mood stabalizer it has really helped level out my moods"""
Migraine Prevention,10,"""have been researching and researching for so many years and I have to say that Topamax saved my life.  I am currently 23 years old,  and I started having these migraines when I was 15. I didn't know that this would be a lifelong thing that would eventually lead me to be on daily medication. The frequency that I would get them,would be more than six times a month. Anyway, I went on propannalol? (Beta blocker), NO SUCESS. & then doctors prescribed me topamax. I didn't have any side effects. At all. No tingling. Nothing. And GUESS WHAT, I didn't have a migraine for 3 years!!!! NOT ONE. but I got off of it, thinking they were ""gone"" & now I'm suffering with new hormonal migraines. Going back on topamax & hoping for same results!!!!"""
Migraine Prevention,10,"""I would get headaches all the time to the point I was not a functioning human being. I'm 26 and the past few years they gotten more frequent more painful and more uncontrollable. My doctor recommended topiramate and after a few trials of different mg it's a game changer. I honestly never get headaches anymore and had not a single side effect from this medication (which I was concerned about). It really does help and gave me a feeling of normalcy back in my life."""
Obesity,10,"""I was just diagnosed with epilepsy about 2 weeks ago and I am now taking 50 mg of topamax 2 times a day and I have to say this is the best thing ever!  I don't know how much I have lost because I did not know what I was when I started and I need to get a new set of scales.  I was around 240 lbs so I needed.  I noticed right away that my diet Dr pepper tasted flat and just thought that I had a bad batch till the next case tasted worse.  I also noticed that food tasted ""off"" too,  now my appetite is down and I took a deeper look at the info on topamax and know this is the drug I have been needing the last 10 years!"""
Migraine Prevention,10,"""Love this medicine, no headaches."""
Migraine Prevention,10,"""After several concussions, i was left with months of daily, debilitating headaches that were ruining my quality of life. My neurologist prescribed me this medication for post concussive syndrome- 50 mgs a day and it has been a miracle drug! This medicine has given me my life back. I am much more mobile, less irritable, and overall happier. I've been on the medicine for about a month though, and have seen a slight return of symptoms. I used to live off of over the counter pain killers, but this medicine has really helped to repair the damage to my brain after tbi. Was warned it would effect memory, but haven't noticed that as a side effect."""
Seizure Prevention,10,"""Great   and Keppra too"""
Obesity,10,"""Update I started Topamax a week ago tomorrow 50mg at night and I have lost 5 lbs I'm 5'3"" and started at 157lbs I am at the Dr.s now stepped on the scale and I'm at 152 so I couldn't be happier...I have very minimal side effects taking them at night helps with those I sleep very well and I have had some tingling fingers but nothing unbearable...all in all I am very happy with the 5 lbs  lost in 6 days looking forward to more weight loss in one more week I do increase my dosage to 100 mg so we shall see about those side effects...but if things keep going the way then I might stay on them for a while"""
Trigeminal Neuralgia,10,"""It took me a year to be diagnosed with Trigeminal Neuralgia - and I had to go to a doctor in Vienna for this, because the doctors in Romania misdiagnosed me - but Topamax is the medicine that really saved my life. Literally! Because I was contemplating suicide, the pain was that bad and nothing else was working for me. I have lost a little weight in the first couple of months and I also have some trouble finding common words while speaking, but otherwise I did not experience any other side effects so far. My cholesterol level is now increasing - I am wondering if anyone is experiencing that as a possible side effect."""
Migraine Prevention,10,"""I have suffered from severe migraines since I was 15 and the older I got the more severe they got I have been on numerous medications over the years but 5 years ago I found a neurologist that gave me Topamax and my life has changed completely 50g in the morning and 50g at night and I don't get any anymore I had a few at the start but haven't had a headache now for a few years thank God for Topamax"""
Migraine Prevention,10,"""I was on Corgard for 7 years and it did not control my migraines. I get complex migraines with neuro symptoms... numbness on one side of face/arm/hand... .feels like a stroke, but isn't.... have had CTs etc. Anyway, was switched to Topomax at 25 mg in March and increased to 50mg in May... no migraines except for one episode of a few days of the 'aura' but did not go into the full blown scary feeling migraine. My side effects have been significant  weight loss and some word find issues, but I would not trade them for feeling like I am having a stroke. I don't know the long term effect of taking Topamax though.... will have to ask my neurologist. I have changed to a new one recently. Am so thankful so far for Topamax."""
Migraine Prevention,10,"""I suffer bi-lateral migraines and have been on Topamax for several years off and on now. I have mixed reviews.  I LOVE Topamax, because nothing else works for me. In fact I was given Maxalt and Propranolol together and wound up in the hospital almost dead. You can NOT take those two together. All medicines have side effects, so does Topamax. I liked the weight loss in the beginning, but be careful with it. I lost 80 lbs and couldn't stop. I forgot to eat. Topamax makes me just not hungry. I have it fixed now and watch out for it, but it was very scary. The memory loss has been a problem at times, but has been funny too. I have not experienced the HOT they spoke of...I FREEZE ALL THE TIME!"""
Bipolar Disorder,10,"""After so many years of trying I finally start to function as a ( almost) normal human being. Topamax is my lifesaver."""
Migraine Prevention,10,"""I've been taking Topamax for about a year now. I started at 25 mg twice a day and I currently take 100 mg twice a day.  IT IS WONDERFUL. I have had only 2-3 migraines since my Dr upped my dosage 3 months ago. I still get ""regular"" headaches 4-5 times a day but I can handle those. I was gearing 5--6 migraines a week before Topamax. The side effects are all there but I don't care as long as the migraine pain stays away."""
Migraine Prevention,10,"""Topamax has significantly reduced my migraines from 1 a month to 1 every 18 months.  I have also found that it helps you - to not over eat or drink alcohol.  I am very happy being on Topamax for all these reasons.  I initially did have tingly feet, a small price to pay, but rarely get that sympton now.  I am on 50 mg a day."""
Obesity,10,"""I was prescribed Topmax for migraines but I have had weight loss being on it. I take 50mg twice a day. I had the same problem with the pop it tasted flat (Still have). I had (have) the tingling in certain body parts and the tired feeling at first. I started taking them July 2015 and by January 2016 I have lost 40lbs. I was 190 and am now 147 and going down every day! The only thing that I have changed is I drink water. I eat whatever I want some days I eat more some days less. I used to go through a 12 pack of Mt Dew a day. It was hard at first but I honestly don't mind now. Because when I look in that mirror every morning its worth drinking that bottle of water."""
Migraine Prevention,10,"""I have suffered with migraines from the age of 13. I used to get them as often as once a week lasting anywhere from three to five days. I have tried so many other medications to attempt to prevent my monster migraines but nothing worked. Been to chiropractors and tried massage therapy.  Countless visits to the ER and walk in clinics for injections of Demerol and Phenergan. Then I began seeing this new neurologist and he started me on Trokendi XR. I have been on it for 3 months and only experienced just one migraine which was my fault, I ate too much chocolate during the holidays, other than that Finally relief! For me Trokendi XR has been an answered prayer. Have not noticed any major side effects yet I take it at night, a little drowsiness."""
Bipolar Disorder,10,"""Put simply, this stuff saved my life. I've been on nine meds to treat my suicidality associated with my ultra-ultra rapid cycling bipolar ii. the AAPS gave me tremors, seroquel made me a zombie, lithium made me suicidal, lamictal and saphris aggrivated my bulimia. My doc didn't want to use antidepressants for fear of driving me into mania. We thought we were out of options. I stumbled on topamax while looking at an NIH research study. I suggested it to my doc. he said, why the hell not? In three days my suicidality was gone, and I barely cycle at all any more. THIS IS A MIRACLE DRUG."""
Migraine Prevention,10,"""helps me to sleep and a lot less head akes"""
Migraine Prevention,10,"""I fell four feet backwards off of a straight truck and whacked the back if my head off of a concrete parking lot and gave my self a concussion. Long story short, I have had a rough go at the post concussion symptoms and the migraine/cluster like headaches have played a MAJOR role. Theres days where I just lay around in the dark and do nothing. The pounding just takes over and that's all that matters. You are not even you anymore. I was prescribed Topamax on Nov.18th and started one week on 25mg. Nothing changed. Then two weeks on 50mg, again nothing changed. This is my third week on 100mg and I am FINALLY migraine free. The side effects do wear off after time. You just have to give this medicine time. Worth it."""
Obesity,10,"""Excellent!  My doctor has combined this with Phentermine and I average a healthy 1.75 lbs of weight loss per week without excercise (due to pulled hamstrings).  I do not take the Phentermine full dose, nor do I take it every day.  My doctor follows me closely and I pay close attention to how I feel and go by instinct.  My overall health and well being is more important than losing weight.  I am very cautious and choose the right foods e.g., protiens, green veggies, lots of water, fruits and fiber.  I am sure to get proper rest to stay mentally sound.  Losing weight is good for me, but is taxing on my body and I am going to do what I have to in order to develop healthy long term habits (which take at least 30 days to develop)."""
Trigeminal Neuralgia,10,"""Works well with combine with medical Marijuana. I take them at night 2 in the morning. It let's me be able to sleeps at night. I wasn't able to lay down after a fail MVD operations. Since I started the Brand name topomax it help me a great deal."""
Migraine Prevention,10,"""I am 19 year old active kid that exercises 4-6 times a week and suddenly after years of working out some migraines began in the gym that didn't go away for 3 months. All day everyday, constant migraines. I had to stop working out, got fat and lost all my gains. I started 25 mg topamax at the same time with chiropractic care  (found in neck x-ray abnormal lordotic curve) and started treatment every week. A week later of both of these combined, the migraines are finally gone! but my head still throbs except with no pain.. I am just happy I can finally exercise again, and stop hating life. (Got CT Scan and MRI of head before X-ray of neck, was clear {checked neck because it got stiffer a month into migraines} ) NO SIDE EFFECTS! :-)"""
Obesity,10,"""I was prescribed topiramate for daily post-concussive headaches, and I also needed to lose weight.  The first three weeks were really rough, and I was unsure if I could take this medicine long-term.  I started off with 25mg the first week, 50mg the second, 75mg the third, then 100mg as my permanent dose.  I took it before bedtime as instructed, but I had next day drowsiness so bad that for three weeks I felt like I was going to face plant at any moment.  Also, the nausea was so bad that I barely ate.  Thankfully, both of these side effects stopped after about 3 weeks as did most of my headaches.  I've also lost 22 lbs in 2 months.  The best part is that it has given me control back in that I eat smart and don't have unhealthy cravings."""
Obesity,10,"""Before Topamax I used to suffer from chronic migraines I mean 3-4 migraines a week. Been on Topamax for nearly 3 weeks, day one 25mg instant appetite suppressant loss 18.7lbs in 2wks! Inches everywhere, food taste good just eat very little of i.t I'm never ever hungry but I enjoy cooking! I have energy, not bogged down with lots of medicines anymore and not one full migraine! I'm excited to lose weight it's actually very easy to eat healthy. Its all you crave and I was a sweet addict. No ugly side effects as described, not on this dosage. So I hope this has helped someone."""
Bipolar Disorder,10,"""This pretty much saved my life. I've been on EVERYTHING (or so it seems) for major depressive disorder and when I was about 32 something wasn't adding up and I was diagnosed BP2. I tried Lamictal and I couldn't handle the headaches. The other BP medications all seem to cause weight gain so I'd stop taking them. I got a new doctor who said if I tried lithium she would give me a little Topiramate to help offset the hunger the lithium caused. Well, the topiramate seemed to help the BP2. So I've slowly worked up to 150/day topiramate along with wellbutrin and Lexapro. It's a GODSEND. 
Side effects: when titrating up at any point, tingly fingers or feet for a week but then goes away. Take at night because can make you sleepy. Hope FDA approves!"""
Migraine Prevention,10,"""I've read many of the poor reviews, and wonder how many refer to the generic version of Topamax. I can't use the generic version - it simply doesn't work for me, and I do recall more side effects. However, the brand name drug has been a lifesaver for me. I suffered with chronic daily migraine for over a decade before being placed on Topamax, and NO other drug helped. I was on beta blockers, calcium channel blockers, every medication for seizure disorders, and talk about side effects! They were horrific! I could barely function at work, missed lots of time, and essentially had no life. Topamax has made a major difference. I now have many fewer migraines, rarely contend with chronic daily migraine, and I've experienced no major side effects"""
Bipolar Disorder,10,"""This is a fantastic medication.  The day I was prescribed it and started taking it was nothing short of a miracle.  I had never heard of anything like it before.  I had been on and off trials of anti-depressants like Zoloft, Wellbutrin, Zypreza, etc for years and none of them did anything for me.  This was an entirely different class of medication and the new psychopharmacologist I had told me so before he gave it to me.  When it kicked in after several weeks I literally felt it one day while riding the bus.  I was trying to have one of those negative, anxiety-ridden feelings and a flush just came over me that downgraded that sensation.  The only drawback is that this medication completely stopped working for me after one and a half years."""
Migraine Prevention,10,"""I've suffered from chronic headaches/ migraines all my life and now being that I have finished  high school and moved to university the headaches would cause me to loose focus in university work. When my grades started to decrease I knew I had to do something about it. The doctors prescribed me Topamax (Topiramate). I've been taking this medication for about a year and I absolutely love it! Now I only get headaches once or twice a week, instead of every day. This medication helped turn dark, painful days to luminous ones!"""
Obesity,10,"""I been on this for med approximately half a month. I actually suffer from Bipolar and Depression also PTSD. Recently after I retired from fighting mixed martial arts and had knee surgery I was more depressed I gained weight. I am a big guy anyway. Normal for me is 6 ft 6 260 lbs. I got up to 340 and was like ok this is enough.

I started my vegan diet I did back when I fought mma went to the doctor I was down 10 lbs. I needed new med so she put me on the topomax. From day 1 zero appetite none whatsoever. Like I have to make an effort to eat.
When I do eat it is just cut up raw veggies in a bowl of vinegar that is it for the  day. Now I am on top of my supplements so my body has what it needs. I'm shredding lbs like mad"""
Obesity,10,"""Ok so I am going on my third week of topamax I have seizures uncontrollably migraines and obesity so let me begin with saying this I have noticed a significant change in my body as far as the weight loss goes 6pds since I have been on it and still loosing however I have lost my appetite I have no desire to eat I may eat one time a day that's the only downside I have noticed a change in carbonated drinks they don't taste the same anymore I am currently coming off tegortol which was only treating my seizures and I was gaining so much weight so I'm thankful that topamax is working for me and i only have to take one pill a day to treat all my ailments"""
Obesity,10,"""I have struggled for years with what I thought was just a problem with controlling my hunger, I would never eat around anyone and then once everyone was asleep I was starved. I finally seen a psychiatrist for my ADD symptoms and while he was modifying my medication he diagnosed me with binge eating disorder. To my surprise he was right. I had no control. I had always bounced on diets. He started me on Topamax 25mg and I knew instantly it will work. It has a calming affect. I feel so full and I am going to bed without eating for the first time in years. I am very thankful. Not every medication is for everyone.  I am pleased with this one so far."""
Migraine Prevention,10,"""I got migraines nearly everyday for around 6 months, I tried lots of different drugs, monitoring blood sugars and cutting out certain foods. One day I was prescribed this to take twice a day. I read lots of reviews about side effects the only ones i got were tingly hands/feet and for diarrhea. But I could cope with that and have not had a Migraine ever since best thing I was prescribed and would recommend."""
Bipolar Disorder,10,"""I have been off and on Topamax for about 5 years now and I must say that it works better for bipolar mood stabilization than any other one out there. The one thing I love the most about this medicine is that it is helping me lose weight. They need to put in the time to verify that this drug is in fact a mood stabilizer because it certainly does help with bipolar disorder."""
Migraine Prevention,10,"""I did not even know how bad my headache was for years and the ringing in my ears, I've started Topomax recently and I never realized how much pain I was in until the headache and the ringing was finally totally gone, I drink lots of water and less caffeine to prevent kidney stones. I have never had one but that was the only side effect that I'm worried about. I feel like a new person."""
Migraine Prevention,10,"""I too had migraine headaches since a teenager. I would leave work vomiting and have to stay in bed, pillow over the head for 3 days (monthly). Back then, nurses couldn't ask for medication for headaches we would be considered 'seekers'. Phenergan was a God send then. When Imitrex came out I thought I found the Holy Grail. Topamax has beat it. NO Headaches, I have my life back. Thank You Pharmacologists, Researchers, Chemical Engineers...
BETTER LIVING THROUGH CHEMISTRY!!"""
Obesity,10,"""I am on day 4 now and I am pretty spacey.  I feel like I have smoked weed honestly. However, I started at 277 and I am at 272 this morning. I am taking 50 mg twice a day. So I think what I will do since I have to work is cut them in have and do half in the morning half at lunch half at dinner and half at bed time so its not so crazy. Lol. It does cause slight memory loss and a little tingly feeling but its not unbearable. I have noticed I do not want any sweets. I crave fruit. And veggies. Or nothing. I had 36 cookies on my desk Friday and didn't eat one of them... This is very worth it. And the side effects do wear off after a while. Thats how I know its time to take another half. I will update later. Yay I extremely happy!!"""
Obesity,10,"""Lost 50 pounds"""
Fibromyalgia,10,"""I was put on Topamax 2 months ago after a serious car accident that left me in a flare up of my fibromyalgia. I have not reacted well to medications in the past and have had serious reactions which lead to serious consequences to the other meds I was on. Topamax has been the only medication that I have been able to tolerate well. It does take a while for it to start working though and I have had a few side effects but none that I'm not willing to put up with and 2 of them have gone away since I have started the Topamax."""
Obesity,10,"""Was given this due to daily headaches. I'm not one to take pills so I started slow. One morning and one at night. Stayed like that for two weeks. I started exercising around that time also but only about 3times weekly and dieting pretty well but lost quite a bit of my appetite. I weighed myself and after two weeks I'm down 15 pounds. I ate allot of yogurt and drank allot of coffee and water. That's all. I can't believe it was from this pill. I'm More motivated then I ever was! Starting weight was 189. Now I'm down to 174"""
Bipolar Disorder,10,"""Great and also losing the weight from the previous medicines I was on. Love it."""
Migraine Prevention,10,"""I have used Topamax off and on for the past 5 years. Off (due to pregnancies.) I am once again on and love the drug. Although the side effects are something to get used to, tingling in the hands, etc., those can be corrected with the correct dosage. The best side effect is the weight loss which certainly helps. My migraines have completely gone away. I have been a migraine sufferer since I was 5 years old (some 27 years). Topamax is a wonder drug!!"""
Obesity,10,"""I've been taking 25mg daily for the past 5 days and already lost 3.8kg or 8.3lbs. It's also been acting as a great mood stabiliser which is awesome because I have bipolar and Seroquel alone wasn't doing enough. Very happy with Topamax so far."""
