Condition,Rating,Review
Bipolar Disorder,9.0,"""I have taken Topamax for the last 8 months as a mood stabilizer. It has worked great, not only has it helped with my moods, but it also helped me lose more than 30 lbs without struggling to lose it. It was easy and great. I am happy again and I don't feel like I want to chew off everyone's head when I start to get irritable or around ""that time of month"". It's been a life saver."""
Migraine Prevention,9.0,"""I have been on Topamax for eight months.  Prior to that I was having clusters of migraines (5 to 7 per month).  I have had two total migraines since starting the medication.  Recently my doctor increased my dosage to decrease the breakthrough migraines.  I do have the tingling in my hands/feet, and have lost 35 pounds (but needed to).  I also was a soda drinker prior to taking the medicine, but have not drank soda since starting Topamax.  I do struggle with memory and finding words.  Although the side effects are problematic, they do not outweigh the benefits of not having migraines."""
Obesity,9.0,"""Topamax is amazing. I originally took it 6 years ago to prevent migraines and lost 80 lbs as a bonus. At that time my doctor and I speculated that it would some day be approved for weight loss because I was not his only patient to report changes in the taste of carbonated beverages and chocolate while taking the medication. I also noticed that I did not dream about food while taking the medication, but within 3 months of changing medications food reentered my dream content. I am now back on the medication to address chronic pain issues and have already found the same results in weight loss, taste changes, and dream content."""
Migraine Prevention,9.0,"""I have been taking Topamax for about 6 years now.  My current dosage is 200mg/day - the dosage was recently increased during a high-stress time. The main side-effects I notice are slight tingling in fingers, which only lasts a few moments. I have gone from 5-6 migraines a week to only 1 or 2 a month. Certainly worth it."""
Obesity,9.0,"""I figure I have lost about 15 -20 lbs per year for 100mg"""
Obesity,9.0,"""I have been battling my weight since I was pregnant with my first son, who just turned 2.  I was 165 when I got pregnant with him, and on the day I went in to have my second son (who is 5 months old today) I weighed 270. I just took my first 25 mg dose of Topamax last night.  I am addicted to Diet Dr. Pepper and can't even stand the taste.  Not hungry either, so I'm hopeful that this medicine will work.  I also take Celexa and Tenuate. I don't know if it's the combination, or just the Topamax, but I am feeling kind of ""floaty"" today, in a sense.  Maybe this will improve with time."""
Seizure Prevention,9.0,"""Best medication for me yet- I have my life back. Give it time and be patient. Let your body adjust to the drug slowly and be sure to stay hydrated and eat enough even though you might not feel hungry. Drinking smoothies helps. Get enough potassium and you wont feel tingly. I can finally go back to being a student and ballet dancer without seizures! Trust me- this medication can give you your life back."""
Migraine Prevention,9.0,"""I suffer from migraines, high blood pressure headaches, nerve pain and occasional bouts of trigeminal neuralgia. Topamax is a god send, it stopped my headaches and trigeminal neuralgia after we had gone through every treatment and pill available with no result. I was close to suicide because of the amount of pain in my life when I tried topamax and it solved all of those issues. One thing I will say is that the side effect I got from it was pretty severe-I was unable to physically exert myself or else I would break out in cold sweats and feel very weak. I didn't realize it was the topamax for the longest time as it isn't listed as one of the major side effects, but I was so ill I wasn't exerting myself anyways."""
Bipolar Disorder,9.0,"""I had hit rock bottom and I finally went to someone who knew what they were talking about. They put me on Topamax and I am fine now thanks to my doctor. Thank you to everyone who cared enough to pay attention to my well-being."""
Migraine Prevention,9.0,"""Does it work? Yeah! For everyone - NO! Let me explain. Do you have a job that you have to be alert and stay on your toes? Then you need to be careful on this because it will cause you to all the negative experiences you read about. I was on top as I call it 6 years ago and took a break from it and now have got back on it again. Why? Because I am tired of taking 6 Advil and every other over the counter drug there is everyday and wondering what is happening to my body from doing that over time and having the headaches day after day after day. So simply put you get to a point of asking yourself - do the side effects of taking it out weigh not taking it, and if you read everything the answer is an overwhelming YES! """
Migraine Prevention,9.0,"""LOVE LOVE LOVE this medicine!  I was apprehensive at first because of all the side effect horror stories, but at the end of my rope with around 15-17 bad migraines per month.  Sometimes I would have them 10 days in a row and my insurance would not pay for enough Imitrex, then I would run out and just suffer for days. Side effects were so bad the first week I almost quit:  dizzy, complete ""weirdness"", inability to handle more than one task at a time, anxiety, spacing out and forgetting things, etc.  And I still got migraines. It was a little scary.  On day 8 I took a leap of faith, increased my dose (as per the doctors orders) and the side effects all but went away, as did the migraines.  Life is better now."""
Migraine Prevention,9.0,"""I have been on topiramate for approximately one month and results are incredible. Within one week I was completely migraine free. When I first started this medicine I was very nervous considering all of the possible side effects, but I have grown to conclude I only had a few side effects. I had weight loss 10 pounds (good) and the bad I get very dizzy sometimes. I also find I over eat at all I feel like I might get sick (last about 10 min.). Lately I have been very tired, I used to be able to stay up forever now I go to bed at 9:30. Lastly, I have been experiencing random pains. They seem like body aches like you would get when you are sick. Oh and I almost forgot foods tastes different and pop taste metallic."""
Bipolar Disorder,9.0,"""Works wonders on rapid cycling.  I really love this medicine.  I know it is off label for bipolar, but wow!  I take it with another mood stabilizer, antipsychotic and a when required antipsychotic and antidepressant, and it has stabilized my Ultradian cycling that is so hard to treat.  I feel normal again.  I take 150mg.  Also can work in conjunction with other common weigh gainer medicines to cancel out the weigh gain effect - just a tip."""
Migraine Prevention,9.0,"""I love Topamax. I can only take the minimal dosage or else I will get the tingling and start to feel a little out of it. I was suffering from silent migraines for over a year and a half. Nausea, vomiting, blurred vision, light headedness, fatigue, upset stomach and daily headaches but the headaches could be cured with ibuprofen. Of course, it took a while to figure out that these symptoms were all caused by migraines but they were and after taking Topamax for 2 weeks I stopped having silent migraines. 

I even went off of it after about 3 months of being on it, just to see if my body had possibly regulated itself, but it had not. I was sick again in no time. It was horrible. It took about 2 weeks for the Topamax to kick back in."""
Bipolar Disorder,9.0,"""Be very careful with the dosing, less is more. Start slow, for me, I'm Bipolar 1 & 50 mg brought clarity but 100 mg. made word finding difficult."""
Obesity,9.0,"""This is an early review as I just started it on 10/16/16 but the food cravings are gone, it takes less food to satisfy me, soda tastes terrible, cigarettes taste different and bad  (which is a surprising good side effect!) and I just feel better with less food in me. I have tried phentermine with no luck and usually had good success with natural weight loss until being diagnosed with rheumatoid arthritis and needing a knee replacement that keeps me from working out too much. So so far, I am impressed. I'll be back in a few weeks for a weigh in review. No side effects like others have had with mental fogginess or tingling. 25mg 2x day. Here's hoping my 235 can become 155 again!"""
Migraine Prevention,9.0,"""I have been on 200mg/day of Topamax for about 6 years along with a bunch of other things and it seemed as though my headaches were worse.  I kept begging to increase the Topamax as I had stopped having any side effects.  Finally I fired my pain doctor after he told me just to go ""cold turkey"" off of morphine (I wanted to stop taking it, but not exactly that way!).  Life is so much better without daily pain medicines and I found a neurologist who took me all the way up to 400mg/day on Topamax.  I did start to have some more weight loss and taste issues and sleepiness, but my migraines became much more manageable with Imitrex and much less frequent.  That is down to maybe once a week from near daily."""
Migraine Prevention,9.0,"""I highly recommend over many of the other medicines that are supposed to do the same thing. Does not cause weight gain either."""
Obesity,9.0,"""After getting a blistering skin rash from Lamictal, Topamax was prescribed.  It did decrease my appetite- I went from 209 lbs back to my regular 135 which I hadn't been in 7 years. This took place in about 10 months.  At abt the same time I started taking it, I was rearended and suffered a MTBI and scored very low on my neuropsych exam. My old psychiatrist retired and the new psychiatrist is against Topamax bc of the ""foggy"" side effects that are common.  Now, a little over a year later, I feel ok abt this med considering the alternatives- wish there were better alternatives!"""
Migraine Prevention,9.0,"""Minimal side effects, some tingling in hands and feet, some ""topamax moments""...trouble finding words to complete sentences, etc.  Did experience a 30 lb. weight loss, which I didn't mind. But most of all it drastically decreased the migraines!! And if I do have one, it is very managable."""
Obesity,9.0,"""I've tried in twice. First time about 7 years ago and lost a modest amount of weight easily. I can't remember how much. It made me thirst, so I drank a lot of water and it took away my craving for junk food. 

Send time was end of May, 2016. 100mg at night.  I lost 10 pounds in about 5-6 weeks easily. No desire to snack or eat emotionally. Only downside was that I was anxious a lot. I've now plateaud but at least I'm not gaining weight. I should try to up the dose. At least the anxiety has largely decreased."""
Migraine Prevention,9.0,"""My neurologist was right. The trick is starting dose low and building up a week at a time, letting your body get used to it. I'm up to 75mg and holding."""
Migraine Prevention,9.0,"""I began taking Topamax about a year ago after suffering from weekly migraines since age 15. I increased the dose to 200mg a day before it seemed to be a therapeutic dose for me. My migraines reduced a lot for a long time but I also do not drink alcohol, caffeine, or eat chocolate, cheese. The last few weeks my migraines are back with great intensity. One lasted 4 days. So I will be going back to my doctor. Topamax did not affect my appetite at all. I get occasional tingling."""
Obesity,9.0,"""I started at 25 mg for a week then went up to to 50 mg. started losing weight right away. I started at 195. Lost 10 pounds the first month. Started in June now it's sept and I weigh 170.  After 2 and 1/2 months the doc raised it to 100mg.  And now it doesn't seem to be working as well. She raised it again to 150mg so I'll see how that works out . I still want to lose 20 more pounds. My insurance didn't pay for it but I did find a coupon on line and it saved me aot."""
Seizure Prevention,9.0,"""I've been on this medication for 3 years now for my seizures (50mg/2 daily) and have not had any episodes since.  At first I would get a tingling feeling in my fingers and toes (like soda fizz), but it went away once my body was used to the drug.  Recently, my pharmacy switched me to the generic version and I hated it. Immediately that first day, I would get crazy headaches, feel dizzy, sick to my stomach and I couldn't concentrate on anything. I went back to my neurologist and got a new prescription for brand name only and have not had any problems since. I was also still using the drug during my recent pregnancy and am happy to report no problems or side effects what-so-ever."""
Diabetic Peripheral Neuropathy,9.0,"""Topamax has helped my diabetic nerve damage more than any other drug that my doctor has prescribed for me, and it does not have all the other nasty side effects, including the weight gain.  I get enough of that from the insulin.  I love taking the Topamax.  I'm on a low dose (25 mg) but it sure has helped me."""
Fibromyalgia,9.0,"""This has been a wonder drug for me when combined with Cymbalta. I have suffered for years and had been on narcotic pain killers. The pain had finally gotten so bad that even those weren't working. I work in Pre-K and didn't want to give up my job to become a disabled person living at home on pain killers. I found an awesome Doctor who understood that I didn't want to live on those types of medications. After only two visits she tapered me off of the medicines I was on and started me on Topamax along with Cymbalta. That is all I take. No more pain! Life is wonderful again."""
Migraine Prevention,9.0,"""There are a few ways to get rid of one of the most annoying side effects, the tingling hands and feet. Potassium- I used to eat a banana or drink fruit juice high in potassium.
All of my side effects went away after 2 yrs on Topamax. It is hard to ween off of. I have not taken a pill for 2 mths and have far less headaches than before Topamax!!
Great drug! I lost almost 30lb but once we found the right dosage I leveled out and stayed that weight for a yr before weening off."""
Obesity,9.0,"""I have been on Topamax for around two months. I decided to go on them because I weighed around 105 kgs, I was feeling depressed and I couldn't stop binge eating. Through Topamax, I have lost 10 kgs in one month (that would be around 22 pounds). I feel so much better. My urge to binge eat is gone. I feel human again. I don't feel any side effects. I sleep better than before, I drink more water than before (as much as I should drink, before I didn't drink at all and had problems with my kidneys). When I first started topiramate, I got double vision. I read that this was a common side effect and saw my eye doctor about it. She said that it was because my vision improved a great deal. So, thank you Topamax, My health greatly improved."""
Migraine Prevention,9.0,"""This medicine changed my life. I went from bedridden to active. I still get flare ups, but I can function in them now. My pain is greatly reduced. I no longer have constant flu like symptoms or muscle spasms. My pain has been reduced to a dull ache  and I can manage without narcotics. I unfortunately did show the rare side effect of hair loss. I solved that by cutting it short and dying it purple! Topamax is also sold as a diet pill, so I also lost about 40 pounds, which is helpful for a lot of fibromyalgia patients since we tend to gain weight from lack of activity or taking meds like Lyrica . In fact, I ended up on Topamax because my insurance wouldn't cover Lyrica. Best thing to ever happen to me since I became ill!"""
Migraine Prevention,9.0,"""I originally started on Topamax for Migraines and found it to be a 10  for that. I went from 4-5 monthly to maybe 2-3 per year. Life changing! It was difficult for my body to adapt to at first and I had to build up VERY slowly using 12.5mg for a few weeks in the morning and then adding an evening dose, etc. It made me feel horrible, tired, breathless, out of sorts and dopey overall but over time all that wore off and in addition to the absence of migraines I enjoyed a more even keel mood, more control over my decision making including less desire for alcohol. This made staying sober easier than at previous attempts. I also struggled less with eating issues. I've had to increase over time and take breaks/restart to manage the dosage amount vs tolerance."""
Migraine Prevention,9.0,"""Works extremely well to prevent my migraines."""
Migraine Prevention,9.0,"""Head injury, migraines with neuralgia. Topiramate was very key in my pain recovery. Amazing results, curious about anxiety attacks, or panic rapid uncomfortable feeling occasionally after taking, lasts about 20 minutes. Then just goes away. """
Migraine Prevention,9.0,"""I went on topiramate January 2012 for migraines with positive results. By the end of  2012 I had lost 85lbs, and 7 dress sizes. I had started out at 235lbs and ended up at 150lbs. My dose started out 25mg twice a day, then went up to 50 mg twice a day in two weeks, then was increased to 100mg, twice a day in 3months. At the end of my treatment, my dose was 300mg daily.  I had also lost the ability to form sentences, because I couldn't find words, and was constantly in a fog. That is not good if you're a nurse. Also my short term memory was non existent, also not good for an acute care medical nurse. By the time the side effects became so debilitating, I had to take a short leave of absence to sort out my situation because it affected my job performance. In the end, the medication was discontinued by my doctor and I gained 23lbs of the weight back. I'm not upset because now I have my short term memory back, plus I've returned to work and I'm migraine free.  I'm still better off because I'm still thinner than before I started with topiramate."""
Migraine Prevention,9.0,"""Topamax literally saved my life! I have been getting headaches often since I was 14 or so. They progressed to full blown migraines after my 3rd child (I was 28 in 2004)and increased from there. By 2008/2009 they had gotten so bad I was literally having paralysis on the left side of my face, could not keep my eyes open at all, severe vomiting. Once I had one there was no driving or I'd run off the road. Thankfully after getting no relief from several medications & including visits to the ER, ENT, and neurologist to try and figure out something... I was prescribed Topamax. Use 50mg a day with 2 Aleve & 500mg Magnesium. Pretty much wiped out my migraines. Got pretty much all the side effects...who cares? I'm not suffering everyday anymore. :)"""
Migraine Prevention,9.0,"""I've only been on this medication for 2 weeks now but it has changed my life. I have lived with chronic migraines since my entire life..since I was 18 months old. I have lived with daily headaches and almost daily migraines for the past 10 years and it has taken over my life. Since starting Topamax, I have had 2-3 manageable headaches and I have my life back! It has even taken away chronic fibromyalgia and arthritis pain, given me back my ability to sleep soundly for hours at a time, and has gotten me out of a daily triptan habit that almost caused a stroke a few weeks ago. The side effects (brain fog, drowsiness, etc) are nothing new for me given I have fibromyalgia. A life without pain is worth it to me! What a miracle!!"""
Migraine Prevention,9.0,"""Like many of you, I've suffered since I was a teenager with migraines 3-5 times a week. Some would be so serious I would end up in the hospital a few times a year. I even lost a job because of my migraines. I had to plan my life around them. Now at 35, I've been on Topamax for 6 years and it's changed my world. It's given me a life back. I'll still get an occasional headache that requires me to break out the Imitrex, but nothing serious. I haven't had too many problems with side effects other then having a little less quick recall/memory, but not enough to really matter. Potassium seems to help with the side effects. My main side effect is getting rash/hives from overheating. """
Migraine Prevention,9.0,"""Once I got past the side effects while titrating up to my standard dosage, I love it!  The side effects were rough, but you MUST start with a low dose and work up gradually, I would suggest not more than 50mg a week, until you reach your target dose.  I loved that it took also away my over- stitmulated appitete and I was able to reduce my BMI to 24."""
Bulimia,9.0,"""I been on this medication for almost a year and a half. I'm twenty years old turning twenty one and struggled with bulimia roughly for ten years now. I was in a treatment center when I was younger for a while, nothing really helped my bulimia. Therapy, nutritionists etc. All the work, DBT everything..honestly it wasn't until I started slowly on this medication. Now on 100mg and taking it with Wellbutrin XL 150mg (I also suffer from other issues) I find myself doing ALOT better..I'm seeing a nutritionist too along with therapy but really my medication has helped. Its great."""
Migraine Prevention,9.0,"""I just started back on Topamax after being off the medication for 4 years. I suffer from cluster headaches, when a cluster starts the debilitating headaches come everyday. The last time I took Topamax it stopped the cluster within a week. I continued working up to the full dose and the side effects gradually decreased (confusion, hard to concentrate, difficulty with finding the words to express my thoughts). I found that a lower dose kept the headaches away so I dropped down for a few months then came off the drug completely. Last week a new cluster started so I am back on the Topamax and have had a couple of headache free days already. This medication works well for me at a lower dose and limits the side effects."""
Migraine Prevention,9.0,"""I was just started on this medicine on February 13th, 2009. 25mg a day then after one week to increase to 50mg. Read some of the side effects here figured they must surely be on someone who is definitely on a higher dose.  Anyway, I am a person who is highly addicted to drinking coca cola. I drink like a 2 liter bottle a day.  Well, not any more.  This medicine has cured me of that in 2 days. All carbonated beverages taste flat like Robitussin cough medicine. Good side is that'll help me lose weight and the better side is I have yet to have my headache."""
Bulimia,9.0,"""It helps. For me it wasn't so much the appetite suppression that worked, but the way it makes me more conscious of the situation before I binge. Its makes me stop in the middle of the binge or just before completely,  and ask myself whats up with the need to hit the self destruct button. 

In case that I do binge on Topamax, my binges consists of less food when. And I eat slower, defeated by the situation."""
Migraine Prevention,9.0,"""I've been using Topiramate for over a month now. I'm 50 years old, female and have hypothyroidism taking 150mcg of Synthroid daily. I suffered from increasing frequency and duration and intensity of migraines. In the past year the Immitrex wasn't working as it used to so my doctor prescribed Topiramate. I'm up to 50mg per day. The only side effect I've had is mild dry mouth. And no migraines. None. I went from 2 or 3 a week to ZERO migraines in over a month. I am very happy with this medication. The only reason I gave it a 9 is because I'm a tough scorer.  :)"""
Migraine Prevention,9.0,"""At 42 and suffering migraine attacks with aura from a young age I have tried lots of meds,acupuncture with no real success,I started of on 25mg of topamax then increased a month later to 50 mg which made me like a ticking time bomb towards my family so dropped back to 25mg at night no more and been having excellent results,when I do get a migraine the pain is very minimal  if any and can continue working which would never happen before I would be out for days ,just stay on low dose ,I find once well in your system works well."""
Migraine Prevention,9.0,"""I've had cronic migraines since I was 14 and I was put on topamax at 16 at 50mg  I've been on it for 4 years now and its worked great for me until recently when I delt with the loss of my father and started experiencing light head aches so my doctor upped me to 100mg, 50mg in the morning and 50mg at night and I haven't gotten a migraine since. Its also helped me as a mood stabilizer too, I would recommend this medication if over the counter drugs aren't working for your migraines it really does wonders"""
Tourette's Syndrome,9.0,"""Topamax/Topiramate has been wonderful for tic reduction. I have a fairly obvious case and they are exhausting and embarrassing. I have minimal to no side effects, a little drier mouth perhaps, plus my 15/20 vision reduces to 20/20. I feel less anxious and less ""pressure/need"" to tic. I can take much lower doses of the brand name to achieve the same effect with the generic; but my insurance won't cover the brand name. It's 100mg twice/day generic versus half that amount brand version. It's still worth it!! I feel so much more in control and ""almost normal""."""
Bipolar Disorder,9.0,"""Over the edge..best thing ever!"""
