source_name,review_date,critic_name,review_detail
Film Ireland Magazine," January 3, 2017",James Phelan," Even by Saturday night multiplex standards, the whole thing starts to feel frightfully slight. Amiable performances alone aren't enough."
Washington City Paper," January 2, 2017",Noah Gittell," The Coens, for once, aren't interested in plot at all, instead choosing to luxuriate in the styles of yesteryear. Johansson and Channing Tatum get to do glamorous musical numbers; Clooney has a ball with his swords-and-sandals epic."
MetroActive," December 31, 2016",Richard von Busack, It's easy to be charmed by the gang of actors. It's less compelling to wonder whether Mannix should continue to serve God or Mammon.
The Mary Sue," December 31, 2016",Lesley Coffin," If Llewyn Davis was about an artist learning to appreciate and collaborate with his audience, this reminds us that before the Coens were movie makers, they were movie watchers."
Out Magazine," December 30, 2016",Armond White," Maybe the campiness of Hail, Caesar! can help educate viewers about the history of gay codes and erotic symbolism."
Salt Lake Tribune," December 30, 2016",Sean P. Means," The Coens show their strongest belief, like Eddie's, is an unshakable faith in the power of movies."
Columbus Alive," December 30, 2016",Melissa Starker," If you're among the Coen brothers' faithful, you'll find much to admire and gags that hit like a ton of bricks, though you'll probably wish there were more of them."
MovieMail," December 19, 2016",Mike McCahill," Hail, Caesar! is finally all too effortful, a doodle undertaken by scholars."
Sunday Times (UK)," December 18, 2016",Camilla Long, A bonkers caper.
Movie Habit," December 12, 2016",Robert Denerstein," Hail Caesar! may not rank at the top of Coen's impressive list, but it should do nothing to sour anyone on their work. My advice: Treat the movie as a smorgasbord. Pick what you like; forget the rest."
Film Inquiry," December 6, 2016",Jay Ledbetter," A middling effort by the Coen Brothers' standards is still a damn good film, and that is exactly what Hail, Caesar! is."
Irish Independent," December 5, 2016",Paul Whitington," Hail, Caesar! should be a lot of fun, but is essentially a collection of nicely written scenes held together by nothing."
rec.arts.movies.reviews," August 31, 2016",David N. Butterworth," I enjoyed their films. Particularly the early, good ones."
CineXpress," August 19, 2016",Fico Cangiano," A nice trip to the past thanks to the amazing performances, beautiful photography and light humor. [Full review in Spanish]"
Chesapeake Family Magazine," August 2, 2016",Roxana Hadadi," Hail, Caesar! imagines the inner dealings of Hollywood during the early 20th century ... But the film's point for these shenanigans is possibly nonexistent."
RTÉ (Ireland)," July 26, 2016",Alan Corr," In what could be the most Coen Brothers movie ever, the masters of bone dry irony and quirk line up an all-star cast to pay homage to an era of Hollywood when actors were indeed cattle and movies dripped with glamour and the promise of escape. "
Washington Free Beacon," July 14, 2016",Sonny Bunch," Instant-classic Coen comedy comments upon, and celebrates, the studio system."
El Universal," July 11, 2016",Alejandro Alemán," Not only is this one of the funniest films of the year, it's an irresistible game of references to classic cinema. [Full review in Spanish]"
Antagony & Ecstasy," July 10, 2016",Tim Brayton, It is the Coens' Christian movie - specifically Catholic - in much the same way that their under-appreciated A Serious Man was their Jewish movie.
Seanax.com," June 16, 2016",Sean Axmaker," The Coen mix of subtle wit and broad slapstick is all over the film, which hopscotches across stories and soundstages at a snappy pace, and they poke fun at everything except the joy of movies."
New York Daily News," February 3, 2016",Joe Dziemianowicz," It's fun and entertaining - no more, no less, no exclamation point."
Compuserve," February 2, 2016",Harvey S. Karten," A day in the life of a movie ""fixer"" forms the unifying bond in a delightful film that satirizes and pays homage as well to 1950s pictures."
Village Voice," February 2, 2016",Melissa Anderson," [It] has a certain buoyancy ... The fizziness, though, proves fleeting, and Hail, Caesar! too often goes flat."
Forbes," February 3, 2016",Scott Mendelson, The picture is such an affectionate ode to the business of movies and the potential for cinematic wonder that I'm half-inclined to presume that its flaws are intentional.
Metro," February 3, 2016",Matt Prigge," Another rumination on the distractions that fill our existence, just couched in a film that's catnip to both Coen heads and TCM addicts."
Uproxx," February 3, 2016",Mike Ryan," Hail, Caesar! is just one of those things you have to experience."
Us Weekly," February 3, 2016",Mara Reinstein," George Clooney, Scarlett Johansson, Josh Brolin, Jonah Hill, Ralph Fiennes and Channing Tatum must really, really, really, really, really, really love working with writer-directors Joel and Ethan Coen. "
TheWrap," February 3, 2016",Alonso Duralde, The Coens revel in both the glamour and the squalor of post-war Hollywood with a film that more than makes up in wit and flash what it might lack in substance.
CraveOnline," February 3, 2016",William Bibbiani," It may not rank amongst The Coen Brothers' best work, but few films do. It's still a high-spirited comedy of the highest order, smart and hilarious."
Screen International," February 3, 2016",Tim Grierson," After focusing in recent years on somber comedies such as ""A Serious Man"" that tackled existential themes, the Coens have turned their attention to a zany Hollywood-golden-age lark ... which ends up being consumed by some of the same questions."
Hollywood Reporter," February 3, 2016",Todd McCarthy," The Coens' reimagining of a real Hollywood tough guy is interesting for insiders, but in their first order of business, that of making a rousing comedy about the Hollywood of 65 years ago, they've fallen rather short."
Critic's Notebook," February 3, 2016",Martin Tsai," It's basically a 106-minute in-joke on the studio system heyday, complete with lovely period details of sets, costumes and visual effects. "
indieWire," February 3, 2016",Eric Kohn," A charming consolidation of their appeal that both celebrates and mocks its target. In short, catnip for Coen fans."
Guardian," February 3, 2016",Andrew Pulver," Hail, Caesar! is a lot of fun, and beautifully crafted, too. One to savour."
Total Film," February 3, 2016",Jamie Graham," Hail, Caesar! is a love letter inked in arsenic, at once celebrating the artistry of Hollywood and cringing at the crass commercialism and rampant phoniness of it all."
Newark Star-Ledger," February 3, 2016",Stephen Whitty," Set at an ersatz MGM, the film fudges some period details but gets almost everything else right - the studio's rich Technicolor palette, a movie-musical style just teetering on the edge of camp."
USA Today," February 3, 2016",Brian Truitt, The combination of the Coen brothers' filmmaking acumen and George Clooney in absolute buffoon mode is again Hollywood magic.
Variety," February 3, 2016",Justin Chang, An inside-showbiz lark that regards the 1950s studio system with the utmost skepticism even as it becomes an expression of movie love at its purest.
TheFilmFile.com," February 3, 2016",Dustin Putman," An original, unapologetically larkish escapade. ""Hail, Caesar!"" is a blessed blur of movie-style artifice and silly behind-the-scenes exposé of 1950s La La Land."
Movie Nation," February 3, 2016",Roger Moore," A swing, and a miss!"
Time Out," February 3, 2016",Joshua Rothkopf," Hail, Caesar! weds the backstage Hollywood shenanigans of Barton Fink to a more manic pace. It doesn't seem new for them, yet as super polished, mannered, slightly surreal comedies go, the movie feels as rare as a unicorn."
ScreenCrush," February 3, 2016",Matt Singer," One of the Coens' most serious pictures, as well as their silliest."
Slant Magazine," February 3, 2016",Jake Cole, Joel and Ethan Coen's idiosyncrasies elevate the film above the level of a mere creative exercise.
AllMovie," February 4, 2016",Violet LeVoit," It's a strange puzzle box of a movie, as impenetrable in its own way as Mulholland Drive, and its slippery, shape-shifting nature defies all of the usual critical assessments, except one: It's worth seeing."
Fort Worth Star-Telegram/DFW.com," February 4, 2016",Preston Jones," Tinseltown may not make 'em like they used to, but fortunately for 21st-century audiences, the Coen brothers can still make an audience believe."
Philadelphia Inquirer," February 4, 2016",Steven Rea," A goofy conflation of Coenian elements: the numbskull huggermugger of The Big Lebowski, the La La Land surrealness of Barton Fink, the Old Testament overlay of A Serious Man."
Seattle Times," February 4, 2016",Moira MacDonald," ""Hail, Caesar!"" isn't the great film you might like it to be, but it's very, very good fun."
Hollywood & Fine," February 4, 2016",Marshall Fine," Like a long, entertaining shaggy dog story without a punchline...just sit back and let it wash over you in all its witty, if insubstantial goodness."
Las Vegas Weekly," February 4, 2016",Josh Bell, The Coens are less successful at combining those sporadically entertaining elements into a cohesive movie.
Looking Closer," February 3, 2016",Jeffrey Overstreet, This is one of those rare occasions where the Coens' aesthetics upstage their writing and unbalance their momentum.
Movie Guys with Jeff & Dave," February 3, 2016",Jeffrey K. Howard, Too confusing even for The Coen Brothers - lacks any creative direction and stretches itself too thin and falls apart. 
Vanity Fair," February 3, 2016",Richard Lawson," Like life, much of what's funny about Hail, Caesar!, the new film from Joel and Ethan Coen, is also what makes it a little sad."
We Got This Covered," February 3, 2016",Matt Donato," Hail, Caesar!? More like ""Hail, Channing!"" - am I right?"
honeycuttshollywood.com," February 3, 2016",Kirk Honeycutt, The Coen Bros. spin their wheels by calling so much attention to every stab at humor.
San Jose Mercury News," February 3, 2016",Karen D'Souza," Perhaps the most disappointing aspect of the film is the nagging feeling that the Coens do indeed have something fascinating to say about the inner workings of Hollywood, but the flailing ""Hail, Caesar!"" isn't it."
Film School Rejects," February 3, 2016",Christopher Campbell," One of the duo's most intricately and wholly thematic movies, and yes, one of their least satisfying in its superficial narrative. Also, extremely silly. Even for the Coens."
Tribune News Service," February 3, 2016",Katie Walsh," Both a love letter to and a gentle skewering of Hollywood's studio system, a wildly entertaining romp through history that also keenly reflects its present."
RedEye," February 3, 2016",Matt Pais, Too funny to dismiss and too mild to endorse.
Entertainment Weekly," February 3, 2016",Leah Greenblatt," It's Coen lite, basically, but still filled with their best signatures: cracked humor, indelible characters, and cinematography so rich and saturated you want to dunk a cookie in it."
Arizona Republic," February 3, 2016",Bill Goodykoontz," While individually some of the scenes are terrific, they don't add up to much, making ""Hail, Caesar!"" one of the Coens' lesser comedies, better than ""Intolerable Cruelty,"" say, but nowhere near the genius of ""The Big Lewbowski."""
"City Pages, Minneapolis/St. Paul"," February 3, 2016",Michael Nordine," They may not make them like they used to, but at least they still make them like this."
RogerEbert.com," February 3, 2016",Glenn Kenny," A comic fable that's both deftly clever and irrepressibly goofy. It is also, from stem to stern, the sweetest and sunniest film the Coens have ever made."
Examiner.com," February 3, 2016",Travis Hopson, This journey down memory lane is worth the trip but won't rank among the brothers' more substantial efforts.
Rolling Stone," February 4, 2016",Peter Travers, A wild whoosh of Coen brothers wizardry that left me laughing helplessly and filled with spiritual dread. That's the Coens for you. They're indispensable.
Daily Telegraph (UK)," February 4, 2016",Tim Robey," Hail, Caesar! keeps stumbling over its own best ideas as we stop to appreciate them - ditching momentum, preferring gaps for applause."
One Guy's Opinion," February 4, 2016",Frank Swietek," Impresses more as a fitfully engaging exercise than a fully realized vision... But to render unto 'Caesar' its due, the movie does deliver sporadic amusement and a few absolutely spectacular sequences. "
Charlotte Observer," February 4, 2016",Lawrence Toppman," ""Hail, Caesar!"" Hail? No. Maybe a faint nod of mild approval, but that's all."
Washington Post," February 4, 2016",Ann Hornaday, It's difficult to remember a recent movie so tartly on-point in skewering a power-driven industry obsessed with such seemingly meaningless ephemera as screen-credit and commissary pecking orders.
Slate," February 4, 2016",David Ehrlich," If the Coen brothers' dramas are cautionary tales, their comedies are veritable how-to guides for people who can't help but enjoy a mirthless chuckle at the humility of human existence. Yeah, the joke is on us, but that doesn't mean it isn't funny."
Chicago Daily Herald," February 4, 2016",Dann Gire," It's tappy, slappy, snappy and happy."
Miami Herald," February 4, 2016",Rene Rodriguez," ""Hail, Caesar!"" isn't the first time brothers Joel and Ethan Coen have made a dud comedy. But they've never made one that was this half-baked and lazy."
Chicago Tribune," February 4, 2016",Michael Phillips," The tone of ""Hail, Caesar!"" is even and assured, yet the comic inspiration is sporadic. Something's missing; the momentum sputters ..."
Salon.com," February 4, 2016",Andrew O'Hehir," Underneath the laff-riot and the Hollywood satire, ""Hail, Caesar!"" is a curiously delicate film built on profound affection for American movies and the illusions they build ..."
San Francisco Chronicle," February 4, 2016",Mick LaSalle," ""Hail, Caesar!"" is a flimsy construction that depends on a zany spirit and the charm of individual scenes to hold it together. There are times when this begins to feel like a dubious strategy, but each time the movie rights itself."
TIME Magazine," February 4, 2016",Stephanie Zacharek," Hail, Caesar! doesn't completely hang together. But Johansson in a mermaid's tail? Really, why else make movies-or go to them?"
Austin Chronicle," February 4, 2016",Marc Savlov," It's both more and less than the sum of its parts, but its never less than thoroughly watchable."
St. Paul Pioneer Press," February 4, 2016",Chris Hewitt (St. Paul)," If you still get a thrill from seeing the MGM lion or hearing the Twentieth Century Fox fanfare, then that's - or, rather, ""Hail, Caesar!"" is - entertainment."
AV Club," February 4, 2016",Ignatiy Vishnevetsky, Somewhere in there are stretches of the Coens' funniest comedy since The Big Lebowski; it just takes a little patience.
ScreenAnarchy," February 4, 2016",Jason Gorber," A New Testament, a riff on the Coens' references, a love letter to a lost age. It's, in short, kind of astonishing. "
ComingSoon.net," February 4, 2016",Scott Chitwood," If you're a Coen brothers fan, this is well worth checking out in theaters."
Bullz-Eye.com," February 4, 2016",David Medsker," Hail, Caesar! features two slices of bread, some turkey, lettuce, tomato, cheese and mustard, yet at no point does the movie seem to realize that it can take all of those ingredients and make a sandwich."
Film Journal International," February 4, 2016",Kevin Lally," Hail, Caesar! has just enough entertainment value to merit a guarded recommendation. But [...] it likely won't be hailed as one of the Coens' best."
The New Republic," February 4, 2016",Will Leitch," Hail Caesar! is pure Coenism, for better or worse."
Toronto Star," February 4, 2016",Peter Howell," The Coens have replaced the acid in their pens with honey, for now at least, and the result is an affectionate comedy that is also one of their most satisfying achievements."
National Post," February 4, 2016",Chris Knight, Makes for a delightful if forgettable mid-winter treat.
New York Times," February 4, 2016",Manohla Dargis," If this were anyone other than the Coens you might think that success and a couple of Oscars had mellowed them. Not likely. ""Hail, Caesar!"" is one of those diversions that they turn out in between masterworks and duds."
Toronto Sun," February 4, 2016",Bruce Kirkland," Stacked with an all-star cast led by George Clooney, Josh Brolin and Scarlett Johansson, and packed with 1950s details about how the Hollywood studio system operated in all its self-indulgent glory in that era, Hail, Caesar! is a sly satire."
FilmDrunk," February 4, 2016",Vincent Mancini, A brilliant excuse for the Coen Brothers to make sketch comedy out of a series of classic Hollywood genres. I could watch 10 hours of this. 
Times (UK)," February 4, 2016",Kate Muir," Hail, Caesar! is a playful romp through Hollywood's golden studio age when egos and cigars were vast and backlots were filled with divas, communists and salacious gossip."
Film Comment Magazine," February 4, 2016",Michael Sragow," By now, the Coen Brothers are reflexively called ""quirky."" The only perverse thing about this movie, though, is that it salutes a company man."
MTV," February 4, 2016",Amy Nicholson," In the dailies of Hail, Caesar!'s fictional Hail, Caesar!, a title card reads, ""Divine presence to be shot."" To the Coens, is that a promise or a threat?"
The Movie Minute," February 4, 2016",Joanna Langfield, Why don't we leave the Coen Brothers' 1950's Hollywood studio comedy walking on air? 
MovieWeb," February 4, 2016",Julian Roman," 'Hail, Caesar!' has no lack of star power, but falls decidedly flat in insufferably dull stretches. The Coen Brothers have a rare miss with their Hollywood golden age satire."
Tampa Bay Times," February 4, 2016",Steve Persall," The big book of Coen characters must be stuffed with ideas, paper scraps jotted with traits and scrapes for the next Dude, Barton or Marge to get into. Hail, Caesar! is what happens when that book is dumped open, contents fluttering into randomness."
Kansas City Star," February 4, 2016",Robert W. Butler," Go for the laughs. But don't expect the spell of ""Hail, Caesar!"" to stick with you beyond the closing credits."
Paste Magazine," February 4, 2016",Jim Vorel," Hail Caesar! is blandly enjoyable in spurts, based on the strength of key performances, but it wouldn't take much to make it that much better."
IGN Movies," February 4, 2016",Jim Vejvoda," Hail, Caesar! may not be one of the Coen Brothers' finest efforts, but it's nevertheless a fun, charming, and oft-hilarious take on Hollywood's Golden Age."
Cleveland Plain Dealer," February 4, 2016",Joanna Connors," This is one of those movies where the actors are plainly having a great time; they're all terrific and give the Coens loose, funny, deadpan performances."
Newcity," February 4, 2016",Ray Pride," If the Coens embed their japery that deeply, there's more to divine from this seemingly superficial, largely pop-poppy confection."
Chicago Sun-Times," February 4, 2016",Richard Roeper, This is one of my favorite movies ever made about making movies.
AtHomeInHollywood.com," February 4, 2016",Staci Layne Wilson, The Coen Brothers have done it again - made an ensemble crime caper comedy that's pure tinsel town gold!
St. Louis Post-Dispatch," February 4, 2016",Calvin Wilson," Hollywood craziness would seem to be ideal grist for the Coen Brothers' absurdist mill. Unfortunately, ""Hail, Caesar!"" comes across as far less than the sum of its parts."
Empire Magazine," February 4, 2016",Dan Jolin," Likely to fry the mind of anyone who hasn't yet built up a resistance to the brothers' foibles and predilections over the past 16 films, it's easily the most Coen-y Coen movie they've put out. But then, they are stealing from the best."
ABC Tucson," February 5, 2016",Phil Villarreal," All hail the Coens, but you're OK to wait til it's on Redbox for this one. "
HollywoodInToto.com," February 5, 2016",Christian Toto," The Coens rarely bother to craft compelling finales. With Hail, Caesar! they've thrown in the towel on the third act, too."
WaffleMovies.com," February 5, 2016",Willie Waffle, It's boring.
Killer Movie Reviews," February 5, 2016",Andrea Chase," If Douglas Sirk had directed a film noir written by Billy Wilder, it might have looked something like the latest thoughtful tangle of philosophy and whimsy from the Coen Brothers. "
Globe and Mail," February 5, 2016",Kate Taylor, There are an awful lot of subplots and comic characters but none of the actors in this star-studded cast is allowed to build his laughs and the Coens just abandon several of these vivid personalities along the way.
Minneapolis Star Tribune," February 5, 2016",Colin Covert," Rather than adding up to an interwoven story line, it's a long, rambling shaggy-dog story. I know there is a dog in it, anyway. What they intended this confusing tale to be overall, I have no idea."
EricDSnider.com," February 4, 2016",Eric D. Snider," Movies are the Coens' religion, and they're two of the best theologians currently working."
New England Movies Weekly," February 4, 2016",Daniel M. Kimmel, ...like watching Turner Classic Movies while under the influence. 
Beliefnet," February 4, 2016",Nell Minow, Flat-out funny and a love letter to the movies.
Independent (UK)," February 4, 2016",Geoffrey Macnab, This is one of the Coen brothers' jolliest and most carefree films - quite a surprise considering its subject matter. 
Associated Press," February 4, 2016",Jake Coyle," It's something like a summation of Joel and Ethan Coen's films: Meaning is a missing frame, human folly is the star and only the dialogue is divine."
Los Angeles Times," February 4, 2016",Kenneth Turan," A hipster mash note to the way things used to be, it will put a smile on your face and keep it there for the duration."
San Diego Union-Tribune," February 4, 2016",Anders Wright," Will it rile up your emotions, or make you truly question something, anything, like their best films can do, while still making you laugh? Hail the Coens, to be sure, but in this case, it's questionable."
Film Racket," February 4, 2016",Bill Gibron, a cool breeze on a sweltering day
L.A. Biz," February 4, 2016",Annlee Ellingson," A love letter to a silly, exasperating industry ... that nonetheless produces works of art that are mesmerizing, meaningful and, well, ""swell."""
NPR," February 4, 2016",Chris Klimek," They're not the types to go fumbling for profundity, those Coens. Profoundly funny will do."
Austin American-Statesman," February 4, 2016",Joe Gross, An intermittently effective mash note to Hollywood's post-war golden age.
Mark Reviews Movies," February 4, 2016",Mark Dujsik," Hail, Caesar! is an episodic romp, filled with unabashed adoration for the feats, follies, and foibles of Hollywood."
Wall Street Journal," February 4, 2016",John Anderson," ""Hail, Caesar!"" verifies a suspicion long held here, that the Coen brothers, Joel and Ethan, really hate the movies."
Boston Globe," February 4, 2016",Ty Burr," There are the serious Coen brothers movies, like ""No Country for Old Men"" and, um, ""A Serious Man,"" and there are the not-so-serious ones. ""Hail, Caesar!"" is the opposite of their serious ones, and it is delightful."
Spirituality and Practice," February 5, 2016",Frederic and Mary Ann Brussat, A light-hearted dramedy about a good man working in Hollywood.
Suburban Journals of St. Louis," February 5, 2016",Mathew DeKinder," ""Hail, Caesar!"" is little more than a goof and a laugh, but who better to take you on such a low-stakes venture than the Coen Brothers?"
EntertainmentTell," February 5, 2016",Stephen Silver," It's scattered, and full of ideas that don't quite connect with each other. But it's the most I've laughed at a Coen movie since Lebowski (FOX 29 Philly) "
ZEALnyc," February 5, 2016",Thelma Adams, Joyous chaos is what the Coen Brothers harness in their generous-spirited wet kiss to the industry they continue to master and remake. Bliss!
San Diego Reader," February 5, 2016",Matthew Lickona," Remember movies? The Coen brothers do. Westerns, romances, musicals, dance extravaganzas - the works. (All of which are on gorgeous, indulgent display here.) "
Screen It!," February 5, 2016",Jim Judy," The film feels scattershot at best. A few moments are fun or funny. Unfortunately, there are plenty of others that simply drag along for too long. (Full Content Review for Parents - Sex, Violence, Profanity, etc. - Also Available)"
Thrillist," February 5, 2016",Matt Patches, A deeply personal jaunt for the Coens ... also straight-up bonkers.
New York Magazine/Vulture," February 5, 2016",David Edelstein," Hail, Caesar! might play better on the small screen, where you can savor its fodder piece by piece."
PopMatters," February 5, 2016",Chris Barsanti," The Coen brothers' artfully conceived but strained satire of '50s Hollywood gets the look right, but little else."
Common Sense Media," February 5, 2016",S. Jhoanna Robledo," Coen brothers' madcap, funny take on old Hollywood."
"Capital Times (Madison, WI)"," February 5, 2016",Rob Thomas," Perhaps only the Coens, who have made some of the best movies of the last 30 years, would make a movie celebrating the value of mediocre Hollywood schlock."
Video-Reviewmaster.com," February 5, 2016",Steve Crum," The Coens have laced 'Hail, Caesar!' with enough visuals and double entendres that beg for multiple viewings to appreciate them all. "
