source_name,review_date,critic_name,review_detail
Reason Online," February 5, 2016",Kurt Loder, Gorgeous throughout. But the loosely structured narrative through-line isn't all that interesting...
Movie Mezzanine," February 5, 2016",Vikram Murthi," Hail, Caesar! is very, very funny with two or three of possibly the funniest scenes in the Coens' entire career..."
CinemaBlend.com," February 5, 2016",Eric Eisenberg," While it's not as narratively strong as most of the Coens' other great works, there's a good chance we'll be calling it one of the funniest movies of 2016."
Daily Film Fix," February 5, 2016",Jonathan W. Hickman," ""Hail, Caesar!"" is utterly delightful entertainment, eschewing dark moments while teasing big picture ideas. "
"Journal and Courier (Lafayette, IN)"," February 5, 2016",Bob Bloom," While ""Hail, Caesar!"" may not rank as one of the Coen brothers' best films, it does offer enough flashes of levity, wit and simple entertainment to have you smiling as you leave the multiplex."
Parade Magazine," February 5, 2016",Neil Pond," The Coens' gloriously goofy homage to the glory days of big studios, big stars and the big wheels that churned out the spectacles of Hollywood's dream factory from a bygone era."
Blu-ray.com," February 5, 2016",Brian Orndorf," ""Hail, Caesar!"" remains charming and intermittently hilarious, but there's a suspicious lack of oomph here, with Coen Brothers noticeably winded during this highly specific juggling act."
FromTheBalcony," February 5, 2016",Bill Clark," With Hail, Caesar!, it's baffling to see the Coens deliver something with next to nothing at stake and zero involvement from a character perspective."
ScreenRant," February 6, 2016",Sandy Schaefer," Hail, Caesar! is a funny and madcap, if unfocused, farcical salute to Golden Age Hollywood from the Coen Brothers."
CinemaDope," February 6, 2016",Glenn Lovell," ... obviously meant as a homage to the great Preston Sturges, the Coens' latest disappoints; it's a flimsy, surprisingly dour succession of double entendres, in-jokes, backlot vignettes ... "
The Patriot Ledger," February 6, 2016",Al Alexander," Unless you have a solid feel for Hollywood history, the Coens are going to leave you completely in the dark. But if, like me, you're a TCM junky, ""Hail, Caesar!"" is going to make you grin from ear to ear."
Creative Loafing," February 6, 2016",Matt Brunson," Whenever the Coens produce a breezy and straightforward comedy, many critics and fans grumble that they're simply coasting, they're making movies beneath them, and they're too valuable as filmmakers to simply offer nothing more than nyuks. Nonsense."
Patheos," February 6, 2016",Peter T. Chattaway," As an absurdist romp through Hollywood history and a provocative, deeply ironic riff on politics and religion and the things that give us meaning, Hail, Caesar! is a delight. As Mannix himself might say, the picture has worth."
New York Post," February 6, 2016",Lou Lumenick," Not one of the Coens' major works, but it's a very enjoyable lark, especially for fans of old Hollywood."
Tri-City Herald," February 5, 2016",Gary Wolcott," Ethan and Joel Coen flashback to 1950s Hollywood. It's their best film since O' Brother, Where Art Thou? and when the credits roll we all tip our hats and say Hail, Caesar. "
ReelViews," February 5, 2016",James Berardinelli," The more 1950s movies a person has seen and the greater their love for Hollywood of 60+ years ago, the greater their appreciation will be of what Joel and Ethan have brought to the screen."
Ex-Press.com," February 5, 2016",Jay Stone," Hail to the Coens, just for thinking of it."
Consequence of Sound," February 5, 2016",Collin Brennan," Hail, Caesar! satisfies that one criterion that matters most in Hollywood, and will for time immemorial: it's entertaining as hell."
Cinemaphile.org," February 5, 2016",David Keyes, How rare to arrive at the embrace of so much joy and enthusiasm in the midst of a perpetual nothing of a plot.
Cinemaclips.com," February 5, 2016",Roger Tennis," This is a mixed bag Coen Brothers comedy that works best as a farcical tribute to the Golden Age of Hollywood. Is 'Hail, Caesar!' worth seeing? Hail, yes! "
Reel Reviews," February 5, 2016",Frank Wilkins," Finds a challenging and stimulating way to poke a bit of harmless fun at the brutal hypocrisy of Hollywood's system, while at the same time making it feel like a loving pat on the back."
Aisle Seat," February 5, 2016",Mike McGranaghan," An old Hollywood tale as only the Coen Brothers could tell it. If you love movies from the '40s and '50s, you'll see affection buried within the often uproarious parody of the on- and off-screen cinematic world at that time."
Birth.Movies.Death.," February 5, 2016",Meredith Borders," With HAIL, CAESAR!, Joel and Ethan Coen skewer and celebrate old Hollywood in equal turns, delivering a screwball movies-in-a-movie picture that satisfies in every particular."
Christian Science Monitor," February 5, 2016",Peter Rainer," The film is often​ sharp and amusing, but it's a doodle in the Coen canon."
Newsday," February 5, 2016",Rafer Guzman," ""Hail, Caesar!"" obeys the first commandment of filmmaking, attributed to the old master Billy Wilder: Thou shalt not bore."
Toledo Blade," February 5, 2016",Kirk Baird," Like most of the Coens' work, Hail, Caesar! has multiple levels to nod at and appreciate -- like the cigarette metaphor and the loving recreations of film genres: westerns, musicals, biblical epics."
NY1-TV," February 5, 2016",Neil Rosen," Hail, Caesar! is a bit disjointed and the story fall apart by the end, but who cares? It is an often-hilarious valentine to movie making in another era, and a good one at that."
Artforum," February 5, 2016",Nick Pinkerton," Joel Coen and Ethan Coen's Hail, Caesar! is the most deliriously enjoyable photoplay to open wide in what's thus far been a pretty barren new year -- and also a seriously funny comedy of ideas."
Missoula Independent," February 11, 2016",Molly Laich," Hail, Caesar! is a great surprise for film lovers looking for a mood enhancer in these final, gloomy weeks of winter."
Laramie Movie Scope," February 11, 2016",Robert Roten," It is the best comedy ever by award-winning directors Ethan and Joel Coen, but much of its content will probably go right over the heads of most people in the audience. This screwball satire is both smart, and silly."
Reno News and Review," February 11, 2016",Bob Grimm," The Coens are just goofing around with this one, and it's still better than most movies being released these days. "
The Atlantic," February 11, 2016",Christopher Orr," An unexpectedly sweet and utterly satisfying confection, a loving sendup of the Hollywood of yesteryear."
NOW Toronto," February 10, 2016",Norman Wilner," Movies like Hail, Caesar! are the reason I will follow Joel and Ethan Coen anywhere."
Playboy Online," February 10, 2016",Stephen Rebello," For all its ""Hooray for Hollywood"" sparkle and highly welcome down-with-Hollywood bile, this dream machine blows its gaskets with too many flat non-scenes, stale jokes and pointless cameos."
"Mountain Xpress (Asheville, NC)"," February 10, 2016",Ken Hanke, The Coen Brothers in a gleefully playful mood with a film that at once spoofs and honors the last days of the old Hollywood.
Reverse Shot," February 10, 2016",Adam Nayman," An enjoyable, well-made movie filled with amusingly stylized performances by famous actors."
Vox," February 10, 2016",Todd VanDerWerff," Hail, Caesar! is a big, Looney Tunes confection of a movie."
Truthdig," February 10, 2016",Carrie Rickey," In this unapologetically frivolous entertainment about the fixer who has a choice between 27-hour-days at the studio or a 9-to-5 in aerospace, our audience surrogate prefers illusion to reality. And who can blame him?"
Q Network Film Desk," February 10, 2016",James Kendrick," The Coens clearly have something to say about Hollywood's irresolvable dedication to art and commerce, but the uneven, shaggy-dog nature of the film's scattershot comedy buries most of it."
tonymacklin.net," February 10, 2016",Tony Macklin," Hail, Caesar! is the Coen Brothers at their mildest."
Kaplan vs. Kaplan," February 9, 2016",David Kaplan," For such a star-studded cast, most of the Coen brothers' latest effort, ""Hail, Caesar!"", falls flat. "
Tolucan Times," February 9, 2016",Tony Medley," Not uproariously funny, still the Coens did a superb job of creating a parody that captures the ambience of the era with a light hearted, comedic touch."
Mark Leeper's Reviews," February 9, 2016",Mark R. Leeper, several humdrum stories do not make for a compelling overall plot. 
LarsenOnFilm," February 8, 2016",Josh Larsen, ...a meta comedy that wants to deflate the pretensions of Hollywood even as it's giving the movies themselves a giant hug.
The ARTery," February 8, 2016",Sean Burns," Another epistemological prank from cinema's snarkiest philosophers, ""Hail, Caesar!"" is a Passion Play played for giggles, with the Golden Age of Hollywood serving as the garden of Gethsemane for yet another in the Coens' long line of serious men."
ReelTalk Movie Reviews," February 7, 2016",Betty Jo Tucker, All the watchable performances make this uneven Coen Brothers movie worth seeing. 
The Young Folks," February 7, 2016",Tyler Christian," Despite how many problems I had with the film's inconsistent narrative, the Coens still manage to make the overall experience quite entertaining. "
London Evening Standard," February 7, 2016",David Sexton," Hail, Caesar! is a hoot, the Coen Brothers in their most PG Wodehouse mode."
The List," February 16, 2016",Eddie Harrison," A frothy, silly concoction that curdles into a sagging soufflé long before its time is up."
"Quad City Times (Davenport, IA)"," February 12, 2016",Linda Cook, 'Hail Caesar!' pokes fun at and embraces Old Hollywood simultaneously.
People Magazine," February 12, 2016",Alynda Wheat," It's all nuts, and the actors couldn't be having more fun."
Nerdist," February 12, 2016",Kyle Anderson," It's about putting in everything we know about Classic Hollywood in a single, hilarious package."
"Deseret News, Salt Lake City"," February 12, 2016",Josh Terry," Fresh and bubbling with personality in places, but lacking that final piece that will bring the picture together."
KPBS.org," February 12, 2016",Beth Accomando," As with the Coens' other films, a single viewing doesn't always reveal what the film's true intentions and meaning are."
The Verge," February 12, 2016",Tasha Robinson," As Coen movies go, this is one of the most upbeat and optimistic, one of the few to suggest that good people can have happy endings. Classic Hollywood wouldn't have it any other way."
Tulsa World," February 12, 2016",Michael Smith, It's not as clever as either the exceptional [Inside Llewyn Davis] or the very good [A Serious Man].
NUVO Newsweekly," February 12, 2016",Sam Watermeier," Hail, Caesar! seems like a lark -- an inessential Coen Brothers film. It's not one of their best, but beneath the surface of this Old Hollywood satire lies a comforting statement from the siblings about their plans for the future."
Dark Horizons," February 12, 2016",Gary Dowell," A slap-happy valentine to the Technicolor heyday of Hollywood that lands somewhere between the trippy brilliance of The Big Lebowski and the goofball parable of O Brother, Where Art Thou?"
Cambridge Day," February 12, 2016",Allyson Johnson," Visually the film is stunning, with Roger Deakins returning to the Coen fold with some eye-popping work, the underwater scene and a dusk car scene being particular highlights."
BuzzFeed News," February 12, 2016",Alison Willmore," The Coen brothers' new comedy isn't quite an homage to 1950s Hollywood, but it's not a spoof of it either -- it strikes that tone of crisp drollness that's their specialty and that some people misread as aloofness or contempt. But it's not."
Salt Lake City Weekly," February 12, 2016",Scott Renshaw," Few contemporary filmmakers create works that require more reflection than the Coen brothers -- and that applies even when they're turning out one of their ""lighter"" comedies."
Reeling Reviews," February 12, 2016",Robin Clifford," The individual parts are each greater than the whole but I hoped, this being from the brothers, for something the other way around."
Georgia Straight," February 12, 2016",Ken Eisner," Few filmmakers working today have a deeper love of studio lore than do the Coen brothers, and here the veteran writer-directors render unto Hollywood what is Hollywood's, and so much more."
ReviewExpress.com," February 12, 2016",Diana Saenger, Somewhat confusing but funny and Channing Tatum dance routine tops!
The Skinny," February 12, 2016",Patrick Gamble," The Coens' funniest film in over a decade, and although the tone is light and breezy, there remains a sinister undercurrent behind the film's glamorous artifice."
HeyUGuys," February 11, 2016",Stefan Pape, An in-joke that we can all be in on.
Reeling Reviews," February 11, 2016",Laura Clifford, Who but the Coen brothers could make a Christ allegory with the Imperial Garden Chinese restaurant as the desert where Jesus is tempted?
Chicago Reader," February 11, 2016",J. R. Jones," This is fairly amusing if you can get past the Coens' erasure of the anticommunist witch hunts, which destroyed hundreds of lives."
"Star-Democrat (Easton, MD)"," February 25, 2016",Greg Maki, ... It's nice to see the brothers devote their time and energy to something this fun.
Herald Sun (Australia)," February 24, 2016",Leigh Paatsch, This is very much a loopy lark concerned with a lost past Hollywood will never reclaim.
Student Edge," February 24, 2016",Simon Miraudo," When it comes to the Coen brothers, you can always believe the hype. Maybe just don't believe the trailers."
The Popcorn Junkie," February 23, 2016",Cameron Williams, A prestigious eye-roll at the ridiculousness of looking for meaning in the institution of show business and every 'ism' vying for a stake of influence
BBC.com," February 23, 2016",Nicholas Barber," Hail, Caesar! is that rare beast: a feel-good Coen brothers film. It feels very good indeed."
Collider," February 23, 2016",Matt Goldberg," While the Coen Brothers don't show any signs of abandoning movies, Hail, Caesar! shows Hollywood on a precipice, and openly wondering if its followers will remain faithful."
Urban Cinefile," February 22, 2016",Andrew L. Urban," The wry tone, the dry wit and the sometimes not so dry moment (eg synchronised water dancing led by the irritable (and pregnant) DeeAnna Moran (Scarlett Johansson), serve as flavouring to this Coen brothers movie meal"
Urban Cinefile," February 22, 2016",Louise Keller," A burnt out Hollywood Executive, a kidnapped movie star, a tenacious gossip columnist and a study group with communist tendencies are some of the scrumptious characters in this latest Coen Brothers jewel"
Blog de cine," February 22, 2016",Sergio Benítez, A film that knows how to laugh at itself and those things it represents without being coarse or easy. [Full review in Spanish] 
Little White Lies," February 22, 2016",David Jenkins," Every new scene is a surprising delight in what, at the time, appearing as a sunny, screwball satire pinpointing the moment where the Hollywood production line was starting to clank and creak."
Ozus' World Movie Reviews," February 21, 2016",Dennis Schwartz, Has some sparkle as it reaches for a happy ending.
The Australian," February 19, 2016",David Stratton," Although it's beautifully crafted, filled with amusing detail and in-jokes and cast with the Coens' usual deft precision, it all falls a little flat."
Arts Fuse," February 19, 2016",Gerald Peary," The Coen brothers, Joel and Ethan, provide an on-target parody in Hail, Caesar!, their funny period comedy set in Hollywood of the 1950s."
Sensacine," February 19, 2016",Quim Casas," The latest film from the Coen brothers seems like a minor title, a tribute to the classic films of Hollywood. [Full review in Spanish]"
El Pais (Spain)," February 19, 2016",Carlos Boyero," Yes, it's funny. But some gags just drag for too long. It's obvious the Coen's enojued making this film. [Full review in Spanish]"
The Film Stage," February 19, 2016",Michael Snydel," Hail, Caesar! is simply a delight from first to last frame."
Seven Days," February 19, 2016",Margot Harrison, One of the things the Coens may or may not be ridiculing in this award-season release is Hollywood's earnest faith in itself.
Blog de cine," February 18, 2016",Mikel Zorrilla," Might not be the best Coen Brothers film, and yet it showcases their talent and is a really enjoyable treat. [Full review in Spanish]"
ChristyLemire.com," February 18, 2016",Christy Lemire," Their latest, Hail, Caesar!, is their giddiest comedy to date, but it's also hit-and-miss within itself. "
leonardmaltin.com," February 16, 2016",Leonard Maltin," Hail, Caesar! ... a slice of Hollywood fluff."
The Spectator," March 3, 2016",Deborah Ross, The latest film from the Coen brothers is a comedy set during the 'golden age' of Hollywood and in some respects it is utterly delicious.
New Statesman," March 3, 2016",Ryan Gilbey," Hail, Caesar! represents a breakthrough for the brothers as storytellers"
The Nation," March 3, 2016",Stuart Klawans," There are half a dozen moments you've really got to see in the Coen brothers' Hail, Caesar! -- more than enough to make this movie worth your while."
Financial Times," March 3, 2016",Nigel Andrews, Think of Altman's The Player; mix it with random pages of Fitzgerald's The Last Tycoon; shake and serve.
Guardian," March 3, 2016",Peter Bradshaw," It's not encumbered with significance, but richly affectionate and very entertaining. Hail, Caesar! is something to be greeted as a gorgeous exercise in style."
WOW247," March 3, 2016",Matthew Turner," Beautifully made, laugh-out-loud funny and utterly charming, Hail, Caesar! delivers pitch-perfect Hollywood pastiche in the Coens' inimitable style."
Independent Online (South Africa)," March 2, 2016",Theresa Smith," Hail, Caesar! is smart and silly at the same time, a light and frothy love letter to '50s Hollywood which also makes fun of the place."
Junkee," March 2, 2016",Clem Bastow," For all its outward glitz and lush ""prestige"" presentation, Hail, Caesar! is curiously empty, narratively and ideologically. It's also frequently and deadeningly dumb."
Rip It Up," March 2, 2016",David 'Mad Dog' Bradley," While there are delightful moments, it's never quite the knockabout slapstick comedy that the trailer suggests."
San Francisco Examiner," March 2, 2016",Jeffrey M. Anderson," It's a big, swirling movie, shot by the great Roger Deakins, full of movies and the joy of movies. "
Jerusalem Post," March 1, 2016",Hannah Brown," There's an affection for the characters in the film, even the ones they satirize most brutally."
Reel Film Reviews," March 1, 2016",David Nusair, ...just another promising yet underwhelming effort from the Coen siblings...
CineVue," March 1, 2016",Adam Lowes," Hail, Caesar! hits all the right notes as a loving tribute to the films and background players of a bygone Hollywood age, and while it's perfectly enjoyably, it ultimately feels like a slight and undernourished offering."
Crikey," March 1, 2016",Luke Buckmaster," Mostly the film is pleasant enough pap - a soft, even toothless hat-tip to Hollywood's dreamy days of yonder year."
ABC Radio (Australia)," February 29, 2016",CJ Johnson," The Coen Brothers' 1950s-set Hollywood Studio comedy is an endlessly, effortlessly entertaining flight of fancy. If they only created it to delight themselves - which is how it possibly comes off - I have no beef with that."
FILMINK (Australia)," February 29, 2016",Anthony O'Connor," Charm goes a long way, but in terms of the Coens' overall oeuvre, Hail, Caesar! is endearing but inessential viewing."
"Commercial Appeal (Memphis, TN)"," February 29, 2016",John Beifuss," Constructed from spoofy vignettes that recreate vanished genres, indelible star turns and 'dialectical' dialogues, the movie is simultaneously amused, awed and appalled by the power of what might be America's most influential industry."
Fort Worth Weekly," February 26, 2016",Kristian M. Lin," The Coens' nihilistic fatalism was getting old, so it's nice to see them leave it behind."
3AW," February 26, 2016",Jim Schembri," The elaborate, beautifully slick musical numbers run for minutes on end and suggest the Coen's might have been better off making a full-on, old-style, unironic Hollywood movie rather than an ensemble comedy that merely pays tribute to them."
Sacramento News & Review," February 25, 2016",Daniel Barnes," As an examination of the post-war hypocrisy of Hollywood, the fantasyland of Hail, Caesar! is ten thousand times more righteous than the based-on-fact Trumbo. But as a Coen brothers' movie, it's just OK."
GQ Magazine [UK]," March 7, 2016",Helen O'Hara," Its fizzy, meandering, ultimately plotless-plot will frustrate many, but if you just go with it this is one of the most joyous films you will ever see."
Daily Express (UK)," March 7, 2016",Henry Fitzherbert, It goes on for ever and is like watching paint dry.
Daily Express (UK)," March 7, 2016",Allan Hunter, A film jammed with comic highlights.
Observer (UK)," March 6, 2016",Mark Kermode," For all its knockabout silliness, the film is a love letter to the movies - or rather, to a dream of the movies."
Irish Times," March 6, 2016",Donald Clarke," You could see it as a sampling menu for Chez Coen. Like most sampling menus, however, Hail, Caesar! leaves you craving a proper main course. "
Graffiti With Punctuation," March 4, 2016",Blake Howard," Watching Hail, Caesar! as a classic cinephile, you're going to have a whale of a time; if you're not, you'll probably only manage a snicker."
Cinencuentro," March 4, 2016",Sebastian Zavala Kahn, Painstakingly recreates an era that very few people remember with the same affection as the Coen Brothers. [Full Review in Spanish]
The Sunday Age," March 4, 2016",Craig Mathieson," Hail, Caesar! has its moments of pleasures, but often it leaves you with what Laurence Laurentz asks Hobie to deliver on camera: 'a mirthless chuckle'."
Uncut Magazine [UK]," March 4, 2016",Michael Bonner, Feels as much like a warm tribute to the studio pictures of the Coens' youth as it does an exuberant comedy in its own right.
The Arts Desk," March 4, 2016",Graham Fuller," As satirical fantasies go, Hail, Caesar! is so loving and spectacular a celebration of the Hollywood studio system of the early 1950s that it looks like a riposte to 2006's Hollywoodland.."
The Big Issue," March 4, 2016",Edward Lawrenson," A hugely entertaining romp. But Hail, Caesar! also emerges as a smart and subtly unnerving exploration of the seductive appeal of films over its paying audience - over us. "
Flick Filosopher," March 4, 2016",MaryAnn Johanson," Full of the Coen Brothers' usual exuberant joie de cinema, and a helluva lot of fun, but too scattershot to ever settle on saying the things it has to say."
Concrete Playground," March 4, 2016",Tom Clift," A mystery, a farce, a treatise on religion and a sly interrogation of cinemas so-called golden age masquerading as the ultimate Hollywood love letter."
Daily Mirror (UK)," March 4, 2016",David Edwards," As Caesar probably never said: I came, I saw, I slept."
Daily Mail (UK)," March 4, 2016",Brian Viner," The Coens and their excellent cast (which includes Michael Gambon, plummily narrating) have huge, hammy fun with all this."
The Sun (UK)," March 3, 2016",Alex Zane," After the Coens' Inside Llewyn Davis, True Grit and A Serious Man, it's great to see them return to lighter fare. Even if this is far from classic Coens."
Sky Movies," March 3, 2016",Rich Phippen," Quite what Hail, Caesar! is driving at will remain a mystery for most (it's well worth looking into this to see what it's all about), but the journey is more than entertaining enough to make it worthwhile."
Radio Times," March 3, 2016",Andrew Collins," It may not have a lot to say - other than: hey, the movies are just swell - but it's all executed with true love."
Sight and Sound," March 3, 2016",Ben Walters," As for the Coens themselves, eccentric and critical Hollywood tomb raiders they might be but, like Sturges, they believe sincerely in the value of delight for its own sake."
Flicks.co.nz," March 3, 2016",Matt Glasby, Feels more laboured than labour of love. 
Reforma," April 25, 2016",Eduardo Molina," With impecable production values, this truly is a masterpiece for lovers of classic Hollywood, they will enjoy all the references, specially if you know on what actors the characters are based of. [Full review in Spanish]"
En Filme," April 22, 2016",Sofía Ochoa Rodríguez," Shiftng through stories to bring a general view of how the film industry works, where the Coens manage to critize it and praise it at the same time. [Full review in Spanish]"
Cine Premiere," April 21, 2016",Gabriela Muñoz, The new movie by the Coen brothers is a love letter to the film industry. [Full review in Spanish]
Garuyo," April 21, 2016",Uriel Barco, Once again the Coen's prove they're masters of absurd but never dumb comedies. [Full review in Spanish]
Brooklyn Magazine," April 19, 2016",Nicolas Rapold, a straight-up-funny syncopated comedy about studio-run showbiz in all its bottom-line absurdity
Cinemixtape," April 7, 2016",J. Olson," The end result should attract and repel moviegoers in the same degree, virtually refusing an easy ranking among the Coens' filmography. Would that it were so simple."
South China Morning Post," April 6, 2016",Richard James Havis," Held together by an effective, if downplayed, Chandler-esque crime yarn, it touches on Marxist theory, theology, hubris, and even synchronised swimming. Film buffs will find it a treat."
