source_name,review_date,critic_name,review_detail
ColeSmithey.com," April 3, 2016",Cole Smithey, The ever-streaky Joel and Ethan Cohen commit a cinematic blunder with a would-be screwball comedy that has all the laughs you can count on one hand. 
Christianity Today," March 30, 2016",Alissa Wilkinson," Mostly it's about the meaning of life by way of religion, with which the Coens have always fiddled, sometimes dancing around the edges and sometimes diving straight into the middle."
Cairo360," March 28, 2016",Marija Loncarevic, Everyone seems to be having fun and it translates to the screen perfectly in what is certainly an entertaining production.
Film Freak Central," March 26, 2016",Walter Chaw, the Coens at their most and least cynical. Amen and hallelujah. - 
The Straits Times (Singapore)," March 24, 2016",John Lui," The result is a warm, funny and uncomplicated blend of satire and tribute, bursting with affection for a medium at the height of its influence, while gently sending up the craziness behind the scenes at the dream factories."
Starburst," March 24, 2016",Jack Bottomley," A film some will love and some will hate, while others will sit somewhere in the middle of disappointment and admiration. Hail, Caesar? Maybe more of a respectful nod perhaps?"
AARP Movies for Grownups," March 23, 2016",Bill Newcott," Before we know it, the film morphs into a complex fable that ingeniously palpates the thin membranes dividing the tales we've been telling ourselves for thousands of years, from the Bible to blockbuster movies."
ABC Radio Brisbane," March 19, 2016",Matthew Toomey, Fans of these iconic filmmakers should enjoy the ride. Those unfamiliar with their previous work may find it all a bit too strange.
Movie Talk," March 13, 2016",Jason Best," The intrigue is engagingly goofy, but the plot is really just an excuse for the Coens to spoof a series of Hollywood genres with gleeful precision. Their pastiche films are a joy, brazenly silly but pulled off with old-school panache."
Hot Press," March 11, 2016",Roe McDermott, Hail Caesar! lifts the curtain on Hollywood in magnificent style.
The Ooh Tray," March 9, 2016",Ed Whitfield," Embrace the movies, says this movie about old movies, and know that the industry and its popular myths are the 20th century's totems, and that to be the bag man for the studio in such an era, was to be as close to godliness as is possible."
The Jacobin," March 9, 2016",Eileen Jones," If it's possible to create a tribute to popular film that's both completely loving and completely scathing at the same time, the Coens have managed it. It's a mind-blower."
Contactmusic.com," March 8, 2016",Rich Cline," An intelligent ode to a time when Hollywood made wildly inventive movies without pressure from focus groups, there's a serious edge to what superficially looks like a madcap comical romp."
Baltimore Magazine," June 13, 2016",Max Weiss," The greatest thing about Hail, Caesar! is that its loose structure allows the Coens to just mess around with the things they like."
The Blu Spot," June 6, 2016",Jeff Beck," With a sharp script and an excellent ensemble, Hail, Caesar! is a delightful love letter to filmmaking that blends the Coen Bros.' passion for the art with an exquisite tapestry of characters and storylines."
Groucho Reviews," June 4, 2016",Peter Canavese," In a way, the amusing, preposterous Hail, Caesar!, for all its arch postmodernism, becomes what it pastiches, resembling the kind of '50s film we can now watch and admire for a kind of cultural reflection without exactly considering it a success..."
Japan Times," May 20, 2016",Giovanni Fazio," Hail, Caesar! ranks in the Coens' filmography somewhere above The Ladykillers but below Intolerable Cruelty, which is to say it has its moments, but not nearly enough of them."
La Jornada," May 6, 2016",Leonardo Garcia Tsao," Hail, Caesar! is a minor work when compared to the Coen's recent filmography. But it's not a bad thing to say either. [Full review in Spanish]"
El Universal," May 3, 2016",Jorge Ayala Blanco," A mix of film genres here are cursed, corrected and augmented to become a satire of the Hollywood system of old. [Full review in Spanish]"
La Nación (Argentina)," April 29, 2016",Diego Batlle," The Coens return to the comedy territory and even though they don't reach the heights of Raising Arizona or The Big Lebowski, the build a light, elegant and funny film. [Full review in Spanish]"
El Fanzine," April 29, 2016",Gonzalo Lira Galván," Hail, Caesar! is a reminder that you can never go wrong with the Coens. [Full review in Spanish]"
Cine Vértigo," April 28, 2016",Ernesto Diezmartinez," Using a film noir base to tell their story, the Coens let it all out to entertain the cinema audience from start to finish. [Full review in Spanish]"
EscribiendoCine," April 28, 2016",Benjamín Harguindey," Worth seeing in the name of love for cinema and cinema history, regardless of some of it's flaws. [Full review in Spanish]"
El Universal," April 28, 2016",Alonso Díaz de la Vega," More than just a good time at the moves, this is a story of th faith of the 20th Century and a representation of the desulsions of the 21st. [Full review in Spanish]"
Código espagueti," April 28, 2016",Nicolás Ruiz," A love song for those who enjoy the smell of popcorn, sitting in the darkness of the theatre and remembering the classic Hollywood movies. [Full review in Spanish]"
Clarín," April 28, 2016",Pablo A. Scholz," The film sometimes loses focus, thankfully you have Brolin or Clooney to save it in those parts. [Full review in Spanish]"
Cinexcepción," April 28, 2016",Hugo Hernández Valdivia," Hail Cesar! might not be one of the best films by the Coen Brothers, but it's full of the grace and charm that distinguishes their movies. [Full review in Spanish]"
Flavorwire," April 27, 2016",Jason Bailey," It is, all in all, mid-level Coens. But as so many others have noted, mid-level Coens still tops most other filmmakers at their peak."
Vanguardia (Mexico)," April 27, 2016",Carlos Díaz Reyes," It may not have the intelligence or depth of they best work, but it is a light comedy and a love letter to what they do so well."
Butaca Ancha," April 27, 2016",JJ Negrete," Rather than talk about the film industry, it talks about an industry of faith. [Full Review in Spanish]"
Correcámara," April 25, 2016",Hugo Lara, The Coen Brother's most recent film is a treat filled with cinephilia; a splendidly fun homage to post-war Hollywood. [Full Review in Spanish]
Cinema Movil," April 25, 2016",Gonzalo Lira Galván," The premise serves to analyze the views about religion and politics in a post-war Hollywood, where McCarthyism transformed filmmakers into ease prey of the anti-communist movement. [Full review in Spanish]"
Reforma," April 25, 2016",Edgardo Reséndiz, It's fun seeing Hollywood making fun of itself and even better with the Coen's sense of humor. [Full review in Spanish]
