source_name,review_date,critic_name,review_detail
IGN Movies," August 18, 2016",Samantha Ladwig," What the film lacks in flash it makes up for in cinematography. What could have been a very plain-looking film with its flat, dusty lands is beautifully captured with wide shots and a breathtaking yellow and blue color palette."
Toronto Sun," August 18, 2016",Liz Braun," Hell or High Water is set up like a cops and robbers drama, but it plays out like a complicated western -- no black-hats-and-white-hats simplicity here. It's all moral shades of grey."
Uncut Magazine [UK]," September 2, 2016",Michael Bonner," Pitched as a heist movie, David Mackenzie's latest film feels more like a contemporary Western set in a time of heightened financial anxiety."
Q Network Film Desk," September 1, 2016",James Kendrick, The violence hurts because the film has texture and meaning and the characters matter.
Christianity Today," September 1, 2016",Kenneth R. Morefield, Nothing that Chris Pine has done to date prepared me for how good he is here.
Tolucan Times," September 1, 2016",Tony Medley," While there's some good action while the brothers are holding up the banks, this film is mostly conversation between Pine and Foster, on the one hand, and Bridges and Birmingham, on the other. Compelling is not the word for which I would be groping."
Ozus' World Movie Reviews," September 1, 2016",Dennis Schwartz, A brilliantly conceived hard-hitting modern Western.
Ex-Press.com," August 29, 2016",Jay Stone," ""Pass With Care,"" reads a road sign, perforated with bullet holes. That's Texas; that's America."
Winnipeg Free Press," August 26, 2016",Alison Gillmor, The movie plays with clichés only to upend them. 
Christian Science Monitor," August 26, 2016",Peter Rainer," All of the performers in this film, right down to the bit players, are quite good, but Bridges demonstrates yet again that he is one of the finest actors in America."
Sacramento News & Review," August 25, 2016",Daniel Barnes," Hollywood used to turn out solidly constructed, midsized genre films like this by the score, but now they're so rare that Hell or High Water practically seems like a unicorn."
ReelViews," August 23, 2016",James Berardinelli," From a purely narrative perspective, there's nothing new here but like a new arrangement of a familiar tune, the slight changes make it fresh and enjoyable."
Reel Film Reviews," August 23, 2016",David Nusair, Mackenzie has infused Hell or High Water with a gritty and irresistibly stylish feel that's heightened by a roster of superb performances...
National Review," August 22, 2016",Armond White, David Mackenzie's Hell or High Water further challenges Hollywood's unethical trends. It twists the outlawry of two white Texas brothers...into a study of millennial cynicism.
Cinemixtape," August 21, 2016",J. Olson," In crossing potboiler and art film streams, David Mackenzie and Taylor Sheridan have come up with something distinct, if not groundbreaking."
EntertainmentTell," August 21, 2016",Stephen Silver," Fantastic. It's planted in various durable genres, as well as American myth itself, while it's also very much of the moment. (Splice Today) "
tonymacklin.net," August 20, 2016",Tony Macklin, Hell or High Water is an elegy for the disenfranchised.
Film School Rejects," August 20, 2016",Rob Hunter," All three leads do strong work with characters and a story that never quite approach their level, and together they make the film entertaining and engrossing despite itself."
Columbus Alive," August 19, 2016",Brad Keefe," Takes a relatively simple cops-and-robbers theme, drops it deep in the heart of Texas and doesn't skimp on complex characters or moral dilemmas."
Cinemaclips.com," August 19, 2016",Roger Tennis, 'Hell or High Water' bristles with true grit. 
CinemaBlend.com," August 19, 2016",Greg Wakeman," A top-notch thriller that's also evocative, suspenseful, and increasingly captivating. A must-watch."
ScreenRant," August 19, 2016",Sandy Schaefer, Hell or High Water makes for a contemplative dramatic thriller that is fueled by great performances and strong direction.
Projected Figures," September 10, 2016",Anton Bitel," A hybrid of crime drama and neo-western..., Hell or High Water uses its half-breed genre thrills to expose an American dream long since soured by recession, and running on empty"
Independent (UK)," September 9, 2016",Geoffrey Macnab, There's no Bonnie and Clyde-style glamour but the film has an emotional depth that you don't often find in a heist thriller.
Seven Days," September 9, 2016",Margot Harrison, The deft sketches of minor characters - each surviving tough times in their own way - give human faces to the film's messaging. 
The Arts Desk," September 9, 2016",Adam Sweeting, The plot functions with lean efficiency... but the real purpose of screenwriter Taylor Sheridan and director David Mackenzie is to evoke an American south-west that time forgot.
RTÉ (Ireland)," September 9, 2016",Harry Guerin," It really would be a crime if Hell or High Water didn't get some recognition come awards time. It'll definitely leave its dust in your bones, and something in your eye."
Times (UK)," September 9, 2016",Kate Muir, A smartly crafted heist thriller that quietly peels back the layers from its macho male characters to reveal the pain and tenderness inside.
London Evening Standard," September 9, 2016",Charlotte O'Sullivan," As with Starred Up, Mackenzie's family-centric prison drama, Hell or High Water is full of grim nooks and crannies."
Daily Mail (UK)," September 9, 2016",Brian Viner, One of the best pictures I have seen all year.
WOW247," September 9, 2016",Matthew Turner," A gripping cops-and-robbers thriller with a strong sense of place, and a timely thematic undercurrent that packs a powerful emotional punch."
Sky Movies," September 8, 2016",Tim Evans," Elevated by a richly detailed script from Sicario writer Taylor Sheridan, who pens roughly authentic dialogue and fleshes out even the most peripheral characters to give the story a genuine heft."
Radio Times," September 8, 2016",Damon Wise," It's a familiar story but one very well told, skewed by dry detail and snappy dialogue, scoring three top-notch performances with a great dustbowl soundtrack by Warren Ellis and Nick Cave."
International Business Times," September 8, 2016",Amy West," There are plenty of great Westerns and there are arguably even more heist movies... but here, director David Mackenzie seamlessly infuses the two, interpreting the best traditions from each in his own way."
Daily Express (UK)," September 8, 2016",Allan Hunter, What you don't expect is how deeply it cuts and how much you care about the characters and the people caught in the crossfire of their impossible dreams.
Tulsa World," September 8, 2016",Michael Smith," Hell or High Water is one of the year's best pictures, sort of a twist on a modern-day Western with plenty of West Texas flavoring and a hint of Oklahoma spice."
Financial Times," September 8, 2016",Danny Leigh," For Mackenzie, a British filmmaker whose career to date has been nomadic, the movie feels like finally finding the right key for a lock."
Little White Lies," September 7, 2016",Manuela Lazic," Unexpected directions, sharp humour and powerful performances."
Creative Loafing," September 6, 2016",Matt Brunson, The best movie of the summer season.
Empire Magazine," September 5, 2016",Jimi Famurewa," Taut, tense and burnished by Jeff Bridges at his best. This is a deceptively simple tale of Texan cops and robbers that drags the Old West into the modern age."
The List," September 5, 2016",Emma Simmonds," Mackenzie's tenth feature cultivates great compassion for its characters, while making wider points relating to exploitation and community erosion well."
The Skinny," September 5, 2016",Josh Slater-Williams, One of the finest American crime films in quite some time.
Urban Cinefile," October 22, 2016",Louise Keller," In the perfect marriage of plot, character, setting and music, Hell or High Water is a crackling good thriller, compounded by the contrast of thrilling action "
Impulse Gamer," October 21, 2016",Damien Straker, Hell or High Water is both an exhilarating crime thriller and a black comedy that shares unexpected thematic parallels with Peter Bogdanovich's The Last Picture Show and also No Country For Old Men.
Flicks.co.nz," October 18, 2016",Aaron Yap, One of the year's most pleasant surprises.
Graffiti With Punctuation," October 6, 2016",Blake Howard, Hell or High Water is about the fight or flight instincts at the epicentre of the disintegration of American society. Mackenzie and Sheridan and their players dance with that relative morality gracefully.
Laramie Movie Scope," September 29, 2016",Robert Roten," Hell or High Water is a smartly-written (by Taylor Sheridan of Sicario) well-acted film that closely observes its characters and their relationships, even minor characters, which are often glossed over in lesser films."
"Commercial Appeal (Memphis, TN)"," September 26, 2016",John Beifuss," Worrying his lines like a plug of chaw, Jeff Bridges again proves that an extreme, even expressionistic characterization can be an unlikely vehicle for emotional honesty."
Indie London," September 22, 2016",Rob Carnevale, Destined to become a modern classic - and deservedly so.
East Bay Express," September 22, 2016",Kelly Vance, Instant Texas with all the trimmings. Highly recommended.
Hot Press," September 22, 2016",Roe McDermott," Pine and Foster put in career bests as brothers, who are different but unerringly loyal to each other, and to their values."
Missoula Independent," September 22, 2016",Molly Laich, I can't think of another film in recent memory that has had so much respect for every one of its characters.
Sight and Sound," September 16, 2016",Trevor Johnston, The whole movie offers ample evidence that [Mackenzie] has stealthily achieved an unassuming but utterly genuine mastery of his craft.
CinemaDope," September 13, 2016",Glenn Lovell, ... a forlorn modern-day Western ... Its garrulous style and tumbleweed authenticity will stay in mind long after the plot has faded from memory ... Bridges is essentially doing Tommy Lee Jones 
Contactmusic.com," September 13, 2016",Rich Cline," Every scene bristles with comedy and suspense, and the atmosphere is further enhanced by a moody score and wonderfully evocative songs by Nick Cave and Warren Ellis."
CineXpress," September 13, 2016",Fico Cangiano," Anchored by excellent performances by Chris Pine, Ben Foster and Jeff Bridges, Hell of High Water manages to successfully marry the western and heist genres. [Full review in Spanish]"
Flick Filosopher," September 13, 2016",MaryAnn Johanson, Alongside plenty of heist-movie humor and suspense is a bleak fatalism grounded in depressing reality and resignation to the miserable necessity it demands.
Irish Independent," September 12, 2016",Paul Whitington, It's quite a film.
Sunday Independent (Ireland)," September 12, 2016",Hilary A White," Always an actor of huge vitality, Foster gives a career best while Pine shows he's far more than just a pretty face. The landscape belongs to Bridges, however."
Scotsman," September 11, 2016",Alistair Harkness," Though this is a thriller with a conscience, it doesn't fall back on black-and-white morality to get us on the side of its outlaw protagonists."
Observer (UK)," September 11, 2016",Wendy Ide," art heist, part western for the Occupy generation, this sharply plotted thriller is a triumph for both director David Mackenzie and writer Taylor Sheridan."
The Ooh Tray," September 11, 2016",Ed Whitfield," A contemporary Western, [which] like the best of them, is concerned with the moral character of the frontier, and whether the lawless and the righteous have a foot in each other's territory. "
Cinema-stache," November 21, 2016",Rob Vaux," It's a simple equation, but the details make it sing."
The Blu Spot," November 21, 2016",Jeff Beck," Hell or High Water has several positive elements, including a great cast and a thrilling finish, but thanks to lax pacing and a narrative that wanders a bit too much, we end up with a film that never truly comes together into a satisfying whole."
Matt's Movie Reviews," November 17, 2016",Matthew Pejkovic," A modern-day set crime western that delves into the themes of right, wrong, law and capitalism with a righteous heart that pulsates within the grey of a morality tale where the pursuit of money turns good men bad."
Arkansas Democrat-Gazette," November 14, 2016",Piers Marchant," Bridges, as always, is a joy to experience, digging into his role with unbridled gusto."
Concrete Playground," November 13, 2016",Sarah Ward," A film built dirt-up from the tiniest of details - a parade of sepia-tinted small towns here, a slow drawl masking unspoken pain there."
El antepenúltimo mohicano," November 10, 2016",Alberto Sáez Villarino," At a narrative and stylistic level, is one of the most complete works that we have been able to witness in the last century. [Full review in Spanish]"
Daily Express (UK)," November 9, 2016",Henry Fitzherbert, Bridges is on fine form and Pine and Foster are a combustible duo. Mackenzie doesn't put a horse-shoed foot wrong.
ABC Radio (Australia)," November 9, 2016",CJ Johnson," The sad, dusty towns against which this classically-oriented story play out are breathtakingly evocative, as are the bodies and faces of all the Texans we meet along the way. "
ABC Radio Brisbane," November 6, 2016",Matthew Toomey, This is a damn good film and your feelings about the characters will oscillate throughout. 
Sydney Morning Herald," October 28, 2016",Sandra Hall, Hell or High Water is a contemporary western with pick-up trucks instead of horses. But some things never change.
Sydney Morning Herald," October 28, 2016",Paul Byrnes," There's not a moment out of place, not a shot that stays too long. If [David McKenzie] makes a better film in his career, he'll be lucky."
New Zealand Herald," October 28, 2016",Russell Baillie," Hell, it sets a high water mark for movies this year."
The Australian," October 28, 2016",David Stratton," Scottish director David Mackenzie employs the keen eye of an outsider to evoke this very particular world. The film is firmly planted in reality, down to the smallest detail."
Junkee," October 26, 2016",Jack Tregoning," Within the first minute of Hell Or High Water, it's clear we're in steady hands."
Herald Sun (Australia)," October 26, 2016",Leigh Paatsch," If this isn't the best film of the year, then it won't be missing that exalted mark by much."
News.com.au," October 26, 2016",Wenlei Ma," Hell or High Water isn't the kind of flashy film that arrived with a lot of fanfare and it certainly isn't your average heist movie, it sneaks up on you and will surprise you with its grace and depth."
Daily Telegraph (Australia)," October 26, 2016",Vicky Roach," Mackenzie gives every one of his actors the opportunity to show what stuff they are made of. And they deliver, each in their own way."
The Straits Times (Singapore)," October 26, 2016",John Lui," There are no real villains, just two brothers who have a code and the rangers who live by another. In the inevitable final clash, as in all good Westerns, it becomes apparent they have a lot more in common than they think."
FILMINK (Australia)," October 24, 2016",Sophia Watson," ...a desperate, bleak and horribly authentic look at post-GFC America. "
Urban Cinefile," October 22, 2016",Andrew L. Urban," Distinguished by a wonderfully nuanced, varied and haunting score thanks to Australian musos Nick Cave and Warren Ellis ...is a fascinating hybrid of melancholy morality play, modern Western and arthouse drama"
