source_name,review_date,critic_name,review_detail
Cinetvymas.cl," February 9, 2017",Daniel Bernal," Absolutely recommended not only for those who like bank robberies and persecutions, but also those who enjoy a good, well narrated film with a clever script and good direction. [Full review in Spanish]"
Film Threat," February 7, 2017",Anthony Ray Bench," The movie is tight, well written, sympathetic, without resorting to cloying sentimentality, and brutal in its consequences."
Otroscines.com," February 2, 2017",Diego Battle, This walk through the founding genres of american classic cinema has a delirium that makes it a very attractive class B exponent. [Full review in Spanish]
JWR," January 31, 2017",S. James Wegg," With a subtler approach, Mackenzie might have delivered a knock-out punch and testament to systemic rage..."
El Mundo (Spain)," January 27, 2017",Luis Martínez," One of the best films of the season, the director manages to come up with something like an X-ray of a desperate time. [Full review in Spanish]"
Blog de cine," January 5, 2017",Alberto Abuín, A jewel whose identity is in the heritage and memory of the genre par excellence. [Full review in Spanish]
El Pais (Spain)," January 2, 2017",Javier Ocaña, A film with a rebellious and deeply ethical vision of the American politics and society of Trump's era. [Full review in Spanish]
Stuff.co.nz," December 31, 2016",James Croot," Filled with dramatic tension, complex characters, rich, memorable dialogue and uncomfortable reflections of the plight of many modern day Americans, David Mackenzie's contemporary western is a compelling watch from go to whoa."
indieWire," December 31, 2016",Eric Kohn," Just as it taps into a dying corner of American society, Hell or High Water resurrects the power of western mayhem done right."
CineVue," December 31, 2016",Maximilian Von Thun," The only saving graces are the (admittedly excellent) cinematography and production values -- the action scenes are crisp, smooth and packed with tension -- but they feel almost irrelevant when the content they have to work with is this bad."
MetroActive," December 31, 2016",Richard von Busack," The violence has speed, impact and follow-through -- it's a magnificent rebuke to all the hundreds of cute killings on screen in summer movies. "
Total Film," December 28, 2016",Kevin Harley," Mackenzie goes western in satisfying style, while Bridges, Pine and Foster bring true grit to Sheridan's tight script."
Irish Times," December 28, 2016",Donald Clarke," We will never get another Howard Hawks or Raoul Walsh, but, every now and then, we see a film that pays homage to their spirit."
Sunday Times (UK)," December 19, 2016",Edward Porter," Is there any better background for this sort of tale than a succession of wide open landscapes, dusty streets, and cheap diners?"
Seanax.com," December 15, 2016",Sean Axmaker, ... as good an American drama as you'll see this year.
Film Ireland Magazine," December 14, 2016",Michael O'Sullivan," It illustrates that, with enough tweaking and refinement, even a generic story can be made into a tense pacing thriller that can still surprise while trying to be as entertaining as possible."
Denver Post," December 14, 2016",John Wenzel," This neo-Western works splendidly as a self-contained tale of loyalty, loss and redemption, with polished turns from a smoldering Chris Pine and spunky Ben Foster."
Antagony & Ecstasy," December 8, 2016",Tim Brayton," A neo-Western for neo-Western lovers, a lean character study of Texan poverty told with wiry masculinity ."
Sensacine," November 29, 2016",Daniel de Partearroyo," A western directly transplanted into the 21st century, featuring a colossal and magnetic Jeff Bridges. [Full review in Spanish]"
Cinemalogue.com," November 25, 2016",Todd Jorgenson," ... a contemporary Western that doesn't fall victim to genre pitfalls. In other words, there's more depth and complexity here than a simple manhunt leading to a climactic showdown. Yet it still dishes out some old-fashioned frontier justice."
Hollywood Reporter," May 16, 2016",David Rooney, A soulful outlaw tale with a socioeconomic perspective and a rich sense of place.
Arizona Republic," August 10, 2016",Bill Goodykoontz," Let's make it easy: If you like sitting in a dark room looking at pictures that move, you should see ""Hell or High Water."" It's terrific."
Movie Nation," August 9, 2016",Roger Moore," A heist picture that plays like a Waylon Jennings song -- lonesome, ornery and mean. "
Tribune News Service," August 9, 2016",Katie Walsh," A dusty, blood-soaked myth of crime and punishment far from fantasy, a finger planted on the pulse -- and the trigger."
Film Journal International," August 9, 2016",Maitland McDonagh, Hell or High Water delivers both action and character that should satisfy viewers looking for an alternative to high-octane Hollywood blockbusters.
Village Voice," August 9, 2016",Danny King, Hell or High Water's deliberate pacing gives it the feel of a heist story with its feet stuck in mud - and that's a good thing.
Slant Magazine," August 9, 2016",Jake Cole," As with Sicario, the broad strokes of the film's Southwestern stereotypes gradually sharpen into focus as the story pivots to a look at the systemic forces that shape the characters."
New York Daily News," August 8, 2016",Stephen Whitty," It's got a dry dusty power, and a dark sense of humor. And when it finally saddles up and really rides, pardner, you'd best get out of its way."
ColeSmithey.com," May 21, 2016",Cole Smithey," [CANNES 2016] ""Hell or High Water"" is a real gem - a high point Cannes 2016. Look for this entertaining drama to attract a following in the States and beyond."
The Young Folks," May 20, 2016",Jordan Ruimy, Mackenzie is about to hit the big time with this one as Hollywood will no doubt be knocking at his door with a lot more opportunities.
Vanity Fair," May 20, 2016",Richard Lawson," Starred Up director David Mackenzie helms with muscle and panache, in both bracing action scenes and quieter moments of introspection, all framed gorgeously by cinematographer Giles Nuttgens."
AV Club," May 19, 2016",Mike D'Angelo," Hell Or High Water plays out in unexpected ways, culminating in a tense final showdown that's somehow simultaneously an epilogue, the story having already concluded. (Neat trick, that.)"
Village Voice," May 18, 2016",Bilge Ebiri," Sheridan's script - filled with quotable zingers, telling character details, and topical anger - comes to vivid, exciting life with that cast, in particular Bridges, who seems to have finally found another gruff, down-home type worthy of his talents."
HeyUGuys," May 18, 2016",Jo-Anne Titmarsh," In depicting the disenfranchised and financially broken, Mackenzie is more successful than either Andrea Arnold or Jodie Foster, who both dealt with similar themes in their Cannes offerings."
CineVue," May 16, 2016",John Bleasdale," A brilliantly executed, sharply written genre gem."
The Playlist," May 16, 2016",Nikola Grozdanovic," If you feel like you've heard it all before, the film nontheless provides more than its share of entertainment to make it a surefooted and perfectly enjoyable ride."
Daily Telegraph (UK)," May 16, 2016",Tim Robey," For a pacy cops-and-robbers exercise, it doesn't only have smart things to say, but even smarter ways to put them."
Screen International," May 16, 2016",Charles Gant," Nine films into his all-over-the-map 14-year movie career, David Mackenzie delivers what is certainly his most commercially appealing entry so far, and one of his most fully achieved."
Guardian," May 16, 2016",Peter Bradshaw," It's an action-thriller with punch; Bridges gives the characterisation ballast and heft and Pine and Foster bring a new, grizzled maturity to their performances."
The Film Stage," May 16, 2016",Rory O'Connor," A gritty, darkly humorous, and fiendishly violent neo-western."
Variety," May 16, 2016",Owen Gleiberman," ""Hell or High Water"" is a thrillingly good movie - a crackerjack drama of crime, fear, and brotherly love set in a sun-roasted, deceptively sleepy West Texas that feels completely exotic for being so authentic."
MTV," August 11, 2016",Amy Nicholson," We don't live in an era of white hats and black hats. Maybe we never did. Today, everyone is gray - or, in Mackenzie's color scheme, faded blue and sad beige"
Washington Post," August 11, 2016",Ann Hornaday," In a word, ""Hell or High Water"" is terrific."
Minneapolis Star Tribune," August 11, 2016",Colin Covert," It's not every day that we see a movie that's fresh, exciting and dangerous, slapping you from explosive laughter to stunned attention. Mood and atmosphere and interesting character acting are rarely handled as well as this."
Us Weekly," August 11, 2016",Mara Reinstein, The tension and anger in this neo-Western practically radiate off the screen.
Collider," August 11, 2016",Brian Formo, The believable bond between Pine and Foster adds one more meaningful stitch of personal history to a script that perfectly combines the Old West with the Nu.
AV Club," August 11, 2016",A.A. Dowd," Audiences have been down this dusty backroad before. The thrill of High Of High Water is in its skillful, offbeat execution."
Entertainment Weekly," August 11, 2016",Chris Nashawaty, You might have to go back to 1967's Bonnie and Clyde to find a film about bank robbers that feels as of its time as David Mackenzie's Hell or High Water.
New York Magazine/Vulture," August 11, 2016",David Edelstein, Hell or High Water is a rare humanist Western: Finality is the true villain.
ScreenCrush," August 11, 2016",Matt Singer, A suspenseful and purposeful thriller that uses the iconography of classic Westerns to tell a modern story.
One Guy's Opinion," August 11, 2016",Frank Swietek," A manhunt movie that blends action, comedy, drama and even a smidgen of social commentary into an almost perfect package, offering excitement, laughs and a dollop of poignancy to go along with them."
Fort Worth Star-Telegram/DFW.com," August 11, 2016",Cary Darling, Texas is as much a riveting character in [this] fascinating crime drama as the brothers turned bank robbers at its heart or the laconic lawman who coolly follows them across the sun-hardened landscape like a hunter on the trail of his next kill.
Boston Globe," August 11, 2016",Ty Burr," They don't make them like this anymore - but they still can, and here's the proof."
Chicago Tribune," August 11, 2016",Michael Phillips," ""Hell or High Water"" has one foot in pulp conventions, and the other in some stimulating, morally tricky contemporary answers to those conventions. What the movie has, above all, is a dramatic line, clean and straight."
Seattle Times," August 11, 2016",Moira MacDonald," In this bleak West Texas landscape where everyone seems to be struggling, you find yourself rooting, inexplicably, for all of them against a clear villain: the faceless, predatory bank."
Blu-ray.com," August 10, 2016",Brian Orndorf," It pulls the viewer in multiple directions, but it never unravels, delivering a true thrill ride that feels emotionally authentic and remains decidedly cinematic."
Los Angeles Times," August 10, 2016",Glenn Whipp," ""Hell or High Water"" is a gripping heist drama keenly attuned to the outsider politics of our times."
Metro," August 10, 2016",Matt Prigge," The rare crime movie with room for both commentary on the housing crisis and ""That's what she said"" jokes."
Consequence of Sound," August 10, 2016",Randall Colburn," A thrilling, tense, and weirdly funny heist film anchored by a tight, no-nonsense script."
San Diego Reader," August 10, 2016",Matthew Lickona, Director David Mackenzie tells a sad story about desperate characters that is somehow as thrilling as it is heartbreaking.
The Movie Minute," August 10, 2016",Joanna Langfield, Not everything is what it seems in this deceptively simple story. 
The Daily Beast," August 11, 2016",Nick Schager," It allows Jeff Bridges to deliver what may be one of the most colorful, and yet nuanced, performances of his career."
Playboy Online," August 11, 2016",Stephen Rebello," Although you can pretty much guess how things are going to play out in the finale, the ride is so satisfying, bleakly funny and well-acted, you almost wish the cat-and-mouse games would never end."
St. Paul Pioneer Press," August 11, 2016",Chris Hewitt (St. Paul)," ""Hell or High Water"" is very, very good."
Beliefnet," August 11, 2016",Nell Minow," A gripping story that touches on the most profound American struggles - from guns to real estate, race, and income inequality - specific in detail but universal in scope. "
New York Times," August 11, 2016",Jeannette Catsoulis," If there's such a thing as an easygoing thriller, then ""Hell or High Water"" is it. The stakes may be steep, but the characters can seem more nonchalant than nervous."
Austin American-Statesman," August 11, 2016",Charles Ealy," British director David Mackenzie knows how to deliver a rip-roaring crime thriller, and he has an ear for West Texas idioms, too."
San Francisco Chronicle," August 11, 2016",Walter V. Addiego," Despite the weighty issues at play, there's much about the movie to simply enjoy -- the camaraderie of the brothers and the lawmen, and the not infrequent elements of humor. "
TheWrap," August 11, 2016",Robert Abele, Feels old-fashioned in its action-thriller gratification and in-the-moment about everything else.
Deadline Hollywood Daily," August 11, 2016",Pete Hammond, A great American film that is not only an exciting cat and mouse bank robber thriller but also a movie with much relevance for these times.
Willamette Week," August 11, 2016",Grace Culhane, Standout acting elevates what could have been a clumsy script from writer Taylor Sheridan (the former Sons of Anarchy star).
NPR," August 11, 2016",Chris Klimek," The 101 minutes that follow essentially comprise a feature-length Nebraska-era Bruce Springsteen song, their brilliance lying in the details."
Rolling Stone," August 11, 2016",Peter Travers," Hot damn, this one's a goodie - a mesmerizing, modern-day western that moves with the coiled intensity of a rattlesnake ready to spring."
Punch Drunk Critics," August 11, 2016",Travis Hopson, Hell or High Water is more than just another movie about cops and robbers.
Den of Geek," August 11, 2016",Don Kaye, It's simply one of the best films of the year.
amNewYork," August 11, 2016",Robert Levin, There's a real sense of desperation embedded in the core of the picture.
New York Post," August 11, 2016",Kyle Smith," ""Hell or High Water"" overcomes its vapid political leanings with loads of West Texas atmosphere, smart dialogue and acutely observed relationships."
Paste Magazine," August 11, 2016",Kenji Fujishima, A sterling example of genre craftsmanship at its intelligent and unexpectedly affecting best.
Chicago Sun-Times," August 11, 2016",Richard Roeper, You could freeze nearly any frame of Hell or High Water and you'd be looking at a work of art. It's stark and breathtaking and gorgeous to behold.
Austin Chronicle," August 11, 2016",Marjorie Baumgarten," Misgivings, maybe, but the go-for-broke performances by Bridges, Foster, and Pine are just so damned enjoyable that little impedes the fun while the movie is unfolding."
honeycuttshollywood.com," August 11, 2016",Kirk Honeycutt," ""Hell or High Water"" may be the best picture released so far in 2016."
The Patriot Ledger," August 14, 2016",Dana Barbuto," Pine, best known as Capt. Kirk in the blockbuster ""Star Trek"" franchise, is the movie's big surprise."
The Atlantic," August 14, 2016",Christopher Orr," Hell or High Water is a genre film that transcends genre, an iconic American tale that is nonetheless firmly grounded in both place and time. One of the best movies of the year."
LarsenOnFilm," August 13, 2016",Josh Larsen," Stillness can be peaceful, but it can also be menacing."
Time Out," August 12, 2016",Tom Huddleston," You've seen it all before -- but hell, it's worth seeing again."
San Diego Union-Tribune," August 12, 2016",Anders Wright," ""Hell or High Water"" is one of the most original, entertaining and intriguing films of 2016."
The Verge," August 12, 2016",Tasha Robinson," David Mackenzie's terrifically tense Western Hell or High Water is set in the present, but it keeps emphasizing that in some key ways, life hasn't changed in West Texas since pioneer days."
Chicago Reader," August 12, 2016",J. R. Jones," When the final showdown arrives, the men are redefined by their deeds and what began as a sharp genre piece deepens into a subtle character study."
Reel Reviews," August 12, 2016",Frank Wilkins, Is always better when Bridges is on the screen... but Foster and Pine certainly hold up their end of the bargain with performances to be considered among their very best.
Newcity," August 12, 2016",Ray Pride," Moment to moment, frame for frame, David Mackenzie's Hell Or High Water is the best American movie released so far this year."
San Francisco Examiner," August 12, 2016",Jeffrey M. Anderson," ""Hell or High Water"" is a great genre picture: film noir cannily combined with a Western, but with a modern-day setting."
HollywoodInToto.com," August 12, 2016",Christian Toto, Can we edit out all the extraneous lecturing and make Hell or High Water a four star movie? Please?
Boston Herald," August 12, 2016",James Verniere," One of the best American films of the year. Bridges is Oscar bait, again."
Mark Reviews Movies," August 12, 2016",Mark Dujsik," Hell or High Water is a simple but perceptive, morally ambiguous, and detailed piece of storytelling."
Reeling Reviews," August 12, 2016",Laura Clifford," Wow. Not since ""No Country for Old Men"" has a modern Western been so thematically rich."
RogerEbert.com," August 12, 2016",Peter Sobczynski, It's frustrating that Hell or High Water contains so many good things that just don't coalesce into a fully satisfying moviegoing experience. 
Pajiba," August 12, 2016",Kristy Puchko," It's so rich in detail and atmosphere, you'll marvel that an English auteur spun such a stirring story about good ol' boys in the new Old West."
Forbes," August 12, 2016",Mark Hughes, Hell or High Water is one of the great modern westerns... the sort of substantive food for the soul we all need to experience.
Washington Free Beacon," August 12, 2016",Sonny Bunch," Hell or High Water is one of the best films released thus far this year. The action unfolds efficiently, alternating deftly between tense action and genuine hilarity."
Screen It!," August 12, 2016",Jim Judy," My number one film of the year. Yes, it's that good. (Full Content Review for Parents - Violence, Sexual Content, Profanity, etc. - also Available)"
ComingSoon.net," August 12, 2016",Alan Cerny," A wonderful modern Texas Western, full of terrific performances by Chris Pine, Jeff Bridges, Ben Foster and Gil Birmingham."
NUVO Newsweekly," August 18, 2016",Edward Johnson-Ott, Hell or High Water takes a story that's been told many times before and makes it feel vital.
Bullz-Eye.com," August 18, 2016",David Medsker," If Blood Simple and Fargo were forced to mate, the offspring would turn out a lot like this."
Parade Magazine," August 18, 2016",Neil Pond," Puts the line between right and wrong underneath a scorching, unforgiving Texas sun then stretches it out on a lonesome, steaming highway, toward a blurred horizon, with no clear end in sight."
TIME Magazine," August 18, 2016",Stephanie Zacharek," The plot is clever, and its intricacies are beautifully worked out."
Las Vegas Weekly," August 17, 2016",Josh Bell, One of the most enjoyable and satisfying moviegoing experiences of the year.
NOW Toronto," August 17, 2016",Glenn Sumi, The real joy of the film is in watching Bridges and Birmingham play out their affectionate working dynamic like two characters in an Elmore Leonard novel.
Uproxx," August 17, 2016",Keith Phipps," The unhurried approach both ratchets up the tension and allows more time to get to know the players, who often talk around what they want to say in barbed, witty, Elmore Leonard-inspired dialogue."
EricDSnider.com," August 17, 2016",Eric D. Snider," A crackling example of the New Western, mixing familiar archetypes into an entertaining genre exercise."
Miami Herald," August 17, 2016",Rene Rodriguez," ""Hell or High Water"" is a story about men, but the movie is really about a mindset, a way of life, the strength and resolution required to make a living in a world that doesn't care about you. "
Groucho Reviews," August 17, 2016",Peter Canavese," Old-school bank robbery meets the new economy-and the New West-in Hell or High Water, a lean tale of cops and robbers, cowboys and Indians, and customers and bankers."
"Journal and Courier (Lafayette, IN)"," August 16, 2016",Bob Bloom," 'Hell or High Water' has a satisfying, old Western feel to it. The tense finale adds an interesting flourish that leaves you wanting more."
Flavorwire," August 16, 2016",Jason Bailey," Give me a well-made little genre exercise like this over a bloated franchise flick any day of the week. This one's got something on its mind to boot, which makes it one of the few must-see movies of the season."
Tampa Bay Times," August 16, 2016",Steve Persall," ... a movie with Lone Star swagger matching its dusty characters, scripted by Taylor Sheridan with the arcing tension he took south of the border in last year's thrilling Sicario. "
Vox," August 15, 2016",Peter Suderman, It's a portrait of economic desperation rooted in a specific place and a specific time that also happens to be a thrilling heist film.
Epoch Times," August 15, 2016",Mark Jackson," Robbing of banks may be very 1800s, but robbing by banks is very 2010s/post-Occupy. Ergo, robbing robber banks makes for a post-Occupy Western. Pine, Foster, and Bridges kill it."
The Young Folks," August 15, 2016",Allyson Johnson," Engaging from the first second onward, Mackenzie has created yet another stunner."
New Yorker," August 15, 2016",Richard Brody," The action is as schematic and artificial as a chess game, and the characters have as much identity as its pieces."
Baret News," August 15, 2016",Kam Williams, A neo-noir masterpiece not to be missed!
ReviewExpress.com," August 14, 2016",Diana Saenger," Great drama, cast and cinematography"
We Got This Covered," August 14, 2016",Bernard Boo," Pulpy, old-fashioned Western action and terrific performances make Hell or High Water one of the most satisfying releases of the summer."
KPBS.org," August 19, 2016",Beth Accomando," Hell or High Water is something rare. It's a film for adults and by that I mean it's smart, it has something to say, and it doesn't condescend to the audience."
Baltimore Magazine," August 19, 2016",Max Weiss," Mackenzie happens to be Scottish, but he's made the best American Western in years."
Bangkok Post," August 19, 2016",Kong Rithdee," For all the genre formula -- the robbing, the hideout, the chase, the ambush -- the film is less about thrills than about slow-burning tension, and it stands out with its cultural and socio-economic specificity."
Cleveland Plain Dealer," August 19, 2016",Joanna Connors, Every element of the movie feels at once lived-in and alive. Don't miss it.
Suburban Journals of St. Louis," August 19, 2016",Mathew DeKinder," This free-wheeling crime drama is packed to the gills with atmosphere, color and performances to the point the movie itself speaks with a gritty drawl."
Tri-City Herald," August 19, 2016",Gary Wolcott, One of the year's best. See this one come hell or high water. 
Toronto Star," August 19, 2016",Peter Howell," Hell or High Water isn't just a great time at the movies, it's one of the year's best pictures."
Globe and Mail," August 19, 2016",Brad Wheeler," Scenic, well-paced and rich in dialogue and character, the film is Coen brothers for the squares, and maybe the best middle-of-the-seat drama of the summer."
Detroit News," August 19, 2016",Adam Graham," The cast is uniformly magnificent, but it's Pine who steals the movie."
Philadelphia Inquirer," August 19, 2016",Steven Rea," Hell or High Water is at once a tale of desperation in hard times, and a keenly observed character study - or studies."
Salt Lake Tribune," August 18, 2016",Sean P. Means," The Old West meets the modern West in Hell or High Water, a soulful crime drama about desperate brothers pitted against the system -- and one cagey lawman."
Fresno Bee," August 18, 2016",Rick Bentley," [Hell or High Water] rides superb writing, Oscar-caliber performances and a serious social message to such grandeur as to make it one of the best pictures of 2016."
Wall Street Journal," August 18, 2016",Joe Morgenstern," A film with the sort of sweeping grandeur that today's filmmakers rarely aspire to, let alone fulfill."
Georgia Straight," August 18, 2016",Adrian Mack, [A] near-perfect film.
National Post," August 18, 2016",Chris Knight," By the time we reach the climax of this smoking modern western, the conclusion seems both tense and inevitable."
Fort Worth Weekly," August 18, 2016",Kristian M. Lin," It lets us make our own judgments about what its flawed characters do, and that makes this low-budget genre exercise one of the best things I've seen this year."
Kansas City Star," August 18, 2016",Robert W. Butler," ""Hell or High Water"" is about two brothers on a crime spree. But David Mackenzie's film has a lot more on its mind than mere suspense and thrills."
St. Louis Post-Dispatch," August 18, 2016",Calvin Wilson," Much more than a genre piece, ""Hell or High Water"" takes you places that you thought the big screen had forgotten."
