source_name,review_date,critic_name,review_detail
Toronto Sun," December 8, 2016",Jim Slotek," At the core of it all is Natalie Portman's masterful performance of a strong, tightly-reined personality, seen in almost painful, constant close-up."
Mark Reviews Movies," December 8, 2016",Mark Dujsik," The film is wise in the way it sees Jackie as a constructor of narratives, and it's tragic in its recognition that those narratives have little to do with her. "
Toronto Star," December 8, 2016",Peter Howell," What emerges is more serious docudrama: a fully rendered vision of a woman ill-served by most previous accounts, featuring an Oscar-worthy lead performance by Portman. It's also one of the year's best movies."
SF Weekly," December 8, 2016",Jeffrey Edalatpour," Instead of devolving into a Warholian pop artifact, the prescient Jackie offers a raw blast of electoral catharsis."
Movie Nation," December 8, 2016",Roger Moore, An iconic performance packaged in a film good enough to support it. 
Washington Post," December 8, 2016",Ann Hornaday," ""Jackie"" would have been an exceptionally smart, intriguing movie as an astutely conceived, well-crafted meditation on political mythmaking. In Larraín and Portman's hands, it becomes something deeper and more emotionally potent."
Chicago Tribune," December 8, 2016",Michael Phillips," Even if it lacks full dimension, and a final imaginative leap past the biopic strictures, ""Jackie"" pulls you into its web, shot by shot, moment by moment - most of them Portman's."
Arizona Republic," December 8, 2016",Bill Goodykoontz," It's not a one-woman show but it's clearly Portman's film, and she makes the most of it, helping Larrain to answer the question: How are myths made?"
New York Observer," December 8, 2016",Rex Reed, A carefully compiled dossier on the life of an ordinary woman in extraordinary times whose dignity and grace under pressure humbled the world at the time and influenced future generations without planning to.
CinemaBlend.com," December 8, 2016",Greg Wakeman," While the gorgeous and mesmerizingly subversive biopic itself is destined to be cult rather than classic, Portman's is a performance for the ages, and one that makes Jackie utterly irresistible."
Newcity," December 7, 2016",Ray Pride," Dazed yet undaunted, grief-stricken but determined, genteel yet steely, Jackie is the role Natalie Portman was born to embody, swaddled in a brilliant skin of a score by Mica Levi. "
Paste Magazine," December 7, 2016",Dom Sinacola," If the film is about grief, then the film must act as grief acts. Unmoored and aimless, Jackie acts like a bad dream."
Chicago Daily Herald," December 7, 2016",Dann Gire," Jackie is a triumph of production design, period costuming and vintage cars and props, all captured by Stephane Fontaine's formal camera lens in a mix of sharply defining close-ups and scenes constructed of Kubrickian symmetry."
"HeraldNet (Everett, WA)"," December 16, 2016",Robert Horton," Portman's scarily composed performance is laser-focused, an act of empathy without tears."
Under the Radar," December 16, 2016",Shawn Hazelett, Jackie proves that grace and composure are qualities that matter in our leaders in a year when many Americans want to deny it.
One Guy's Opinion," December 16, 2016",Frank Swietek, Whether...this amounts to much more than a bit of tabloidism with pretensions...is open to question.
Detroit News," December 16, 2016",Adam Graham," ""Jackie"" is a gamble, and Portman makes it pay off."
San Diego Reader," December 15, 2016",Scott Marks," Together [director Larrain and star Portman] trap the character on film, like a rose frozen in a block of ice."
leonardmaltin.com," December 15, 2016",Leonard Maltin, Jackie begins at a fever pitch and never lets up. What Noah Oppenheim's dazzling screenplay & Pablo Lorrain's direction manage to thrust us back in time and make us see a series of historical events in a way we never have before
Sacramento News & Review," December 15, 2016",Daniel Barnes," All the perfectly manicured technical elements assembled by Larraín are the reasons to watch Jackie, even as they overwhelm a slight and not particularly revealing story."
Georgia Straight," December 15, 2016",Ken Eisner, How about just telling the story straight?
Philadelphia Inquirer," December 15, 2016",Steven Rea," It is a fever dream of a movie, tracking its subject as she tries to maintain control, maintain her composure, her sanity."
Cleveland Plain Dealer," December 15, 2016",Joanna Connors," Enormously moving, but flawed."
Fort Worth Star-Telegram/DFW.com," December 15, 2016",Cary Darling, Larrain's gorgeously grim and austere vision bolsters a bravura performance from Natalie Portman. She inhabits Jackie as a woman who has been shaken to her core with grief.
Graffiti With Punctuation," December 15, 2016",Blake Howard," Jackie's power is in the sticky quality of the moments of pure cinematic composition. Those images, moments and chords in the score flicker in your memory long after the viewing. "
Seattle Times," December 14, 2016",Moira MacDonald," ""Jackie"" is mesmerizing; a familiar story told from an entirely different angle."
Cambridge Day," December 13, 2016",Tom Meek," It's an impressively bold go at such a revered presidency, and much of the project's success hangs on Natalie Portman's fully immersed and utterly mesmerizing portrait of the grieving first widow."
Huffington Post," December 12, 2016",Derek Malcolm, How do you dramatise history on film without adding a large dollop of fiction to the mix? Many have tried and most have failed. But Pablo Larraín succeeds better than many with Jackie.
The Young Folks," December 12, 2016",Yasmin Kleinbart," It's a very intimate character study that shows this woman, who is known for her poise, break down like any other human being."
Medium," December 11, 2016",Chris Barsanti, ...wrenching and unforgettable
The Patriot Ledger," December 10, 2016",Al Alexander," Larrain succeeds - to a point. His hindrance is Portman, whose Jackie exists without an inner-life."
RedEye," December 9, 2016",Shelbie Lynn Bostedt, Portman reconciles the indulgent and extravagant aspects of Jackie's character with the strong-willed first lady looking to create something for the American people out of a nationwide tragedy.
Cinemaclips.com," December 9, 2016",Roger Tennis," Revealing her strength during the end of the presidential Camelot, 'Jackie' is a royal depiction."
Blu-ray.com," December 22, 2016",Brian Orndorf," Portman's body language, a profound interior burn, is brilliant."
Las Vegas Review-Journal," December 22, 2016",Christopher Lawrence," Jackie paints a chilling portrait of the former first lady, spectacularly portrayed by Natalie Portman, in the moments and days after her husband's assassination in Dallas."
Minneapolis Star Tribune," December 22, 2016",Colin Covert," This is a movie about power, and its spectacle is that of a woman almost losing all of it. Larrain portrays all of this with the appropriate degree of horror and sorrow."
Orlando Weekly," December 22, 2016",Thaddeus McCollum," The success of any biopic rests squarely on the shoulders of the actor playing the subject, and Natalie Portman harnesses every bit of the strength and fragility she displayed in her Oscar-winning role in 2010's Black Swan to astounding effect."
The Nation," December 21, 2016",Stuart Klawans," Love and ambition struggle again, this time to world-shaping effect without and (in the devastating last scenes) despair within."
Groucho Reviews," December 21, 2016",Peter Canavese," The serviceable movie you make about this subject. But it does offer a little bit more, peeking through with an interesting insight every quarter-hour or so."
Salt Lake Tribune," December 21, 2016",Sean P. Means," Portman's performance reaches past mere impersonation to capture her sense of dignity that allowed her, in the face of her husband's horrific death, to complete the task of establishing his place in history."
Tulsa World," December 21, 2016",Michael Smith," There's no denying Portman's depiction of class and grace under pressure, capturing the emotions of that time and showing people who were scared and confused a way to heal."
Playback:stl," December 21, 2016",Sarah Boslaugh, Natalie Portman's performance is a masterpiece of carefully controlled emotion...
"Journal and Courier (Lafayette, IN)"," December 20, 2016",Bob Bloom," ... 'Jackie' is an extraordinary and intimate look at an iconic figure who put her stamp on the White House, the nation and our perception of grace and beauty."
Las Vegas Weekly," December 20, 2016",Josh Bell, An impressionistic portrait that says more in images than in words.
St. Louis Post-Dispatch," December 20, 2016",Calvin Wilson," Portman is simply brilliant, getting to the essence of Jackie without resorting to a mere impersonation."
Tampa Bay Times," December 20, 2016",Steve Persall," Larrain spins a tale of dignified anguish and calculations less sympathetic. Anchored by Natalie Portman's uncanny impersonation - wispy voice, aristocratic posture - Jackie fascinates and frustrates, sometimes at once. "
Kansas City Star," December 20, 2016",Jon Niccum," The film instead becomes preoccupied with trendy period detail and the mannered performance of its star, rather than in finding deeper truths about the subject."
Suite101.com," December 20, 2016",Nick Rogers," The best film about any Kennedy since ""JFK."" This is not a safe, comfortable, amber-encased reminiscence people may want. It's a mesmerizing, insidious suggestion of how deep the American political rot may run and for how long it has done so."
CineXpress," December 19, 2016",Fico Cangiano," Jackie breaks new ground inside the biopic genre, thanks to a magnificent direction by Pablo Larráin and Natalie Portman's best performance to date. One of the best films of 2016. [Full review in Spanish]"
Times-Picayune," December 19, 2016",Mike Scott," Natalie Portman is sensational in what ends up as a powerful, intimate and award-worthy portrait of a very public grief."
Creative Loafing," December 18, 2016",Matt Brunson, Natalie Portman delivers a tremendous performance in a movie that marches to its own beat without ever taking its eye off the ball.
ReelViews," December 18, 2016",James Berardinelli, The title character never emerges from the iconic shell she inhabits to become a fully fleshed-out individual and the filmmakers are perhaps too reverential to make her seem real.
AARP Movies for Grownups," December 16, 2016",Bill Newcott, There's an eerie rightness: the bright Dallas sun; the long Washington shadows; the delicate bouclé of that pink Chanel suit; the clarion clip-clop along Pennsylvania Avenue. 
The Popcorn Junkie," January 11, 2017",Cameron Williams," If the winners write history, the survivors become guardians of the legacy."
FILMINK (Australia)," January 10, 2017",Sophia Watson, ...sets the new standard for the biopic genre against which all future attempts will likely be measured. 
News.com.au," January 10, 2017",Wenlei Ma, Pablo Larrain has crafted a visually stunning and emotionally raw film but what really brings Jackie to life is Natalie Portman's extraordinarily complex performance. 
National Review," January 9, 2017",Armond White," [Jackie is] a tour de force that works precisely because it doesn't have to be totally convincing, just insightful."
El Nuevo Herald (Miami)," January 6, 2017",Pilar Ayuso, An intelligent and emotional biographical piece. It's the tragedy in the face of a young widow. [Full review in Spanish]
The Australian," January 6, 2017",David Stratton," From the beginning of the film, with its mournful, atonal music score by Mica Levi, it's obvious that this is no conventional dramatisation of the events that arguably brought to an end America's innocence."
The Mary Sue," January 5, 2017",Charline Jao," There are two narratives at war in Jackie: One is a decent but disposable showcase of dialogue, the other a masterpiece streaming through sentiments."
Student Edge," January 4, 2017",Simon Miraudo," History comes to life and a former First Lady becomes a walking ghost in Pablo Larraín's strange, disquieting biopic, Jackie."
HollywoodInToto.com," January 3, 2017",Christian Toto, Torture-lot.
Washington City Paper," January 2, 2017",Tricia Olszewski," Yes, the actress nails Jackie's soft, breathy, almost brittle voice. Yes, she moves about with the perfect posture and grace that Kennedy was known for. Yet her Jackie rarely feels lived-in."
MetroActive," January 1, 2017",Richard von Busack, A movie like this stands or falls by its lead performance. Fall it does.
ColeSmithey.com," January 1, 2017",Cole Smithey, [Here is an] ill-conceived movie further hobbled by an inarticulate script ineptly executed by miscast actors - gross political exploitation at its lowest. 
The Virginian-Pilot," December 29, 2016",Mal Vincent, One could excuse the lack of factual detail if the movie had some focused impression to suggest.
It's Just Movies," December 27, 2016",Ron Wilkinson, Viewers who were alive and witnessed it will find it inspiring. Those who were not will find it flat.
East Bay Express," December 27, 2016",Kelly Vance," The film is not a document, nor a myth, nor a political indictment, but a completely subjective, artfully wrought fragment of the American mystique."
EntertainmentTell," December 23, 2016",Stephen Silver, A brilliant performance surrounded by an otherwise unremarkable movie. (Splice Today) 
"Star-Democrat (Easton, MD)"," December 23, 2016",Greg Maki," ... A mesmerizing picture that stays with you after the lights go up, but it's not one to be enjoyed."
Austin Chronicle," December 22, 2016",Marc Savlov," It is, in its own way, a eulogy not just to Camelot but to the American dream itself. It is grace in the midst of madness."
LarsenOnFilm," December 22, 2016",Josh Larsen, ...a psychodrama more than a standard biopic.
New England Movies Weekly," December 22, 2016",Daniel M. Kimmel," We've known for some time that Natalie Portman is a fine actress, but with her portrayal of Jacqueline Kennedy she steps into the front ranks."
CineVue," January 17, 2017",Matthew Anderson," Breathes life, hope, blood, sweat and tears into despair."
Concrete Playground," January 16, 2017",Tom Glasson, A captivating and unflinching portrait of private grief amidst one of history's most public tragedies.
Empire Magazine," January 16, 2017",Olly Richards, Jackie does what the very best biopics should: it makes you view someone you've seen countless times as if you were seeing them anew.
Total Film," January 16, 2017",Neil Smith," Portman's Oscar-worthy work crowns an unconventional study of an icon, while Mica Levi's score is sublime."
The List," January 16, 2017",Angie Errigo," A mesmerising reflection on celebrity, memory and the determined individual crafting history."
Urban Cinefile," January 15, 2017",Louise Keller, Natalie Portman's central multi-layered performance is unforgettable for many reasons. Beyond the physical illusion... her portrayal is both internal and external
MediaMikes," January 14, 2017",Michael A. Smith," Natalie Portman captures every facet of Jacqueline Kennedy. The smiling, laughing young woman and the embittered widow, refusing to change out of her clothes, stained with her husband's blood"
Daily Telegraph (Australia)," January 13, 2017",Nick Dent, Immensely powerful.
Sydney Morning Herald," January 13, 2017",Paul Byrnes, Natalie Portman's performance is as good as everyone says.
Arkansas Democrat-Gazette," January 13, 2017",Philip Martin," Working from a nuanced script by Noah Oppenheim, Larrain has fashioned a solemn film that mourns what never came to be more than what was lost."
Cinemixtape," January 12, 2017",J. Olson," A beautiful, bewildering film that bounces from haunting to overblown and back again without a moment's notice, ending up an oddity most befitting of its subject."
Fresno Bee," January 12, 2017",Rick Bentley," The entire movie resonates with an authenticity that stems from Portman's performance. From the wardrobe to the re-creation of historical moments, there are no shortcuts taken."
Adelaide Review," January 12, 2017",David 'Mad Dog' Bradley," [Jackie] is held together by a startling performance by Natalie Portman, who goes beyond mere chameleonic imitation and offers something truly emotionally wrenching."
Flicks.co.nz," January 12, 2017",Leonie Hayden," A fascinating, high energy, character study and well worth your time if you don't mind the emotional cost."
The Skinny," January 12, 2017",Patrick Gamble, A bewitching study of mythmaking that underlines Pablo Larraín's status as cinema's most daring political filmmaker.
New Zealand Herald," January 11, 2017",Francesca Rudkin," Portman and Larrain have done a terrific job presenting a complex, conflicted and often-contradictory character, who struggled at times to be the person others wanted her to be."
Daily Telegraph (UK)," January 11, 2017",Robbie Collin," This is a cinema of no escape, and few if any actors will have to shoulder the same burden of expressive responsibility this year - yet the never-better Portman simply shines beneath it, giving a performance of mesmeric complexity and commitment."
Sydney Morning Herald," January 11, 2017",Sandra Hall, Larrain has carried off a perfect fusion of the personal and the political. The story of one woman's loss has become a study in America's sustaining need to turn its leaders into myth.
Willamette Week," January 11, 2017",Isabel Zachariah," This film is less an isolated Jackie Kennedy biopic than a dark and conceptual statement on how the American people classifies, experiences and remembers historic tragedies."
Herald Sun (Australia)," January 11, 2017",Leigh Paatsch," By the end of the film, Portman has drained the iconic Jacqueline Kennedy of every last drop of her famously fluid grace and poise, and we have watched it harden into resilience and defiance."
Little White Lies," January 20, 2017",Sophie Monks Kaufman," Clever, beautiful images about a clever, beautiful image-maker."
The Arts Desk," January 19, 2017",Markie Robson-Scott," Portman's portrayal of explosive yet restrained grief packs a punch, and Jackie's loneliness is palpable, emphasised by the White House's enormous rooms, Mica Levi's disquieting score... and cinematographer Stéphane Fontaine's long shots."
Sky Movies," January 19, 2017",Tim Evans, [An] engagingly unconventional chronicle of the days between JFK's assassination and his elaborate state funeral.
Times (UK)," January 19, 2017",Kate Muir, [Jackie Kennedy] is played to perfection by Natalie Portman.
Scotsman," January 19, 2017",Alistair Harkness," Don't expect a comprehensive biopic of the wife, mother, widow, tastemaker and White House style icon. This is a rigorous exploration of Jackie Kennedy's steely determination ..."
Radio Times," January 19, 2017",Emma Simmonds," Daringly intimate and unusually insightful, Jackie sees a South American provocateur take on an all-American idol - and the results are unforgettable."
Daily Express (UK)," January 19, 2017",Allan Hunter," A fascinating film with a complex, moving performance from Natalie Portman, sounding strangely like Marilyn Monroe in places, and a sentimental belief in the enduring promise of Kennedy's brief, shining moment as president."
RTÉ (Ireland)," January 19, 2017",John Byrne, In a word: Oscars!
Junkee," January 19, 2017",Mel Campbell," By immersing us in Jackie Kennedy's (Natalie Portman) subjective experience rather than observing her from the outside, Larraín gets closer than a traditional biopic to capturing an individual's capacity to shape history."
The Spectator," January 19, 2017",Deborah Ross," Was I riveted by Natalie Portman as Jackie Kennedy? I was... But was I aware it was Natalie Portman, Acting? Always. And there isn't much else here."
New Statesman," January 19, 2017",Ryan Gilbey," For all the bustle around her, the film insists on Jackie's aloneness and Portman gives a performance in which there is as much tantalisingly concealed as fearlessly exposed."
Guardian," January 19, 2017",Peter Bradshaw," It is well made, handsomely furnished, punctiliously designed and the use of Richard Burton's sonorous tones on the Kennedys' LP of the musical Camelot is a nice moment."
Financial Times," January 19, 2017",Nigel Andrews," There is kitsch but no corn in this piercingly intelligent film. Even the press-interview framing device, a tired trope in some cinema, proves its sly mettle."
ABC Radio (Australia)," January 18, 2017",CJ Johnson, Has almost unbearable extra resonance in these waning days of the Obama administration ... The themes are big but the focus is tight as a drum ... astonishingly effective production and costume design ... Portman [give]s [a] tremendous performance.
Trespass," January 18, 2017",Alex Doenau," More mood piece than standard narrative, more character sketch than study, Jackie is a fascinating film that rewards as it confounds."
Independent (UK)," January 18, 2017",Geoffrey Macnab, It's the incongruity of the Jackie Kennedy story told in Pablo Larrain's Jackie that makes the film so compelling.
Seven Days," January 18, 2017",Margot Harrison," The woman comes across as imperious, mercurial and sometimes eccentric, but always real. "
Irish Times," January 18, 2017",Donald Clarke, Larraín has made an incomparable film on the process of moving queasily into uncertainty. 
Impulse Gamer," January 17, 2017",Damien Straker," To be moved by this film, directed by Chilean filmmaker Pablo Larraín, it is important to absorb it as a visual experience first and allow yourself to be entranced by its images."
ArtsHub," January 17, 2017",Sarah Ward," An interpretation of how the bereaved woman at its core copes... purposefully restless in look and in mood yet still attuned to the impact of glances, choices, words and objects."
