source_name,review_date,critic_name,review_detail
BuzzFeed News," May 4, 2016",Alison Willmore," The film captures the earnestness and the silliness of the boys' efforts, but also how little that matters when you're discovering what it feels like to create something."
Spirituality and Practice," May 4, 2016",Frederic and Mary Ann Brussat, A spunky romantic drama about a gifted singer and songwriter who is transformed by music and love
ReviewExpress.com," April 29, 2016",Jean Lowerison, Singing for Survival
"HeraldNet (Everett, WA)"," April 29, 2016",Robert Horton," There are enough delicious details here to keep ""Sing Street"" alive and kicking."
ComingSoon.net," April 29, 2016",Alan Cerny," John Carney's third film is a joyous celebration of 1980s rock, youth, and love. One of the best films of the year."
East Bay Express," April 29, 2016",Kelly Vance, No one will ever hate him- or herself for going along with the sentimental Irish improbabilities.
Movie Nation," April 29, 2016",Roger Moore," Sure, it's only ""Commitments-Lite."" It's still infectious and sweet"
HollywoodInToto.com," April 29, 2016",Christian Toto, Save some time. Go buy the soundtrack before you see this vibrant slice of '80s pop culture.
Playback:stl," April 29, 2016",Sarah Boslaugh, ... a delightful little film that feels true to its time and place.
New Statesman," June 9, 2016",Ryan Gilbey," If anything, it's even better than The Commitments because it doesn't go in for the slick manipulation associated with that film's director, Alan Parker."
"Quad City Times (Davenport, IA)"," June 8, 2016",Linda Cook, 'Sing Street' hits all the right notes. 
South China Morning Post," June 6, 2016",James Marsh," Sing Street pays loving tribute to a decade of woeful fashion choices and the music of Duran Duran, Spandau Ballet and The Cure, while capturing the emotional vulnerability of adolescent artistic expression."
Contactmusic.com," May 24, 2016",Rich Cline," A buoyant celebration of the power of music, this is the third blissfully entertaining musical romance from John Carney, who also wrote and directed Once and Begin Again."
London Evening Standard," May 22, 2016",Charlotte O'Sullivan, Carney nails every quirky detail.
Daily Express (UK)," May 22, 2016",Henry Fitzherbert," After Once and Begin Again, Irish writer-director John Carney makes it a hat-trick of delightful rites-of-passage musical films with his latest, Sing Street."
Daily Express (UK)," May 22, 2016",Allan Hunter," Coming after Once and Begin Again it offers further proof of director John Carney's ability to make crowd-pleasing musical dramas with a lingering, bittersweet aftertaste."
Observer (UK)," May 22, 2016",Mark Kermode," I laughed, I cried, I bought the soundtrack album."
WOW247," May 20, 2016",Matthew Turner, Carney's captivating combination of catchy songs and compelling characters is so charming you won't want it to end. Surely set to be one of the films of the year.
Independent (UK)," May 19, 2016",Geoffrey Macnab, For at least half its running length Sing Street is tremendous: a coming of age story set in early 80s Dublin that has the comic poignance and truthfulness of a Gregory's Girl or a Son Rambow.
The Sun (UK)," May 19, 2016",Jamie East," Love the film, buy the soundtrack, paint your nails, put some blusher on and fall in love for the first time, again."
Sky Movies," May 19, 2016",Tim Evans," Exuberant in a winningly ramshackle way, this is the cinematic equivalent of a classic disposable pop song and - as Noel Coward pointed out - it's ""strange how potent cheap music is...""​"
Radio Times," May 19, 2016",David Aldridge," Cornily heart-warming, it's an absolute delight and a welcome relief from the shock and bore of the typical multiplex blockbuster."
The Arts Desk," May 19, 2016",Matthew Wright," Carney seems to be viewing his imagined world with both sepia and rose tints, yet the result is still, with sufficient suspension of disbelief, sweetly enjoyable."
Tampa Bay Times," May 19, 2016",Steve Persall," John Carney's love affair with pop music is one of indie cinema's pleasures, blending a busker's spirit with lovely songs presented in stirring dramatic context."
Daily Telegraph (UK)," May 19, 2016",Rupert Hawksley, A delightful coming-of-age tale that both celebrates young love and laments how quickly the fire of youth can be snuffed out.
Guardian," May 19, 2016",Peter Bradshaw," Like a great pop song, this film is over much too soon."
Cinemixtape," May 18, 2016",J. Olson," As joyous a moviegoing experience as 2016 has offered to date, sweet and funny and just dark enough to keep the admittedly imitative story interesting."
SSG Syndicate," May 18, 2016",Susan Granger, Energetic and enjoyable - it's nostalgic music to your ears!
Little White Lies," May 18, 2016",David Jenkins, Like a tie-in soundtrack album in search of a movie.
