source_name,review_date,critic_name,review_detail
MovieWeb," March 3, 2016",Julian Roman," Disney's 'Zootopia' is wildly adventurous and knockdown funny, arguably the best film of 2016 so far."
Austin American-Statesman," March 3, 2016",Nicole Villalpando," [Zootopia is] incredibly entertaining in the beginning as we see how different animals live in different parts of Zootopia that feel very human, indeed... It's the dark middle part that is hard to reconcile in a Disney movie."
Paste Magazine," March 3, 2016",Andy Crump," Simple though its politics may be, the film is effective -- and coming from a mainstream studio, it is even just daring enough to make a difference."
New England Movies Weekly," March 3, 2016",Daniel M. Kimmel," Everything you could want in an animated film: creative visuals, solid script, engaging characters. "
Boston Globe," March 3, 2016",Tom Russo," An agreeable hodgepodge, at least, one that aims to be not just a breezy mystery, but also a race-and-ethnicity fable."
Wall Street Journal," March 3, 2016",Joe Morgenstern, Zootopia is Yootopia if you're looking for jaunty fun. 
Los Angeles Times," March 3, 2016",Gary Goldstein," Bursting with a rich blend of timely themes, superb voice work, wonderful visuals and laugh-out-loud wit, Walt Disney Animation Studios' ""Zootopia"" is quite simply a great time at the movies."
Film Comment Magazine," March 3, 2016",Michael Sragow," These filmmakers cross-fertilize social satire with burlesque, parody, and self-parody."
Collider," March 3, 2016",Matt Goldberg, It's got a catchy pop song and a nice message about working to achieve your dreams. But because the directors pushed further- in showing how prejudice seeps into our daily lives-they've made Zootopia a destination you absolutely must visit.
Birth.Movies.Death.," March 3, 2016",Devin Faraci," This charming, pop culture soaked movie admirably takes on racial issues but sags under the weight of its muddled metaphors."
Winnipeg Free Press," March 4, 2016",Randall King," Unlike a certain Pixar property having to do with automobiles, this one warrants a sequel."
"Deseret News, Salt Lake City"," March 4, 2016",Josh Terry," A rich blend of story, message and entertainment."
Salt Lake City Weekly," March 4, 2016",Scott Renshaw, It's confusing when it starts to feel that Zootopia is working against its own message to get easy laughs.
ScreenRant," March 4, 2016",Ben Kendrick, Zootopia is filled with lovable characters and a heartfelt message for kids - along with a layered subtext for adults that is both timely and moving. 
RogerEbert.com," March 4, 2016",Matt Zoller Seitz," A funny, beautifully designed kids' film with a message that it restates at every turn."
People Magazine," March 4, 2016",Alynda Wheat," Don't be surprised if Zootopia ends up becoming a kids' detective series, based on how fabulously these two go about working the case. "
Independent Online (South Africa)," March 4, 2016",Latoya Newman," The script is highly entertaining - funny enough to keep the young ones entertained, but witty enough to keep adults hooked and LOL-ing through most of the movie."
Cinemaclips.com," March 4, 2016",Roger Tennis, The cagey and delightful 'Zootopia' is creature comfort in every way. 
Tribune News Service," March 4, 2016",Katie Walsh," Somehow, Disney has managed to pull off a hard-boiled police procedural thriller about political corruption starring an adorable, large-eyed bunny. As strange as this combination might seem, it works. Who knew bunnies could make such intrepid rookie cops?"
San Diego Reader," March 4, 2016",Matthew Lickona, A buddy-cop comedy crossed with a political thriller and mashed up against a social drama. It's a credit to Disney's collaborative process that the whole thing manages to hold together as well as it does.
CraveOnline," March 4, 2016",William Bibbiani," Teems with sight gags and puns and pop culture references, but it's all an excuse to use the buddy cop genre they way it was always intended, as a form of social commentary."
San Francisco Examiner," March 4, 2016",Jeffrey M. Anderson," The computer-generated creatures have smooth and cheerful lines, like old-style ""stretch-and-squash"" animation. The movie is wonderfully fluid and graceful."
Tri-City Herald," March 4, 2016",Gary Wolcott, The motor vehicles department scene alone is worth the price of a ticket. I'm still laughing. 
Screen It!," March 4, 2016",Jim Judy," It's the best film so far of 2016 and should easily be at or near the top of the list for Best Animated Film come award season next December and beyond. (Full Content Review for Parents - Violence, Scary Stuff, etc. - Also Available)"
Parade Magazine," March 4, 2016",Neil Pond, Shows just how far the House of Mouse has evolved from dreamy prince-and-princess fairy tales of decades past.
Mark Reviews Movies," March 4, 2016",Mark Dujsik, [I]t's dealing head-on -- in that subversively indirect way that these animal-based tales do -- with issues that aren't so easily defined and are far more difficult to resolve.
Suburban Journals of St. Louis," March 4, 2016",Mathew DeKinder," ""Zootopia"" is a wolf in sheep's clothing, a movie packed with talking animals that dares to be something more by offering up a bold little slice of social commentary. "
Common Sense Media," March 4, 2016",Sandie Angulo Chen," Charming buddy-animal story promotes tolerance, teamwork."
NPR," March 4, 2016",Andrew Lapin," If Zootopia becomes fortunate enough to fall into Frozen-style heavy rotation for kids of a certain age, its messages of rejecting prejudice and embracing the complicated nature of multiculturalism could do some good for the world."
NPR," March 4, 2016",Bob Mondello, Credit the Disney folks with making what could have been a lecture on stereotypes into one of the more amusing animated kidflicks of recent vintage.
EntertainmentTell," March 7, 2016",Stephen Silver," Exciting visuals, good characters, lots of laughs and even a timely allegory about American race relations. (Splice Today) "
New Yorker," March 7, 2016",Anthony Lane," ""Zootopia,"" like its heroine, is zesty, bright, and breakneck, with chase scenes and well-tuned gags where you half expect songs to be."
SSG Syndicate," March 7, 2016",Susan Granger," The Mouse House may win the gold for Best Animated Feature in 2017 for this intrepid, action-packed comedy/police procedural parable."
ReelViews," March 6, 2016",James Berardinelli, There's a lot here for kids to like and nearly as much to keep parents from fidgeting.
Illinois Times," March 6, 2016",Charles Koplinski," Timely message buoys charming, clever ""Zootopia."""
The Atlantic," March 6, 2016",Christopher Orr," In many ways a conventional movie, but it unfolds with so much wit, panache, and visual ingenuity that it outstrips many a more high-concept film."
The Young Folks," March 6, 2016",Allyson Johnson," From the enormity of the world building, the slick animation, the enthusiastic voice work done by a sprawling cast and a script that's intelligent and warm, Zootopia is already shaping up to be a highlight of the 2016 cinematic year. "
Reeling Reviews," March 6, 2016",Laura Clifford," What an unexpected surprise, a Disney animation with Orwellian anthropomorphic political allegory and a film noir backdrop not seen since Roger Rabbit was framed."
The Patriot Ledger," March 5, 2016",Al Alexander," It should serve as a terrific inspiration for little girls to dream big and aspire high. But the larger message ""Zootopia"" is sending is one of tolerance and understanding."
Kaplan vs. Kaplan," March 5, 2016",Jeanne Kaplan, Sure to become a classic. 
Kaplan vs. Kaplan," March 5, 2016",David Kaplan, A movie you will tell your friends and family about. 
Creative Loafing," March 5, 2016",Matt Brunson, The beauty of Zootopia is that you can be unaware of the subtext (as would a child ... or a clueless Trump supporter) and still reap the benefits of an imaginatively designed endeavor packed with huge laughs.
Sci-Fi Movie Page," March 5, 2016",Rob Vaux," Zootopia is a great animated film, but it might be something much more: a clarion call for sanity and understanding arriving just when we need it the most. "
Cinemalogue.com," March 4, 2016",Todd Jorgenson," This 3D animated comedy has the expected combination of kid-friendly slapstick and pop-culture send-ups, but underneath that slick surface it promotes a message of tolerance and empowerment."
New York Magazine/Vulture," March 4, 2016",David Edelstein," What saves this big-budget cartoon behemoth is its modest, old-fashioned storytelling."
Movie Guys with Jeff & Dave," March 4, 2016",Jeffrey K. Howard, One of Disney's best animated films ever! Fun for adults and kids alike. 
El Nuevo Día," March 4, 2016",Juanma Fernández París, With this film Disney has a truly progressive jump with a character who achieves the seemingly impossible by his willpower and intelligence. [Full review in Spanish]
Aisle Seat," March 4, 2016",Mike McGranaghan, Zootopia is to 2016 what Inside Out was to 2015 - a next-level animated feature that gives kids something of substance while simultaneously showing them a really good time.
"HeraldNet (Everett, WA)"," March 4, 2016",Robert Horton," The comic high point is a scene at the DMV where sloths work behind the counter and talk. Very. Very. Very. Slowly. If the movie is overlong because of that one hilarious scene, it was worth it."
leonardmaltin.com," March 4, 2016",Leonard Maltin, Disarming characters... multidimensional plot form the core of an atypical Disney movie that's right on the mark...
ABC Radio Brisbane," March 19, 2016",Matthew Toomey," Stepping back from the movie's key themes, the creative team behind the project deserve praise for crafting a fun, complex world. "
The Mercury," March 18, 2016",Tim Martain," Much like George Orwell used animals as an allegory for communism and social inequality, Disney has used Zootopia to deliver a story about prejudice and intolerance."
Herald Sun (Australia)," March 18, 2016",Leigh Paatsch," A lively and universally accessible story is set in an idealised, human-free future where animals of all species have learned to live as one."
Flicks.co.nz," March 17, 2016",Liam Maguren, Threatens to blow away Shane Black's The Nice Guys for Best Buddy-Cop Film of 2016. 
Irish Times," March 17, 2016",Donald Clarke," Zootropolis has a plot you can really, ahem, sink teeth into."
Tulsa World," March 17, 2016",Michael Smith, Wildly entertaining.
The Standard," March 17, 2016",Matt Neal," A surprisingly sharp examination of racial profiling, prejudice, equality and stereotyping, and how often can you say that about a kids movie?"
Junkee," March 16, 2016",Matt Roden," I mean, come on -- what was the last kids film that stumbled because it was overreaching in its exploration of inclusiveness? Also -- those sloths!"
The Age (Australia)," March 16, 2016",Philippa Hawker," The tale of a plucky rabbit and a sly fox, it's also a meditation on human nature, civil society and the politics of stereotyping. And it has great sloth jokes."
The Sunday Age," March 16, 2016",Craig Mathieson," In this zippy and entertaining children's animation that comes with an unusually thoughtful commentary on inclusion and discrimination, the animals don't just come out in the city at night, they literally run it during the day."
Proceso," March 15, 2016",Fausto Ponce, A well balanced film with a powerful message and a great story. [Full review in Spanish]
"Mountain Xpress (Asheville, NC)"," March 13, 2016",Ken Hanke," Gorgeous to look at, clever, funny and with a solid and atmospheric mystery at its core. But there's more here in the film's timely and relevant thematic content."
Thrillist," March 11, 2016",Matt Patches, Impressionable kids and adults who swear they're progressive will both take something away from Zootopia.
New York Post," March 10, 2016",Lou Lumenick, Zootopia excels on so many levels that it stands with the finest of the Disney classics.
Tijuaneo," March 9, 2016",Cuauhtémoc Ruelas," Not many animated films give adults, teenagers and adults something to enjoy and that doesn't fall into the dumb humor territory. [Full review in Spanish]"
John Hanlon Reviews," March 9, 2016",John Hanlon," Reminiscent of ""Toy Story"" in its ability to create a wonderfully colorful world of its own, ""Zootopia"" is a fun film with undeniably important themes about diversity, inclusion and self-worth. "
Spirituality and Practice," March 8, 2016",Frederic and Mary Ann Brussat, A spunky 3-D animated film about a bunny whose life is energized by big dreams and rock-solid optimism.
Reforma," March 7, 2016",Edgardo Reséndiz," It is complex, different, thinking, technically flawless and definitely a fun Disney product that works the same for children and adults. [Full review in Spanish]"
Reforma," March 7, 2016",Eduardo Molina," By using animation the movie gives a snapshot of the problems of intolerance that live in the world, without leaving aside the humor. [Full review in Spanish]"
Examiner.com," March 7, 2016",Chris Sawin, The film is visually spectacular with gorgeous backgrounds and intricate textures on mammals so realistic that you'll want to try and pet them while watching the film. Zootopia is vividly creative and fantastically amusing for all ages. 
The Sun (UK)," March 24, 2016",Alex Zane, The voice cast is perfect - especially Bateman - and there are some cracking action scenes too. Superb family film.
Sky Movies," March 24, 2016",Tim Evans, An animated outing that propels Disney's historical success at anthropomorphisation to new heights.
Guardian," March 24, 2016",Wendy Ide, The animation is first rate - fur is rendered so realistically that it could trigger an allergy at 50 paces - but it is the writing that elevates the picture.
FILMINK (Australia)," March 24, 2016",Erin Free," There's rarely been so much sub in the text of an animated movie, and while it makes Zootopia a surprisingly thought provoking experience, there's also something slightly disconcerting about Disney's willingness to so keenly embrace adult themes."
Times (UK)," March 24, 2016",Kevin Maher," There's a magical moment in every movie of quality, a reciprocal bond between screen and viewer, where your shoulders happily drop, you sink deeper into your seat and your soul secretly smiles because it knows that you are in the safest of hands."
International Business Times," March 24, 2016",Amy West, It's easy to see why the studio is back at the top of its game and proves its still the master of producing films both children and adults will engage with.
Indie London," March 24, 2016",Rob Carnevale," For the young and innocent minded, there's plenty of knockabout fun and slapstick humour to enjoy, coupled with a timely message about tolerance and integration, while pop culture references abound for adults and film fans to savour. "
Empire Magazine," March 24, 2016",John Nugent," The fictional universe it presents - a human-free world where mammals have evolved into a bustling, civilised society - is vividly realised, richly detailed and very funny."
Daily Telegraph (UK)," March 24, 2016",Robbie Collin," One of the film's great strengths is the trust it puts in its young audience to decode its complex, nuanced message about the value of difference."
Flick Filosopher," March 24, 2016",MaryAnn Johanson, Marvelous. A bouncy comedy mystery adventure parable in a fantasy world meticulously and cleverly conceived and gorgeously realized. I adore this movie.
Rip It Up," March 23, 2016",David 'Mad Dog' Bradley," This has enough light wit and gooey sentiment for Disney groupies, and yet it does leave many unanswered questions."
MetroActive," March 23, 2016",Richard von Busack," It acknowledges problems that no bumper-sticker can patch over, and yet it leaves room for an exploration of a seriously charming world."
Fan The Fire," March 23, 2016",Martin Roberts," The voice cast are all on enjoyable form, and the storyline, once it kicks into gear, is not simply a vehicle for the message of the film, but an enjoyable caper in its own right, full of motion and invention."
Financial Times," March 23, 2016",Nigel Andrews," Just relish the zingy jokes and in-jokes; a slow-burn dialogue scene with sloths that's an instant classic; the elastic character animation; and the pacy, racy disrespect for PC of all hues and flavours."
HeyUGuys," March 23, 2016",Stefan Pape," Directors Byron Howard and Rich Moore have crafted this environment in a meticulous fashion, with a striking attention to detail, painting a comprehensive picture of this universe we're inhabiting."
Cinema em Cena," March 21, 2016",Pablo Villaça," The film gracefully deals with the contradiction between what we feel, who we are and what we let other people see. [Full review in Portuguese.]"
Irish Independent," March 21, 2016",Paul Whitington," Zootropolis takes the form of a jovial noir thriller, is nicely voiced by the likes of Jason Bateman and Ginnifer Goodwin and should go down very well with the smaller viewer."
Sunday Independent (Ireland)," March 21, 2016",Aine O'Connor, Bright and mostly brilliant.
Total Film," March 21, 2016",Neil Smith," No instant Disney classic, but a fast and furry-ious caper with endless gags, a fizzy fox-bunny double act and Shakira as a singing gazelle."
ReviewExpress.com," March 20, 2016",Jean Lowerison, It's a delight. Don't miss it.
FilmGamed," April 4, 2016",Mahmoud Mahdy," Zootopia is the best Disney animated movie, either with Pixar or without it, since Toy Story 3 in 2010."
Urban Cinefile," April 3, 2016",Andrew L. Urban," It's a bunny movie ... sorry, a buddy movie ... in family-fun land, where the rookie cop (a bunny) has to team up with a small-time crim (a fox) to track down bigger crooks. Anthropomorphic as it is, there is plenty of innocent fun"
Urban Cinefile," April 3, 2016",Louise Keller, It's a gorgeous film beautifully executed with a story that will have you smiling throughout. Don't miss it!
4:3," April 3, 2016",Dominic Barlow," Zootopia, like its protagonist, walks blissfully into a jungle of discourse it has precious little chance of surviving."
LarsenOnFilm," April 2, 2016",Josh Larsen, Done with creativity and wit ... but still has the stridency of a lesson plan.
Cinemaphile.org," April 1, 2016",David Keyes, How refreshing it is to see an animated movie that takes the initiative to climb above the restrictions of its formula.
Independent (UK)," April 1, 2016",Geoffrey Macnab, The genius of the film lies in its combination of traditional Disney characters and situations with a very subversive storytelling style. 
Contactmusic.com," April 1, 2016",Rich Cline," The filmmakers behind Tangled and Wreck-it Ralph join forces for this entertaining animated action comedy, which has clearly been planned as a franchise-launcher."
TheShiznit.co.uk," March 31, 2016",Ali Gray, It is its own cinematic zooniverse.
eFilmCritic.com," March 29, 2016",Peter Sobczynski, You may be taken aback by just how good it really is.
MovieCrypt.com," March 29, 2016",Kevin A. Ranson, ...manages an incredible balancing act having fun with their high concept while taking nothing away from the seriousness of their story. Prejudice 101 - for kids of all ages.
Cairo360," March 28, 2016",Marija Loncarevic," Clever, funny and refreshingly bold, its message is endearing and engaging, without falling into sentimentality."
Scotsman," March 27, 2016",Alistair Harkness," A pretty sophisticated meditation on race relations dressed up as a delightfully entertaining, gag-packed and inventively plotted police procedural."
London Evening Standard," March 27, 2016",Charlotte O'Sullivan, The film feels like a riposte to Trump-ism. It also contains some of the best sloth-related humour you will ever see.
Daily Mirror (UK)," March 27, 2016",David Edwards," Here's a great-looking, emotionally engaging and enormously entertaining movie guaranteed to delight kids and adults alike."
Daily Express (UK)," March 27, 2016",Allan Hunter, The latest Disney animated feature may not be a classic but it is full of bright ideas and funny one-liners.
Daily Express (UK)," March 27, 2016",Henry Fitzherbert, The friendship between predator and prey stands as a powerful rebuke to Donald Trump.
Observer (UK)," March 27, 2016",Mark Kermode, An encouragingly upbeat celebration of love and diversity in times of hate and uncertainty.
Film Freak Central," March 26, 2016",Walter Chaw," The illness in our society comes from the artificial stratification, and defensive denial, of original difference. "
Movie Talk," March 25, 2016",Jason Best, Cute and clever in equal measure.
